id,idx,start,end,text,genre
irHjw4H3OvI,762,1223.789,1223.799,shoot JJ up JJ I think I'm running back,4
irHjw4H3OvI,763,1223.799,1230.33,shoot JJ up JJ I think I'm running backkinda with that oh my fuck,4
irHjw4H3OvI,764,1230.33,1230.34,kinda with that oh my fuck,4
irHjw4H3OvI,765,1230.34,1233.18,kinda with that oh my fuckso when I was at you oh my god it's,4
irHjw4H3OvI,766,1233.18,1233.19,so when I was at you oh my god it's,4
irHjw4H3OvI,767,1233.19,1235.039,so when I was at you oh my god it'salready here oh my god oh my just know,4
irHjw4H3OvI,768,1235.039,1235.049,already here oh my god oh my just know,4
irHjw4H3OvI,769,1235.049,1237.32,already here oh my god oh my just knowit as I I touch the load I will heal I,4
irHjw4H3OvI,770,1237.32,1237.33,it as I I touch the load I will heal I,4
irHjw4H3OvI,771,1237.33,1239.779,it as I I touch the load I will heal Icame I saw JJ go I could just so guys,4
irHjw4H3OvI,772,1239.779,1239.789,came I saw JJ go I could just so guys,4
irHjw4H3OvI,773,1239.789,1242.84,came I saw JJ go I could just so guysknow is that when I said one thing I,4
irHjw4H3OvI,774,1242.84,1242.85,know is that when I said one thing I,4
irHjw4H3OvI,775,1242.85,1243.289,know is that when I said one thing Itired,4
irHjw4H3OvI,776,1243.289,1243.299,tired,4
irHjw4H3OvI,777,1243.299,1245.4189999999999,tiredI was kind of meaning like we don't slow,4
irHjw4H3OvI,778,1245.4189999999999,1245.4289999999999,I was kind of meaning like we don't slow,4
irHjw4H3OvI,779,1245.4289999999999,1247.279,I was kind of meaning like we don't slowleave not shoot the plane but you know I,4
irHjw4H3OvI,780,1247.279,1247.289,leave not shoot the plane but you know I,4
irHjw4H3OvI,781,1247.289,1248.779,leave not shoot the plane but you know Ienjoy it,4
irHjw4H3OvI,782,1248.779,1248.789,enjoy it,4
irHjw4H3OvI,783,1248.789,1254.299,enjoy itJJ do we shoot the plane yes touch it,4
irHjw4H3OvI,784,1254.299,1254.309,JJ do we shoot the plane yes touch it,4
irHjw4H3OvI,785,1254.309,1258.56,JJ do we shoot the plane yes touch itwas sabotage oh fuck oh yeah I fired my,4
irHjw4H3OvI,786,1258.56,1258.57,was sabotage oh fuck oh yeah I fired my,4
irHjw4H3OvI,787,1258.57,1262.7,was sabotage oh fuck oh yeah I fired mywhat yeah yeah JJ what you thinking,4
irHjw4H3OvI,788,1262.7,1262.71,what yeah yeah JJ what you thinking,4
irHjw4H3OvI,789,1262.71,1266.45,what yeah yeah JJ what you thinkingabout just bun it yeah they're just fuck,4
irHjw4H3OvI,790,1266.45,1266.46,about just bun it yeah they're just fuck,4
irHjw4H3OvI,791,1266.46,1270.95,about just bun it yeah they're just fuckyou no no I insist you son no JJ I want,4
irHjw4H3OvI,792,1270.95,1270.96,you no no I insist you son no JJ I want,4
irHjw4H3OvI,793,1270.96,1272.96,you no no I insist you son no JJ I wantyou to know not only guys guys I do have,4
irHjw4H3OvI,794,1272.96,1272.97,you to know not only guys guys I do have,4
irHjw4H3OvI,795,1272.97,1274.82,you to know not only guys guys I do haveapplied on take your time,4
irHjw4H3OvI,796,1274.82,1274.83,applied on take your time,4
irHjw4H3OvI,797,1274.83,1277.549,applied on take your time100 games of rock-paper-scissors yeah,4
irHjw4H3OvI,798,1277.549,1277.559,100 games of rock-paper-scissors yeah,4
irHjw4H3OvI,799,1277.559,1281.6589999999999,100 games of rock-paper-scissors yeahyeah best of best of 99 a do any range a,4
irHjw4H3OvI,800,1281.6589999999999,1281.6689999999999,yeah best of best of 99 a do any range a,4
irHjw4H3OvI,801,1281.6689999999999,1283.34,yeah best of best of 99 a do any range aday 3 2 1 and then roll purposes we,4
irHjw4H3OvI,802,1283.34,1283.35,day 3 2 1 and then roll purposes we,4
irHjw4H3OvI,803,1283.35,1288.95,day 3 2 1 and then roll purposes wedon't go oh boy it's gone oh no both,4
irHjw4H3OvI,804,1288.95,1288.96,don't go oh boy it's gone oh no both,4
irHjw4H3OvI,805,1288.96,1291.649,don't go oh boy it's gone oh no bothaiming in it Oh coming no that's fine,4
irHjw4H3OvI,806,1291.649,1291.6589999999999,aiming in it Oh coming no that's fine,4
irHjw4H3OvI,807,1291.6589999999999,1294.2,aiming in it Oh coming no that's fineI'm running back fuck it fuck fuck fuck,4
irHjw4H3OvI,808,1294.2,1294.21,I'm running back fuck it fuck fuck fuck,4
irHjw4H3OvI,809,1294.21,1300.32,I'm running back fuck it fuck fuck fuckfuck fuck oh ok ok the dice fun,4
irHjw4H3OvI,810,1300.32,1300.33,fuck fuck oh ok ok the dice fun,4
irHjw4H3OvI,811,1300.33,1302.87,fuck fuck oh ok ok the dice funI'm gonna see who's gonna die ugly no,4
irHjw4H3OvI,812,1302.87,1302.88,I'm gonna see who's gonna die ugly no,4
irHjw4H3OvI,813,1302.88,1306.019,I'm gonna see who's gonna die ugly noright no go get our bed josh is dead,4
irHjw4H3OvI,814,1306.019,1306.029,right no go get our bed josh is dead,4
irHjw4H3OvI,815,1306.029,1308.69,right no go get our bed josh is deadrock say I didn't get hit a little funny,4
irHjw4H3OvI,816,1308.69,1308.7,rock say I didn't get hit a little funny,4
irHjw4H3OvI,817,1308.7,1309.32,rock say I didn't get hit a little funnything hit me,4
irHjw4H3OvI,818,1309.32,1309.33,thing hit me,4
irHjw4H3OvI,819,1309.33,1313.31,thing hit mehahaha Toby let's rage quit we got two,4
irHjw4H3OvI,820,1313.31,1313.32,hahaha Toby let's rage quit we got two,4
irHjw4H3OvI,821,1313.32,1317.269,hahaha Toby let's rage quit we got twoone oh why am i knowing of all oh your,4
irHjw4H3OvI,822,1317.269,1317.279,one oh why am i knowing of all oh your,4
irHjw4H3OvI,823,1317.279,1319.19,one oh why am i knowing of all oh yourage quit baby what say I made it plus,4
irHjw4H3OvI,824,1319.19,1319.2,age quit baby what say I made it plus,4
irHjw4H3OvI,825,1319.2,1325.85,age quit baby what say I made it pluseverything I literally dodged every fine,4
irHjw4H3OvI,826,1325.85,1325.86,everything I literally dodged every fine,4
irHjw4H3OvI,827,1325.86,1327.47,everything I literally dodged every finetell you not like excuses we know you,4
irHjw4H3OvI,828,1327.47,1327.48,tell you not like excuses we know you,4
irHjw4H3OvI,829,1327.48,1328.22,tell you not like excuses we know yourage quit,4
irHjw4H3OvI,830,1328.22,1328.23,rage quit,4
irHjw4H3OvI,831,1328.23,1331.58,rage quitI actually just touched everything,4
j8vdqJnCq8I,1,1.07,12.85,are you fucking prick give me something,4
j8vdqJnCq8I,3,12.86,32.479,nice,4
j8vdqJnCq8I,5,32.489000000000004,44.81,yes I have good is hacking how good a,4
j8vdqJnCq8I,6,44.81,44.82,yes I have good is hacking how good a,4
j8vdqJnCq8I,7,44.82,55.01,yes I have good is hacking how good ahacks oh you say that one too did I kill,4
j8vdqJnCq8I,8,55.01,55.02,hacks oh you say that one too did I kill,4
j8vdqJnCq8I,9,55.02,83.149,hacks oh you say that one too did I killyour entire squad one more where is he,4
j8vdqJnCq8I,11,83.15899999999998,87.02,ah this one got me Jesus Oh was that,4
j8vdqJnCq8I,12,87.02,87.03,ah this one got me Jesus Oh was that,4
j8vdqJnCq8I,13,87.03,88.179,ah this one got me Jesus Oh was thatyour buddy,4
j8vdqJnCq8I,14,88.179,88.189,your buddy,4
j8vdqJnCq8I,15,88.189,118.46,your buddyyeah I'm dead dead actually died I can,4
j8vdqJnCq8I,16,118.46,118.47,yeah I'm dead dead actually died I can,4
j8vdqJnCq8I,17,118.47,123.139,yeah I'm dead dead actually died I cantell tell them to stop shooting I'm,4
j8vdqJnCq8I,18,123.139,123.149,tell tell them to stop shooting I'm,4
j8vdqJnCq8I,19,123.149,124.969,tell tell them to stop shooting I'mdoing it I have a gun now,4
j8vdqJnCq8I,20,124.969,124.979,doing it I have a gun now,4
j8vdqJnCq8I,21,124.979,126.529,doing it I have a gun nowwell I'm not gonna shoot you and by,4
j8vdqJnCq8I,22,126.529,126.539,well I'm not gonna shoot you and by,4
j8vdqJnCq8I,23,126.539,164.59900000000005,well I'm not gonna shoot you and bymyself I'm coming up to you boy I'm,4
j8vdqJnCq8I,24,164.59900000000005,164.609,myself I'm coming up to you boy I'm,4
j8vdqJnCq8I,25,164.609,165.68,myself I'm coming up to you boy I'msorry I'm sorry,4
j8vdqJnCq8I,26,165.68,165.69,sorry I'm sorry,4
j8vdqJnCq8I,27,165.69,167.99,sorry I'm sorryyou shit you should let me live you know,4
j8vdqJnCq8I,28,167.99,168.0,you shit you should let me live you know,4
j8vdqJnCq8I,29,168.0,169.449,you shit you should let me live you knowI'm gonna go have fun,4
j8vdqJnCq8I,30,169.449,169.459,I'm gonna go have fun,4
j8vdqJnCq8I,31,169.459,176.24,I'm gonna go have funfucking appreciate it man,4
j8vdqJnCq8I,33,176.25,182.73,you smell like fish well I'm not you may,4
j8vdqJnCq8I,34,182.73,182.74,you smell like fish well I'm not you may,4
j8vdqJnCq8I,35,182.74,227.25,you smell like fish well I'm not you maynot hear you're nice thank you,4
j8vdqJnCq8I,37,227.26,234.64,[Music],4
j8vdqJnCq8I,39,234.65,236.52,[Music],4
j8vdqJnCq8I,40,236.52,236.53,[Music],4
j8vdqJnCq8I,41,236.53,253.95,[Music]fuck you fuck your father hey fuck you,4
j8vdqJnCq8I,42,253.95,253.96,fuck you fuck your father hey fuck you,4
j8vdqJnCq8I,43,253.96,283.19,fuck you fuck your father hey fuck youI see there boy okay Oh,4
j8vdqJnCq8I,45,283.2,288.0,instead call me Dad whoa-ho who's this,4
j8vdqJnCq8I,46,288.0,288.01,instead call me Dad whoa-ho who's this,4
j8vdqJnCq8I,47,288.01,296.43,instead call me Dad whoa-ho who's thiswho's this backup hey hey hey hey yeah,4
j8vdqJnCq8I,48,296.43,296.44,who's this backup hey hey hey hey yeah,4
j8vdqJnCq8I,49,296.44,298.2,who's this backup hey hey hey hey yeahyeah good good just take it easy take it,4
j8vdqJnCq8I,50,298.2,298.21,yeah good good just take it easy take it,4
j8vdqJnCq8I,51,298.21,299.64,yeah good good just take it easy take iteasy what are you doing bro no no no no,4
j8vdqJnCq8I,52,299.64,299.65,easy what are you doing bro no no no no,4
j8vdqJnCq8I,53,299.65,302.72,easy what are you doing bro no no no nonone of that,4
j8vdqJnCq8I,55,302.73,306.84,oh hey,4
j8vdqJnCq8I,56,306.84,306.85,oh hey,4
j8vdqJnCq8I,57,306.85,314.67,oh heyloot me I've got a lot of loot did he,4
j8vdqJnCq8I,58,314.67,314.68,loot me I've got a lot of loot did he,4
j8vdqJnCq8I,59,314.68,324.11,loot me I've got a lot of loot did hejust kill himself you killed him a few,4
j8vdqJnCq8I,61,324.12,348.88,hello,4
j8vdqJnCq8I,63,348.89,365.649,[Music],4
loxyCaQWPLk,1,0.03,8.96,yes the suspicious be teeming bastards,4
loxyCaQWPLk,2,8.96,8.97,yes the suspicious be teeming bastards,4
loxyCaQWPLk,3,8.97,42.08,yes the suspicious be teeming bastardsbro or literally a duel you idiot dude,4
loxyCaQWPLk,4,42.08,42.09,bro or literally a duel you idiot dude,4
loxyCaQWPLk,5,42.09,43.28,bro or literally a duel you idiot dudeare you stupid,4
loxyCaQWPLk,6,43.28,43.29,are you stupid,4
loxyCaQWPLk,7,43.29,45.11,are you stupidcuz there's nothing outside from you are,4
loxyCaQWPLk,8,45.11,45.12,cuz there's nothing outside from you are,4
loxyCaQWPLk,9,45.12,50.028999999999996,cuz there's nothing outside from you areyou talking jackass oh yeah I can tell,4
loxyCaQWPLk,10,50.028999999999996,50.038999999999994,you talking jackass oh yeah I can tell,4
loxyCaQWPLk,11,50.038999999999994,51.888999999999996,you talking jackass oh yeah I can tellcause you're about to because you,4
loxyCaQWPLk,12,51.888999999999996,51.898999999999994,cause you're about to because you,4
loxyCaQWPLk,13,51.898999999999994,56.63,cause you're about to because youfucking I literally just run in my dude,4
loxyCaQWPLk,14,56.63,56.64,fucking I literally just run in my dude,4
loxyCaQWPLk,15,56.64,59.599,fucking I literally just run in my dudeI mean you're about you're drawn them to,4
loxyCaQWPLk,16,59.599,59.608999999999995,I mean you're about you're drawn them to,4
loxyCaQWPLk,17,59.608999999999995,66.62,I mean you're about you're drawn them toyou fuckin killed ya cuz I was fuckin,4
loxyCaQWPLk,18,66.62,66.63,you fuckin killed ya cuz I was fuckin,4
loxyCaQWPLk,19,66.63,69.71,you fuckin killed ya cuz I was fuckinoutta ammo from looking guys right now,4
loxyCaQWPLk,20,69.71,69.72,outta ammo from looking guys right now,4
loxyCaQWPLk,21,69.72,73.37,outta ammo from looking guys right nowsee you old Salty that's my dude yeah,4
loxyCaQWPLk,22,73.37,73.38,see you old Salty that's my dude yeah,4
loxyCaQWPLk,23,73.38,75.41,see you old Salty that's my dude yeahchoose your chairs you can't come up on,4
loxyCaQWPLk,24,75.41,75.42,choose your chairs you can't come up on,4
loxyCaQWPLk,25,75.42,77.179,choose your chairs you can't come up onme when I'm fuckin shooting somebody,4
loxyCaQWPLk,26,77.179,77.189,me when I'm fuckin shooting somebody,4
loxyCaQWPLk,27,77.189,81.2,me when I'm fuckin shooting somebodyelse huh I saw you I killed you man yeah,4
loxyCaQWPLk,28,81.2,81.21,else huh I saw you I killed you man yeah,4
loxyCaQWPLk,29,81.21,91.87,else huh I saw you I killed you man yeahexactly I didn't in the game,4
loxyCaQWPLk,31,91.88,94.789,are you fucking kidding me you'll flip,4
loxyCaQWPLk,32,94.789,94.79899999999999,are you fucking kidding me you'll flip,4
loxyCaQWPLk,33,94.79899999999999,96.469,are you fucking kidding me you'll flipdo you inhale you're actually terrible,4
loxyCaQWPLk,34,96.469,96.479,do you inhale you're actually terrible,4
loxyCaQWPLk,35,96.479,100.94,do you inhale you're actually terribleat this game fucking kill of India don't,4
loxyCaQWPLk,36,100.94,100.95,at this game fucking kill of India don't,4
loxyCaQWPLk,37,100.95,103.37,at this game fucking kill of India don'tcare do what do you mo you kill yourself,4
loxyCaQWPLk,38,103.37,103.38,care do what do you mo you kill yourself,4
loxyCaQWPLk,39,103.38,104.959,care do what do you mo you kill yourselfhello now you look fucking helmet on,4
loxyCaQWPLk,40,104.959,104.969,hello now you look fucking helmet on,4
loxyCaQWPLk,41,104.969,106.91,hello now you look fucking helmet onyeah keep tagging me hey I like that,4
loxyCaQWPLk,42,106.91,106.92,yeah keep tagging me hey I like that,4
loxyCaQWPLk,43,106.92,110.419,yeah keep tagging me hey I like thatshit I'm homosexual I wish my game,4
loxyCaQWPLk,44,110.419,110.429,shit I'm homosexual I wish my game,4
loxyCaQWPLk,45,110.429,112.069,shit I'm homosexual I wish my gamewasn't like give me massive frame drops,4
loxyCaQWPLk,46,112.069,112.079,wasn't like give me massive frame drops,4
loxyCaQWPLk,47,112.079,118.45,wasn't like give me massive frame dropsright now I don't see where they're at,4
loxyCaQWPLk,49,118.46,121.16,your fucking landlord - header you're,4
loxyCaQWPLk,50,121.16,121.17,your fucking landlord - header you're,4
loxyCaQWPLk,51,121.17,123.02,your fucking landlord - header you'resaying hey man that's not nice that's,4
loxyCaQWPLk,52,123.02,123.03,saying hey man that's not nice that's,4
loxyCaQWPLk,53,123.03,127.669,saying hey man that's not nice that'svery that's why cuz I downed you all you,4
loxyCaQWPLk,54,127.669,127.679,very that's why cuz I downed you all you,4
loxyCaQWPLk,55,127.679,129.97899999999998,very that's why cuz I downed you all youwere healing you're the one who came,4
loxyCaQWPLk,56,129.97899999999998,129.989,were healing you're the one who came,4
loxyCaQWPLk,57,129.989,137.36,were healing you're the one who cameover here little dude like like how my,4
loxyCaQWPLk,58,137.36,137.37,over here little dude like like how my,4
loxyCaQWPLk,59,137.37,138.38,over here little dude like like how mypower,4
loxyCaQWPLk,60,138.38,138.39,power,4
loxyCaQWPLk,61,138.39,140.36,powerhow am i faggot when you're the one that,4
loxyCaQWPLk,62,140.36,140.37,how am i faggot when you're the one that,4
loxyCaQWPLk,63,140.37,147.05,how am i faggot when you're the one thatdead are you talking to some guy like,4
loxyCaQWPLk,64,147.05,147.06,dead are you talking to some guy like,4
loxyCaQWPLk,65,147.06,149.27,dead are you talking to some guy likelook at that your teammates dead still,4
loxyCaQWPLk,66,149.27,149.28,look at that your teammates dead still,4
loxyCaQWPLk,67,149.28,170.3,look at that your teammates dead stillword you shotguns man I hit someone,4
loxyCaQWPLk,68,170.3,170.31,word you shotguns man I hit someone,4
loxyCaQWPLk,69,170.31,173.66,word you shotguns man I hit someonetwice with one last game fucking hits me,4
loxyCaQWPLk,70,173.66,173.67,twice with one last game fucking hits me,4
loxyCaQWPLk,71,173.67,175.03900000000004,twice with one last game fucking hits mein the head with the scar in one shots,4
loxyCaQWPLk,72,175.03900000000004,175.049,in the head with the scar in one shots,4
loxyCaQWPLk,73,175.049,175.49,in the head with the scar in one shotsme,4
loxyCaQWPLk,74,175.49,175.5,me,4
loxyCaQWPLk,75,175.5,179.21,meI hate shotguns they're so on somebody,4
loxyCaQWPLk,76,179.21,179.22,I hate shotguns they're so on somebody,4
loxyCaQWPLk,77,179.22,182.66,I hate shotguns they're so on somebodybuddy your fuck you I hope you lose I,4
loxyCaQWPLk,78,182.66,182.67,buddy your fuck you I hope you lose I,4
loxyCaQWPLk,79,182.67,185.38,buddy your fuck you I hope you lose Ilove you too,4
loxyCaQWPLk,80,185.38,185.39,love you too,4
loxyCaQWPLk,81,185.39,195.58900000000003,love you tooeat my ass hope your mother dies of,4
loxyCaQWPLk,82,195.58900000000003,195.59900000000002,eat my ass hope your mother dies of,4
loxyCaQWPLk,83,195.59900000000002,210.52,eat my ass hope your mother dies ofcancer off she dies of cancer from,4
loxyCaQWPLk,85,210.53,216.25900000000001,hacking but reacts yeah you want tell me,4
loxyCaQWPLk,86,216.25900000000001,216.269,hacking but reacts yeah you want tell me,4
loxyCaQWPLk,87,216.269,218.09,hacking but reacts yeah you want tell mewhy you have fun,4
loxyCaQWPLk,88,218.09,218.1,why you have fun,4
loxyCaQWPLk,89,218.1,223.05900000000003,why you have funtalk to me bitch check your earth cam oh,4
loxyCaQWPLk,90,223.05900000000003,223.06900000000002,talk to me bitch check your earth cam oh,4
loxyCaQWPLk,91,223.06900000000002,225.979,talk to me bitch check your earth cam ohyeah I'm watching bud and now all I see,4
loxyCaQWPLk,92,225.979,225.989,yeah I'm watching bud and now all I see,4
loxyCaQWPLk,93,225.989,228.02,yeah I'm watching bud and now all I seeis you hitting my headshots with little,4
loxyCaQWPLk,94,228.02,228.03,is you hitting my headshots with little,4
loxyCaQWPLk,95,228.03,231.85,is you hitting my headshots with littlethree humming tell me that explain it,4
loxyCaQWPLk,96,231.85,231.86,three humming tell me that explain it,4
loxyCaQWPLk,97,231.86,236.96,three humming tell me that explain itcome on bitch tell me all your little,4
loxyCaQWPLk,98,236.96,236.97,come on bitch tell me all your little,4
loxyCaQWPLk,99,236.97,238.49,come on bitch tell me all your littlepussy ass bitch to the hacks he isn't,4
loxyCaQWPLk,100,238.49,238.5,pussy ass bitch to the hacks he isn't,4
loxyCaQWPLk,101,238.5,251.75900000000001,pussy ass bitch to the hacks he isn'ttalk okay,4
loxyCaQWPLk,103,251.769,263.4,look at your fucking bullet holes faggot,4
loxyCaQWPLk,105,263.41,265.9,fucking barrel it sticks up your fucking,4
loxyCaQWPLk,106,265.9,265.91,fucking barrel it sticks up your fucking,4
loxyCaQWPLk,107,265.91,267.85,fucking barrel it sticks up your fuckingass you worthless fucking nigger are you,4
loxyCaQWPLk,108,267.85,267.86,ass you worthless fucking nigger are you,4
loxyCaQWPLk,109,267.86,287.16,ass you worthless fucking nigger are youmad cuz you suck,4
loxyCaQWPLk,111,287.17,292.54,[Music],4
loxyCaQWPLk,113,292.55,307.0,[Music],4
loxyCaQWPLk,115,307.01,310.4190000000001,change big as I fucking,4
nF-rEPvqHLw,1,19.25,20.75,one second please,4
nF-rEPvqHLw,2,20.75,20.76,one second please,4
nF-rEPvqHLw,3,20.76,23.06,one second pleaseI'm going to be speaking to the,4
nF-rEPvqHLw,4,23.06,23.07,I'm going to be speaking to the,4
nF-rEPvqHLw,5,23.07,24.65,I'm going to be speaking to thegentlemen out here you you can suck my,4
nF-rEPvqHLw,6,24.65,24.66,gentlemen out here you you can suck my,4
nF-rEPvqHLw,7,24.66,26.57,gentlemen out here you you can suck myfucking giant dick you little loser fuck,4
nF-rEPvqHLw,8,26.57,26.58,fucking giant dick you little loser fuck,4
nF-rEPvqHLw,9,26.58,28.04,fucking giant dick you little loser fuckboy I'm gonna fuck your mother I'm gonna,4
nF-rEPvqHLw,10,28.04,28.05,boy I'm gonna fuck your mother I'm gonna,4
nF-rEPvqHLw,11,28.05,29.39,boy I'm gonna fuck your mother I'm gonnafuck your sister I'm gonna fuck them all,4
nF-rEPvqHLw,12,29.39,29.4,fuck your sister I'm gonna fuck them all,4
nF-rEPvqHLw,13,29.4,30.74,fuck your sister I'm gonna fuck them alluntil they bleed from their assholes you,4
nF-rEPvqHLw,14,30.74,30.75,until they bleed from their assholes you,4
nF-rEPvqHLw,15,30.75,41.15,until they bleed from their assholes youpiece of fucking planning shit this,4
nF-rEPvqHLw,16,41.15,41.16,piece of fucking planning shit this,4
nF-rEPvqHLw,17,41.16,42.83,piece of fucking planning shit thisvideo is sponsored by coin Oh doh,4
nF-rEPvqHLw,18,42.83,42.84,video is sponsored by coin Oh doh,4
nF-rEPvqHLw,19,42.84,44.869,video is sponsored by coin Oh dohkwinto is a brand new and absolutely,4
nF-rEPvqHLw,20,44.869,44.879,kwinto is a brand new and absolutely,4
nF-rEPvqHLw,21,44.879,46.1,kwinto is a brand new and absolutelyunique way to get more out of your,4
nF-rEPvqHLw,22,46.1,46.11,unique way to get more out of your,4
nF-rEPvqHLw,23,46.11,48.11,unique way to get more out of yourgaming PC with coin Auto you can earn,4
nF-rEPvqHLw,24,48.11,48.12,gaming PC with coin Auto you can earn,4
nF-rEPvqHLw,25,48.12,50.299,gaming PC with coin Auto you can earnskins for games like pub G or csgo,4
nF-rEPvqHLw,26,50.299,50.309,skins for games like pub G or csgo,4
nF-rEPvqHLw,27,50.309,52.278999999999996,skins for games like pub G or csgowhile you're at work school or even,4
nF-rEPvqHLw,28,52.278999999999996,52.288999999999994,while you're at work school or even,4
nF-rEPvqHLw,29,52.288999999999994,54.47,while you're at work school or evensleeping so how can this work the Quinto,4
nF-rEPvqHLw,30,54.47,54.48,sleeping so how can this work the Quinto,4
nF-rEPvqHLw,31,54.48,56.15,sleeping so how can this work the Quintoclient Minds cryptocurrencies while,4
nF-rEPvqHLw,32,56.15,56.16,client Minds cryptocurrencies while,4
nF-rEPvqHLw,33,56.16,57.799,client Minds cryptocurrencies whileyou're afk and not using your powerful,4
nF-rEPvqHLw,34,57.799,57.809,you're afk and not using your powerful,4
nF-rEPvqHLw,35,57.809,59.9,you're afk and not using your powerfulgaming PC anyway in return you'll,4
nF-rEPvqHLw,36,59.9,59.91,gaming PC anyway in return you'll,4
nF-rEPvqHLw,37,59.91,61.099,gaming PC anyway in return you'llreceive skins for the game of your,4
nF-rEPvqHLw,38,61.099,61.108999999999995,receive skins for the game of your,4
nF-rEPvqHLw,39,61.108999999999995,62.81,receive skins for the game of yourchoice by doing absolutely nothing I,4
nF-rEPvqHLw,40,62.81,62.82,choice by doing absolutely nothing I,4
nF-rEPvqHLw,41,62.82,64.039,choice by doing absolutely nothing Ipersonally love coin arrow and I know,4
nF-rEPvqHLw,42,64.039,64.04899999999999,personally love coin arrow and I know,4
nF-rEPvqHLw,43,64.04899999999999,65.42,personally love coin arrow and I knowyou guys will as well so don't miss out,4
nF-rEPvqHLw,44,65.42,65.43,you guys will as well so don't miss out,4
nF-rEPvqHLw,45,65.43,66.89,you guys will as well so don't miss outgo check it out it's the first link in,4
nF-rEPvqHLw,46,66.89,66.9,go check it out it's the first link in,4
nF-rEPvqHLw,47,66.9,79.399,go check it out it's the first link inthe description you got owned oh my god,4
nF-rEPvqHLw,48,79.399,79.40899999999998,the description you got owned oh my god,4
nF-rEPvqHLw,49,79.40899999999998,80.6,the description you got owned oh my godyou fucking know skilled piece of,4
nF-rEPvqHLw,50,80.6,80.61,you fucking know skilled piece of,4
nF-rEPvqHLw,51,80.61,82.429,you fucking know skilled piece ofmotherfucking faggot fuck holy fucking,4
nF-rEPvqHLw,52,82.429,82.439,motherfucking faggot fuck holy fucking,4
nF-rEPvqHLw,53,82.439,83.749,motherfucking faggot fuck holy fuckingshit are you fuckin teaming or something,4
nF-rEPvqHLw,54,83.749,83.759,shit are you fuckin teaming or something,4
nF-rEPvqHLw,55,83.759,93.64,shit are you fuckin teaming or somethingyou fucking mother you're on stream yeah,4
nF-rEPvqHLw,56,93.64,93.65,you fucking mother you're on stream yeah,4
nF-rEPvqHLw,57,93.65,98.6,you fucking mother you're on stream yeahthank you retarded name it's the white,4
nF-rEPvqHLw,58,98.6,98.61,thank you retarded name it's the white,4
nF-rEPvqHLw,59,98.61,104.149,thank you retarded name it's the whiteturkey,4
nF-rEPvqHLw,61,104.15899999999999,126.0,oh my god my little girl,4
nF-rEPvqHLw,63,126.01,169.26,oh my god oh my god yeah yes you been,4
nF-rEPvqHLw,64,169.26,169.27,oh my god oh my god yeah yes you been,4
nF-rEPvqHLw,65,169.27,171.87,oh my god oh my god yeah yes you beenthere for fucking five minutes I cream,4
nF-rEPvqHLw,66,171.87,171.88,there for fucking five minutes I cream,4
nF-rEPvqHLw,67,171.88,175.74,there for fucking five minutes I creamcream less how worthless your fucking,4
nF-rEPvqHLw,68,175.74,175.75,cream less how worthless your fucking,4
nF-rEPvqHLw,69,175.75,178.11,cream less how worthless your fuckinglife is that you would take five minutes,4
nF-rEPvqHLw,70,178.11,178.12,life is that you would take five minutes,4
nF-rEPvqHLw,71,178.12,180.75,life is that you would take five minuteseach side a push do you see makes a,4
nF-rEPvqHLw,72,180.75,180.76,each side a push do you see makes a,4
nF-rEPvqHLw,73,180.76,194.55,each side a push do you see makes athousand dollar reward for the game do,4
nF-rEPvqHLw,74,194.55,194.56,thousand dollar reward for the game do,4
nF-rEPvqHLw,75,194.56,216.41,thousand dollar reward for the game doyou wanna take it to be hiding in a bush,4
nF-rEPvqHLw,77,216.42,220.02,how are these people is able to take it,4
nF-rEPvqHLw,78,220.02,220.03,how are these people is able to take it,4
nF-rEPvqHLw,79,220.03,231.81,how are these people is able to take itman,4
nF-rEPvqHLw,81,231.82,245.22,you're such a fucking pussy,4
nF-rEPvqHLw,83,245.23,259.47900000000004,GG hey calm it down boy I just got here,4
nF-rEPvqHLw,84,259.47900000000004,259.48900000000003,GG hey calm it down boy I just got here,4
nF-rEPvqHLw,85,259.48900000000003,268.56,GG hey calm it down boy I just got hereI'm a new I'm your new neighbor,4
