id,idx,start,end,text,genre
3tgZ6lSa0yE,1,0.0,3.71,mr. mine you say babe what's yeah first,0
3tgZ6lSa0yE,2,3.71,3.72,mr. mine you say babe what's yeah first,0
3tgZ6lSa0yE,3,3.72,22.79,mr. mine you say babe what's yeah firstof a dynamic punch get it good mr. line,0
3tgZ6lSa0yE,4,22.79,22.8,of a dynamic punch get it good mr. line,0
3tgZ6lSa0yE,5,22.8,28.4,of a dynamic punch get it good mr. lineyou'll get stronger glabra it's your,0
3tgZ6lSa0yE,6,28.4,28.41,you'll get stronger glabra it's your,0
3tgZ6lSa0yE,7,28.41,29.0,you'll get stronger glabra it's yourturn,0
3tgZ6lSa0yE,8,29.0,29.01,turn,0
3tgZ6lSa0yE,9,29.01,36.47,turnyes confusion Cobra Cobra Cobra term,0
3tgZ6lSa0yE,10,36.47,36.48,yes confusion Cobra Cobra Cobra term,0
3tgZ6lSa0yE,11,36.48,47.049,yes confusion Cobra Cobra Cobra termCobra,0
3tgZ6lSa0yE,13,47.059,49.85,who's that Pokemon,0
3tgZ6lSa0yE,14,49.85,49.86,who's that Pokemon,0
3tgZ6lSa0yE,15,49.86,52.27,who's that Pokemonit's a fucking big issue,0
3tgZ6lSa0yE,16,52.27,52.28,it's a fucking big issue,0
3tgZ6lSa0yE,17,52.28,57.318999999999996,it's a fucking big issue[Music],0
3tgZ6lSa0yE,19,57.32899999999999,60.349,get out brah you know what to do go go,0
3tgZ6lSa0yE,20,60.349,60.358999999999995,get out brah you know what to do go go,0
3tgZ6lSa0yE,21,60.358999999999995,83.66,get out brah you know what to do go gogo go oh this is my last chance I don't,0
3tgZ6lSa0yE,22,83.66,83.67,go go oh this is my last chance I don't,0
3tgZ6lSa0yE,23,83.67,86.51,go go oh this is my last chance I don'tknow if you can make it jewel shards are,0
3tgZ6lSa0yE,24,86.51,86.52,know if you can make it jewel shards are,0
3tgZ6lSa0yE,25,86.52,92.12,know if you can make it jewel shards areah yes,0
3tgZ6lSa0yE,26,92.12,92.13,ah yes,0
3tgZ6lSa0yE,27,92.13,104.18,ah yes$20 something,0
3tgZ6lSa0yE,29,104.19,106.21,[Music],0
3tgZ6lSa0yE,30,106.21,106.22,[Music],0
3tgZ6lSa0yE,31,106.22,111.35,[Music]we welcome to the Pokemon Center how can,0
3tgZ6lSa0yE,32,111.35,111.36,we welcome to the Pokemon Center how can,0
3tgZ6lSa0yE,33,111.36,114.08,we welcome to the Pokemon Center how canI help you fucking yeah stick him in a,0
3tgZ6lSa0yE,34,114.08,114.09,I help you fucking yeah stick him in a,0
3tgZ6lSa0yE,35,114.09,115.79,I help you fucking yeah stick him in amicrowave or something out of fucking,0
3tgZ6lSa0yE,36,115.79,115.8,microwave or something out of fucking,0
3tgZ6lSa0yE,37,115.8,117.29,microwave or something out of fuckingnow whatever you do just heal them and,0
3tgZ6lSa0yE,38,117.29,117.3,now whatever you do just heal them and,0
3tgZ6lSa0yE,39,117.3,123.48,now whatever you do just heal them andgive me some doughnuts while you addy,0
3tgZ6lSa0yE,41,123.49,133.09,[Music],0
3tgZ6lSa0yE,42,133.09,133.1,[Music],0
3tgZ6lSa0yE,43,133.1,135.16,[Music]you,0
Dq8j0PShAJc,1,5.39,20.929000000000002,it's me Mickey yeah yeah okay let's,0
Dq8j0PShAJc,2,20.929000000000002,20.939,it's me Mickey yeah yeah okay let's,0
Dq8j0PShAJc,3,20.939,29.2,it's me Mickey yeah yeah okay let'sfight at the football,0
Dq8j0PShAJc,5,29.21,85.45,okay oh really,0
Dq8j0PShAJc,7,85.46,89.84,cartoons not this portion Cartoon,0
Dq8j0PShAJc,8,89.84,89.85,cartoons not this portion Cartoon,0
Dq8j0PShAJc,9,89.85,92.83,cartoons not this portion CartoonNetwork shit I'm gonna beat you so hard,0
Dq8j0PShAJc,10,92.83,92.84,Network shit I'm gonna beat you so hard,0
Dq8j0PShAJc,11,92.84,95.09,Network shit I'm gonna beat you so hardthat Walt Disney is gonna have to,0
Dq8j0PShAJc,12,95.09,95.1,that Walt Disney is gonna have to,0
Dq8j0PShAJc,13,95.1,103.96,that Walt Disney is gonna have toreanimate you did you fuck Minnie yeah,0
Dq8j0PShAJc,15,103.97,107.6,you better be lying you better be lying,0
Dq8j0PShAJc,16,107.6,107.61,you better be lying you better be lying,0
Dq8j0PShAJc,17,107.61,114.289,you better be lying you better be lyingabout that did you seriously fuck my,0
Dq8j0PShAJc,18,114.289,114.29899999999999,about that did you seriously fuck my,0
Dq8j0PShAJc,19,114.29899999999999,118.6,about that did you seriously fuck myprincess Minnie Mouse yeah,0
Dq8j0PShAJc,20,118.6,118.61,princess Minnie Mouse yeah,0
Dq8j0PShAJc,21,118.61,121.15,princess Minnie Mouse yeah[Music],0
Dq8j0PShAJc,22,121.15,121.16,[Music],0
Dq8j0PShAJc,23,121.16,122.51,[Music][Applause],0
Dq8j0PShAJc,24,122.51,122.52,[Applause],0
Dq8j0PShAJc,25,122.52,126.41,[Applause]I am NOT okay I wanted to kick your ass,0
Dq8j0PShAJc,26,126.41,126.42,I am NOT okay I wanted to kick your ass,0
Dq8j0PShAJc,27,126.42,129.499,I am NOT okay I wanted to kick your assbut now I want to destroy your ass not,0
Dq8j0PShAJc,28,129.499,129.509,but now I want to destroy your ass not,0
Dq8j0PShAJc,29,129.509,132.38,but now I want to destroy your ass notsexually but physically I mean no I mean,0
Dq8j0PShAJc,30,132.38,132.39,sexually but physically I mean no I mean,0
Dq8j0PShAJc,31,132.39,136.43,sexually but physically I mean no I meanI mean in terms of fighting I want to,0
Dq8j0PShAJc,32,136.43,136.44,I mean in terms of fighting I want to,0
Dq8j0PShAJc,33,136.44,138.02,I mean in terms of fighting I want tokick your ass so hard that you won't,0
Dq8j0PShAJc,34,138.02,138.03,kick your ass so hard that you won't,0
Dq8j0PShAJc,35,138.03,142.12,kick your ass so hard that you won'tfeel anything again in a non-sexual way,0
Dq8j0PShAJc,36,142.12,142.13,feel anything again in a non-sexual way,0
Dq8j0PShAJc,37,142.13,146.47899999999996,feel anything again in a non-sexual wayokay that's it that's all you say okay,0
Dq8j0PShAJc,38,146.47899999999996,146.489,okay that's it that's all you say okay,0
Dq8j0PShAJc,39,146.489,149.66,okay that's it that's all you say okayyou fucking my mouth and you fuck my,0
Dq8j0PShAJc,40,149.66,149.67,you fucking my mouth and you fuck my,0
Dq8j0PShAJc,41,149.67,162.8,you fucking my mouth and you fuck myprincess you just say that's okay freak,0
Dq8j0PShAJc,42,162.8,162.81,princess you just say that's okay freak,0
Dq8j0PShAJc,43,162.81,163.94,princess you just say that's okay freakout of me,0
Dq8j0PShAJc,44,163.94,163.95,out of me,0
Dq8j0PShAJc,45,163.95,165.35,out of melet me know when you're done with that,0
Dq8j0PShAJc,46,165.35,165.36,let me know when you're done with that,0
Dq8j0PShAJc,47,165.36,168.02,let me know when you're done with thatyou're pulling orders so like I can pull,0
Dq8j0PShAJc,48,168.02,168.03,you're pulling orders so like I can pull,0
Dq8j0PShAJc,49,168.03,170.0,you're pulling orders so like I can pullup and kick your ass in front of all,0
Dq8j0PShAJc,50,170.0,170.01,up and kick your ass in front of all,0
Dq8j0PShAJc,51,170.01,173.75,up and kick your ass in front of allover everyone in Chipotle huh you're not,0
Dq8j0PShAJc,52,173.75,173.76,over everyone in Chipotle huh you're not,0
Dq8j0PShAJc,53,173.76,177.699,over everyone in Chipotle huh you're notat all a yes yo don't think I'm lyin I'm,0
Dq8j0PShAJc,54,177.699,177.709,at all a yes yo don't think I'm lyin I'm,0
Dq8j0PShAJc,55,177.709,179.96,at all a yes yo don't think I'm lyin I'mpulling up right now do you hear me,0
Dq8j0PShAJc,56,179.96,179.97,pulling up right now do you hear me,0
Dq8j0PShAJc,57,179.97,190.55,pulling up right now do you hear mehonking the horn yeah piece of shit did,0
Dq8j0PShAJc,58,190.55,190.56,honking the horn yeah piece of shit did,0
Dq8j0PShAJc,59,190.56,200.39,honking the horn yeah piece of shit didyou finish you to pull a burrito oh no,0
Dq8j0PShAJc,60,200.39,200.4,you finish you to pull a burrito oh no,0
Dq8j0PShAJc,61,200.4,203.36,you finish you to pull a burrito oh nobitch did you just call me did you just,0
Dq8j0PShAJc,62,203.36,203.37,bitch did you just call me did you just,0
Dq8j0PShAJc,63,203.37,215.92,bitch did you just call me did you justcall me the b-word from Quito birds -,0
Dq8j0PShAJc,64,215.92,215.93,call me the b-word from Quito birds -,0
Dq8j0PShAJc,65,215.93,219.14,call me the b-word from Quito birds -he's gonna give me a keyblade shove this,0
Dq8j0PShAJc,66,219.14,219.15,he's gonna give me a keyblade shove this,0
Dq8j0PShAJc,67,219.15,225.52,he's gonna give me a keyblade shove thisup your bubble roast your ass is so,0
Dq8j0PShAJc,68,225.52,225.53,up your bubble roast your ass is so,0
Dq8j0PShAJc,69,225.53,229.19,up your bubble roast your ass is sofinal fantasy shit oh oh that's it,0
Dq8j0PShAJc,70,229.19,229.2,final fantasy shit oh oh that's it,0
Dq8j0PShAJc,71,229.2,233.449,final fantasy shit oh oh that's ityou're making me on my own now huh you,0
Dq8j0PShAJc,72,233.449,233.459,you're making me on my own now huh you,0
Dq8j0PShAJc,73,233.459,234.229,you're making me on my own now huh youwanna see,0
Dq8j0PShAJc,74,234.229,234.239,wanna see,0
Dq8j0PShAJc,75,234.239,236.12,wanna seefuck your Mickey Mouse Clubhouse Mickey,0
Dq8j0PShAJc,76,236.12,236.13,fuck your Mickey Mouse Clubhouse Mickey,0
Dq8j0PShAJc,77,236.13,237.47,fuck your Mickey Mouse Clubhouse MickeyMouse you're about to see some killer,0
Dq8j0PShAJc,78,237.47,237.48,Mouse you're about to see some killer,0
Dq8j0PShAJc,79,237.48,239.96,Mouse you're about to see some killermarts three shit right here huh are you,0
Dq8j0PShAJc,80,239.96,239.97,marts three shit right here huh are you,0
Dq8j0PShAJc,81,239.97,242.3,marts three shit right here huh are youready are you fuckin ready for who are,0
Dq8j0PShAJc,82,242.3,242.31,ready are you fuckin ready for who are,0
Dq8j0PShAJc,83,242.31,247.729,ready are you fuckin ready for who areyou with right now oh shit oh fuck,0
Dq8j0PShAJc,84,247.729,247.739,you with right now oh shit oh fuck,0
Dq8j0PShAJc,85,247.739,249.949,you with right now oh shit oh fuckI'm sorry man I'm sorry oh did she hear,0
Dq8j0PShAJc,86,249.949,249.959,I'm sorry man I'm sorry oh did she hear,0
Dq8j0PShAJc,87,249.959,325.98,I'm sorry man I'm sorry oh did she heara new this conversation,0
Dq8j0PShAJc,89,325.99,329.409,you better find a flight ticket here cuz,0
Dq8j0PShAJc,90,329.409,329.4190000000001,you better find a flight ticket here cuz,0
Dq8j0PShAJc,91,329.4190000000001,331.629,you better find a flight ticket here cuzthis shit's gonna go live and it's gonna,0
Dq8j0PShAJc,92,331.629,331.639,this shit's gonna go live and it's gonna,0
Dq8j0PShAJc,93,331.639,342.61,this shit's gonna go live and it's gonnago on and that's it you've passed the,0
Dq8j0PShAJc,94,342.61,342.62,go on and that's it you've passed the,0
Dq8j0PShAJc,95,342.62,345.969,go on and that's it you've passed theline I'm gonna I'm gonna drive in my,0
Dq8j0PShAJc,96,345.969,345.97900000000016,line I'm gonna I'm gonna drive in my,0
Dq8j0PShAJc,97,345.97900000000016,347.95,line I'm gonna I'm gonna drive in mygummi ship right now and on the,0
Dq8j0PShAJc,98,347.95,347.96,gummi ship right now and on the,0
Dq8j0PShAJc,99,347.96,359.52,gummi ship right now and on thebutterfly please Donald and Goofy okay,0
Dq8j0PShAJc,101,359.53,361.99,all right guys so I'm pretty much done,0
Dq8j0PShAJc,102,361.99,362.0,all right guys so I'm pretty much done,0
Dq8j0PShAJc,103,362.0,364.24,all right guys so I'm pretty much donewith my Mickey Mouse prank calls if you,0
Dq8j0PShAJc,104,364.24,364.25,with my Mickey Mouse prank calls if you,0
Dq8j0PShAJc,105,364.25,366.37,with my Mickey Mouse prank calls if youhave any video ideas or stuff you want,0
Dq8j0PShAJc,106,366.37,366.38,have any video ideas or stuff you want,0
Dq8j0PShAJc,107,366.38,368.17,have any video ideas or stuff you wantme to do in future videos just leave a,0
Dq8j0PShAJc,108,368.17,368.18,me to do in future videos just leave a,0
Dq8j0PShAJc,109,368.18,371.29,me to do in future videos just leave acomment below and stay tuned for more,0
Dq8j0PShAJc,110,371.29,371.3,comment below and stay tuned for more,0
Dq8j0PShAJc,111,371.3,375.039,comment below and stay tuned for moredope john palma hyenas,0
Hvcx1wd9S8g,1,0.0,2.0,okay children let's start the day with a,0
Hvcx1wd9S8g,2,2.0,2.01,okay children let's start the day with a,0
Hvcx1wd9S8g,3,2.01,4.37,okay children let's start the day with afew new math problems what is five times,0
Hvcx1wd9S8g,4,4.37,4.38,few new math problems what is five times,0
Hvcx1wd9S8g,5,4.38,5.86,few new math problems what is five timestwo,0
Hvcx1wd9S8g,6,5.86,5.87,two,0
Hvcx1wd9S8g,7,5.87,8.66,twocome on children don't be shy just give,0
Hvcx1wd9S8g,8,8.66,8.67,come on children don't be shy just give,0
Hvcx1wd9S8g,9,8.67,9.68,come on children don't be shy just giveit your best shot,0
Hvcx1wd9S8g,10,9.68,9.69,it your best shot,0
Hvcx1wd9S8g,11,9.69,13.459000000000001,it your best shotyes Clyde well okay now let's try to get,0
Hvcx1wd9S8g,12,13.459000000000001,13.469000000000001,yes Clyde well okay now let's try to get,0
Hvcx1wd9S8g,13,13.469000000000001,14.749,yes Clyde well okay now let's try to getan answer from someone who's not a,0
Hvcx1wd9S8g,14,14.749,14.759,an answer from someone who's not a,0
Hvcx1wd9S8g,15,14.759,17.93,an answer from someone who's not acomplete retard anyone come on don't be,0
Hvcx1wd9S8g,16,17.93,17.94,complete retard anyone come on don't be,0
Hvcx1wd9S8g,17,17.94,19.64,complete retard anyone come on don't beshy I think I know the answer mr.,0
Hvcx1wd9S8g,18,19.64,19.65,shy I think I know the answer mr.,0
Hvcx1wd9S8g,19,19.65,23.509,shy I think I know the answer mr.garrison don't call me fat you fuckin,0
Hvcx1wd9S8g,20,23.509,23.519000000000002,garrison don't call me fat you fuckin,0
Hvcx1wd9S8g,21,23.519000000000002,26.779,garrison don't call me fat you fuckinJew Eric did you just say the F word Jew,0
Hvcx1wd9S8g,22,26.779,26.789,Jew Eric did you just say the F word Jew,0
Hvcx1wd9S8g,23,26.789,28.58,Jew Eric did you just say the F word Jewno he's not gonna fuck you can't say,0
Hvcx1wd9S8g,24,28.58,28.59,no he's not gonna fuck you can't say,0
Hvcx1wd9S8g,25,28.59,29.63,no he's not gonna fuck you can't sayfucking school you're fucking fat-ass,0
Hvcx1wd9S8g,26,29.63,29.64,fucking school you're fucking fat-ass,0
Hvcx1wd9S8g,27,29.64,30.91,fucking school you're fucking fat-assCarl,0
Hvcx1wd9S8g,28,30.91,30.92,Carl,0
Hvcx1wd9S8g,29,30.92,33.08,CarlEric dude you just said fuck against,0
Hvcx1wd9S8g,30,33.08,33.09,Eric dude you just said fuck against,0
Hvcx1wd9S8g,31,33.09,37.27,Eric dude you just said fuck againstfamily boom Kenny doesn't hurt anybody,0
Hvcx1wd9S8g,32,37.27,37.28,family boom Kenny doesn't hurt anybody,0
Hvcx1wd9S8g,33,37.28,39.619,family boom Kenny doesn't hurt anybodyhow would you like to go see the school,0
Hvcx1wd9S8g,34,39.619,39.629,how would you like to go see the school,0
Hvcx1wd9S8g,35,39.629,41.958999999999996,how would you like to go see the schoolcounselor how would you like to suck my,0
Hvcx1wd9S8g,36,41.958999999999996,41.968999999999994,counselor how would you like to suck my,0
Hvcx1wd9S8g,37,41.968999999999994,46.4,counselor how would you like to suck mybuzz what did you say I'm sorry I'm,0
Hvcx1wd9S8g,38,46.4,46.41,buzz what did you say I'm sorry I'm,0
Hvcx1wd9S8g,39,46.41,46.85,buzz what did you say I'm sorry I'msorry,0
Hvcx1wd9S8g,40,46.85,46.86,sorry,0
Hvcx1wd9S8g,41,46.86,58.398999999999994,sorryactually what I said was holy shit dude,0
JkIKl9XTF1A,1,0.0,2.149,yes we read here before the jinyu's come,0
JkIKl9XTF1A,2,2.149,2.1590000000000003,yes we read here before the jinyu's come,0
JkIKl9XTF1A,3,2.1590000000000003,4.849,yes we read here before the jinyu's comeon let's get this over with it what the,0
JkIKl9XTF1A,4,4.849,4.859,on let's get this over with it what the,0
JkIKl9XTF1A,5,4.859,6.888999999999999,on let's get this over with it what thehell are you two doing we don't think we,0
JkIKl9XTF1A,6,6.888999999999999,6.899,hell are you two doing we don't think we,0
JkIKl9XTF1A,7,6.899,7.76,hell are you two doing we don't think wecan trust you,0
JkIKl9XTF1A,8,7.76,7.77,can trust you,0
JkIKl9XTF1A,9,7.77,8.99,can trust youyou still haven't pledged your,0
JkIKl9XTF1A,10,8.99,9.0,you still haven't pledged your,0
JkIKl9XTF1A,11,9.0,11.03,you still haven't pledged yourallegiance to deep Freestar what are you,0
JkIKl9XTF1A,12,11.03,11.04,allegiance to deep Freestar what are you,0
JkIKl9XTF1A,13,11.04,12.95,allegiance to deep Freestar what are youdense the ginyu force could be here any,0
JkIKl9XTF1A,14,12.95,12.96,dense the ginyu force could be here any,0
JkIKl9XTF1A,15,12.96,14.39,dense the ginyu force could be here anysecond and then well I would you too,0
JkIKl9XTF1A,16,14.39,14.4,second and then well I would you too,0
JkIKl9XTF1A,17,14.4,20.06,second and then well I would you toohigh in you and then where son of a,0
JkIKl9XTF1A,18,20.06,20.07,high in you and then where son of a,0
JkIKl9XTF1A,19,20.07,22.04,high in you and then where son of adying Beast,0
JkIKl9XTF1A,20,22.04,22.05,dying Beast,0
JkIKl9XTF1A,21,22.05,24.41,dying Beastwhy the fuck is all this happening me,0
JkIKl9XTF1A,22,24.41,24.42,why the fuck is all this happening me,0
JkIKl9XTF1A,23,24.42,27.83,why the fuck is all this happening meJace please sorry kitten I'm scared that,0
JkIKl9XTF1A,24,27.83,27.84,Jace please sorry kitten I'm scared that,0
JkIKl9XTF1A,25,27.84,30.89,Jace please sorry kitten I'm scared thatin a bit chunky with a goddamn peg,0
JkIKl9XTF1A,26,30.89,30.9,in a bit chunky with a goddamn peg,0
JkIKl9XTF1A,27,30.9,34.13,in a bit chunky with a goddamn pegare you done son of a gum-chewing funk,0
JkIKl9XTF1A,28,34.13,34.14,are you done son of a gum-chewing funk,0
JkIKl9XTF1A,29,34.14,36.319,are you done son of a gum-chewing funkmonster why the fruit does all this,0
JkIKl9XTF1A,30,36.319,36.329,monster why the fruit does all this,0
JkIKl9XTF1A,31,36.329,38.99,monster why the fruit does all thisfunny stuff happened to me forget my,0
JkIKl9XTF1A,32,38.99,39.0,funny stuff happened to me forget my,0
JkIKl9XTF1A,33,39.0,41.69,funny stuff happened to me forget mylife always surrounded by miserable,0
JkIKl9XTF1A,34,41.69,41.7,life always surrounded by miserable,0
JkIKl9XTF1A,35,41.7,44.81,life always surrounded by miserablefailing clods like this whole world just,0
JkIKl9XTF1A,36,44.81,44.82,failing clods like this whole world just,0
JkIKl9XTF1A,37,44.82,47.54,failing clods like this whole world justlikes to bend me over and find me in the,0
JkIKl9XTF1A,38,47.54,47.55,likes to bend me over and find me in the,0
JkIKl9XTF1A,39,47.55,49.67,likes to bend me over and find me in theAlps like I'm some sort of schlock,0
JkIKl9XTF1A,40,49.67,49.68,Alps like I'm some sort of schlock,0
JkIKl9XTF1A,41,49.68,52.49,Alps like I'm some sort of schlockreceptacle well as far as I care these,0
JkIKl9XTF1A,42,52.49,52.5,receptacle well as far as I care these,0
JkIKl9XTF1A,43,52.5,55.068999999999996,receptacle well as far as I care thesemiserable cows can have a fancy barbecue,0
JkIKl9XTF1A,44,55.068999999999996,55.07899999999999,miserable cows can have a fancy barbecue,0
JkIKl9XTF1A,45,55.07899999999999,58.76,miserable cows can have a fancy barbecuewith a goddamn pig,0
L0JnM4MvhVc,1,34.9,37.87,back through the smoke of centuries when,0
L0JnM4MvhVc,2,37.87,37.88,back through the smoke of centuries when,0
L0JnM4MvhVc,3,37.88,39.97,back through the smoke of centuries whenColumbus first set foot on a new world,0
L0JnM4MvhVc,4,39.97,39.98,Columbus first set foot on a new world,0
L0JnM4MvhVc,5,39.98,44.23,Columbus first set foot on a new worldoh wow you smoke match,0
L0JnM4MvhVc,6,44.23,44.24,oh wow you smoke match,0
L0JnM4MvhVc,7,44.24,49.36,oh wow you smoke matchnatch,0
L0JnM4MvhVc,9,49.37,53.0,and so Columbus not only proved the,0
L0JnM4MvhVc,10,53.0,53.01,and so Columbus not only proved the,0
L0JnM4MvhVc,11,53.01,56.09,and so Columbus not only proved theworld was round but also firm and fully,0
L0JnM4MvhVc,12,56.09,56.1,world was round but also firm and fully,0
L0JnM4MvhVc,13,56.1,59.27,world was round but also firm and fullypacked smoking became a new heaven in,0
L0JnM4MvhVc,14,59.27,59.28,packed smoking became a new heaven in,0
L0JnM4MvhVc,15,59.28,70.21,packed smoking became a new heaven inthe old world yes sire,0
L0JnM4MvhVc,17,70.22,74.12,it got so man could face any test with a,0
L0JnM4MvhVc,18,74.12,74.13,it got so man could face any test with a,0
L0JnM4MvhVc,19,74.13,80.56,it got so man could face any test with acigarette in his mouth ready aim,0
L0JnM4MvhVc,21,80.57,83.56,it's a Phyllis Morrison,0
L0JnM4MvhVc,22,83.56,83.57,it's a Phyllis Morrison,0
L0JnM4MvhVc,23,83.57,85.88,it's a Phyllis Morrisonsmokers could read the handwriting on,0
L0JnM4MvhVc,24,85.88,85.89,smokers could read the handwriting on,0
L0JnM4MvhVc,25,85.89,89.33,smokers could read the handwriting onthe wall today they see the sky riding,0
L0JnM4MvhVc,26,89.33,89.34,the wall today they see the sky riding,0
L0JnM4MvhVc,27,89.34,97.46,the wall today they see the sky ridingin the air,0
L0JnM4MvhVc,29,97.47,99.8,the average man's habit of smoking,0
L0JnM4MvhVc,30,99.8,99.81,the average man's habit of smoking,0
L0JnM4MvhVc,31,99.81,102.17,the average man's habit of smokingleaves its marks deeply imprinted upon,0
L0JnM4MvhVc,32,102.17,102.18,leaves its marks deeply imprinted upon,0
L0JnM4MvhVc,33,102.18,105.31,leaves its marks deeply imprinted uponhis surroundings,0
L0JnM4MvhVc,35,105.32,108.4,with tobacco the smoker finds relaxation,0
L0JnM4MvhVc,36,108.4,108.41,with tobacco the smoker finds relaxation,0
L0JnM4MvhVc,37,108.41,119.59,with tobacco the smoker finds relaxationand contentment a constant companion in,0
L0JnM4MvhVc,38,119.59,119.6,and contentment a constant companion in,0
L0JnM4MvhVc,39,119.6,120.49,and contentment a constant companion inhis leisure hours,0
L0JnM4MvhVc,40,120.49,120.5,his leisure hours,0
L0JnM4MvhVc,41,120.5,127.43,his leisure hoursah that last puff before retiring,0
L0JnM4MvhVc,43,127.44,134.54,and that first drag on a rising it's,0
L0JnM4MvhVc,44,134.54,134.55,and that first drag on a rising it's,0
L0JnM4MvhVc,45,134.55,138.25,and that first drag on a rising it'smild fragrance for the morning shave,0
L0JnM4MvhVc,46,138.25,138.26,mild fragrance for the morning shave,0
L0JnM4MvhVc,47,138.26,143.59,mild fragrance for the morning shavethat cool inhale with coffee and toast a,0
L0JnM4MvhVc,48,143.59,143.6,that cool inhale with coffee and toast a,0
L0JnM4MvhVc,49,143.6,149.42,that cool inhale with coffee and toast afast exhale while leaving for work the,0
L0JnM4MvhVc,50,149.42,149.43,fast exhale while leaving for work the,0
L0JnM4MvhVc,51,149.43,154.4,fast exhale while leaving for work thesoothing pag to face the day's toil but,0
L0JnM4MvhVc,52,154.4,154.41,soothing pag to face the day's toil but,0
L0JnM4MvhVc,53,154.41,156.41,soothing pag to face the day's toil butsometimes because of the irritated eyes,0
L0JnM4MvhVc,54,156.41,156.42,sometimes because of the irritated eyes,0
L0JnM4MvhVc,55,156.42,159.14,sometimes because of the irritated eyestickling throat dry hack,0
L0JnM4MvhVc,56,159.14,159.15,tickling throat dry hack,0
L0JnM4MvhVc,57,159.15,163.91,tickling throat dry hackwheezing and the shortness of wind the,0
L0JnM4MvhVc,58,163.91,163.92,wheezing and the shortness of wind the,0
L0JnM4MvhVc,59,163.92,166.28,wheezing and the shortness of wind theinveterate smoker gets a strange desire,0
L0JnM4MvhVc,60,166.28,166.29,inveterate smoker gets a strange desire,0
L0JnM4MvhVc,61,166.29,173.08,inveterate smoker gets a strange desireto rid himself of the habit like quiet,0
L0JnM4MvhVc,63,173.09,207.74,where I feel better already,0
L0JnM4MvhVc,65,207.75,210.96,well George you've gone and done it,0
L0JnM4MvhVc,66,210.96,210.97,well George you've gone and done it,0
L0JnM4MvhVc,67,210.97,213.6,well George you've gone and done itI sure admire a guy that can quit,0
L0JnM4MvhVc,68,213.6,213.61,I sure admire a guy that can quit,0
L0JnM4MvhVc,69,213.61,217.02,I sure admire a guy that can quitsmoking like you can it ain't easy if it,0
L0JnM4MvhVc,70,217.02,217.03,smoking like you can it ain't easy if it,0
L0JnM4MvhVc,71,217.03,220.86,smoking like you can it ain't easy if itwas quit quitting giving up the habit,0
L0JnM4MvhVc,72,220.86,220.87,was quit quitting giving up the habit,0
L0JnM4MvhVc,73,220.87,224.31,was quit quitting giving up the habitchanged Keith's entire outlook hey,0
L0JnM4MvhVc,74,224.31,224.32,changed Keith's entire outlook hey,0
L0JnM4MvhVc,75,224.32,224.97,changed Keith's entire outlook heyGeorge,0
L0JnM4MvhVc,76,224.97,224.98,George,0
L0JnM4MvhVc,77,224.98,229.26,GeorgeI'm a father have a cigar whoa boy you,0
L0JnM4MvhVc,78,229.26,229.27,I'm a father have a cigar whoa boy you,0
L0JnM4MvhVc,79,229.27,236.79,I'm a father have a cigar whoa boy youcould smoke one I quit smoking for I,0
L0JnM4MvhVc,80,236.79,236.8,could smoke one I quit smoking for I,0
L0JnM4MvhVc,81,236.8,239.55,could smoke one I quit smoking for Ilike smoking I'm no quitter get a lot of,0
L0JnM4MvhVc,82,239.55,239.56,like smoking I'm no quitter get a lot of,0
L0JnM4MvhVc,83,239.56,241.89,like smoking I'm no quitter get a lot ofpleasure smoking I love smoking it's my,0
L0JnM4MvhVc,84,241.89,241.9,pleasure smoking I love smoking it's my,0
L0JnM4MvhVc,85,241.9,289.6,pleasure smoking I love smoking it's myhobby,0
L0JnM4MvhVc,87,289.61,308.019,a Glock Lika gone,0
L0JnM4MvhVc,89,308.029,314.449,smooth smooth and the little man wins a,0
L0JnM4MvhVc,90,314.449,314.459,smooth smooth and the little man wins a,0
L0JnM4MvhVc,91,314.459,345.26,smooth smooth and the little man wins abig cigar,0
L0JnM4MvhVc,93,345.27,353.52,Wow hey mister,0
L0JnM4MvhVc,94,353.52,353.53,Wow hey mister,0
L0JnM4MvhVc,95,353.53,357.39,Wow hey misteryou gotta see a my male lead rope,0
L0JnM4MvhVc,96,357.39,357.4,you gotta see a my male lead rope,0
L0JnM4MvhVc,97,357.4,358.559,you gotta see a my male lead ropeGeorge,0
L0JnM4MvhVc,98,358.559,358.569,George,0
L0JnM4MvhVc,99,358.569,362.119,Georgecigar who snuffer anything just anything,0
L0JnM4MvhVc,100,362.119,362.129,cigar who snuffer anything just anything,0
L0JnM4MvhVc,101,362.129,366.149,cigar who snuffer anything just anythingwhy of course my good man ever see God,0
L0JnM4MvhVc,102,366.149,366.159,why of course my good man ever see God,0
L0JnM4MvhVc,103,366.159,371.779,why of course my good man ever see Godwho thank you soon,0
L0JnM4MvhVc,105,371.789,376.86,give the smoker enough rope and he'll,0
