id,idx,start,end,text,genre
2oSGqlMe2yA,235,392.17,397.83,please I beg please please please pleasebro please shut up shut up man,4
2oSGqlMe2yA,236,397.83,397.84,bro please shut up shut up man,4
2oSGqlMe2yA,237,397.84,400.86,bro please shut up shut up manno it's not a great fucking thought we,4
2oSGqlMe2yA,238,400.86,400.87,no it's not a great fucking thought we,4
2oSGqlMe2yA,239,400.87,408.69,no it's not a great fucking thought weare once you have the correct method or,4
2oSGqlMe2yA,240,408.69,408.7,are once you have the correct method or,4
2oSGqlMe2yA,241,408.7,410.13,are once you have the correct method orthe correct equipment or just us,4
2oSGqlMe2yA,242,410.13,410.14,the correct equipment or just us,4
2oSGqlMe2yA,243,410.14,412.74,the correct equipment or just usspending enough time in that sense every,4
2oSGqlMe2yA,244,412.74,412.75,spending enough time in that sense every,4
2oSGqlMe2yA,245,412.75,415.14,spending enough time in that sense everypixelated obstacle and sexy hiking is,4
2oSGqlMe2yA,246,415.14,415.15,pixelated obstacle and sexy hiking is,4
2oSGqlMe2yA,247,415.15,434.85,pixelated obstacle and sexy hiking isreal,4
2oSGqlMe2yA,249,434.86,436.68,well I don't need to do this I don't,4
2oSGqlMe2yA,250,436.68,436.69,well I don't need to do this I don't,4
2oSGqlMe2yA,251,436.69,440.49,well I don't need to do this I don'tneed your fucking do this I'm bossing,4
2oSGqlMe2yA,252,440.49,440.5,need your fucking do this I'm bossing,4
2oSGqlMe2yA,253,440.5,443.1,need your fucking do this I'm bossingthis and then my mind starts poking and,4
2oSGqlMe2yA,254,443.1,443.11,this and then my mind starts poking and,4
2oSGqlMe2yA,255,443.11,445.41,this and then my mind starts poking andhe just fucks with my my psyche and and,4
2oSGqlMe2yA,256,445.41,445.42,he just fucks with my my psyche and and,4
2oSGqlMe2yA,257,445.42,447.18,he just fucks with my my psyche and andI don't know what to do and then I fuck,4
2oSGqlMe2yA,258,447.18,447.19,I don't know what to do and then I fuck,4
2oSGqlMe2yA,259,447.19,459.51,I don't know what to do and then I fuckup I'm in a good position anyway we're,4
2oSGqlMe2yA,260,459.51,459.52,up I'm in a good position anyway we're,4
2oSGqlMe2yA,261,459.52,460.83,up I'm in a good position anyway we'regood we're good were good were good,4
2oSGqlMe2yA,262,460.83,460.84,good we're good were good were good,4
2oSGqlMe2yA,263,460.84,462.36,good we're good were good were goodwe're good we're good we're good we're,4
2oSGqlMe2yA,264,462.36,462.37,we're good we're good we're good we're,4
2oSGqlMe2yA,265,462.37,464.55,we're good we're good we're good we'regood yeah we go there we go we're good,4
2oSGqlMe2yA,266,464.55,464.56,good yeah we go there we go we're good,4
2oSGqlMe2yA,267,464.56,465.06,good yeah we go there we go we're goodwe're good,4
2oSGqlMe2yA,268,465.06,465.07,we're good,4
2oSGqlMe2yA,269,465.07,468.36,we're gooduh-huh you know what I've got I've got,4
2oSGqlMe2yA,270,468.36,468.37,uh-huh you know what I've got I've got,4
2oSGqlMe2yA,271,468.37,479.22,uh-huh you know what I've got I've gotthe technique oh no no no no no you know,4
2oSGqlMe2yA,272,479.22,479.23,the technique oh no no no no no you know,4
2oSGqlMe2yA,273,479.23,482.28,the technique oh no no no no no you knowI wanted to be here I like this spot to,4
2oSGqlMe2yA,274,482.28,482.29,I wanted to be here I like this spot to,4
2oSGqlMe2yA,275,482.29,490.34,I wanted to be here I like this spot tobe honest I like this fucking I like,4
2oSGqlMe2yA,276,490.34,490.35,be honest I like this fucking I like,4
2oSGqlMe2yA,277,490.35,491.64,be honest I like this fucking I likespot,4
2oSGqlMe2yA,278,491.64,491.65,spot,4
2oSGqlMe2yA,279,491.65,500.25,spotoh I don't slap you fucking whose voice,4
2oSGqlMe2yA,280,500.25,500.26,oh I don't slap you fucking whose voice,4
2oSGqlMe2yA,281,500.26,502.77,oh I don't slap you fucking whose voiceis this I need to know because though I,4
2oSGqlMe2yA,282,502.77,502.78,is this I need to know because though I,4
2oSGqlMe2yA,283,502.78,504.84,is this I need to know because though Ihe's getting hey what's this game called,4
2oSGqlMe2yA,284,504.84,504.85,he's getting hey what's this game called,4
2oSGqlMe2yA,285,504.85,508.23,he's getting hey what's this game calledget over it cool voice Bennett funny,4
2oSGqlMe2yA,286,508.23,508.24,get over it cool voice Bennett funny,4
2oSGqlMe2yA,287,508.24,512.52,get over it cool voice Bennett funnycool he's the dude who make wop as well,4
2oSGqlMe2yA,288,512.52,512.53,cool he's the dude who make wop as well,4
2oSGqlMe2yA,289,512.53,514.14,cool he's the dude who make wop as wellyou just saw you know he's a fucking,4
2oSGqlMe2yA,290,514.14,514.15,you just saw you know he's a fucking,4
2oSGqlMe2yA,291,514.15,517.83,you just saw you know he's a fuckingpagan my man has Twitter yo yeah I cool,4
2oSGqlMe2yA,292,517.83,517.84,pagan my man has Twitter yo yeah I cool,4
2oSGqlMe2yA,293,517.84,522.93,pagan my man has Twitter yo yeah I coolI want you to @b f OD just at him saying,4
2oSGqlMe2yA,294,522.93,522.94,I want you to @b f OD just at him saying,4
2oSGqlMe2yA,295,522.94,526.41,I want you to @b f OD just at him sayingyour game getting over it is shit okay,4
2oSGqlMe2yA,296,526.41,526.42,your game getting over it is shit okay,4
2oSGqlMe2yA,297,526.42,529.77,your game getting over it is shit okayalso your voice is shit okay you're a,4
2oSGqlMe2yA,298,529.77,529.78,also your voice is shit okay you're a,4
2oSGqlMe2yA,299,529.78,532.95,also your voice is shit okay you're apagan he's just a dickhead like I can't,4
2oSGqlMe2yA,300,532.95,532.96,pagan he's just a dickhead like I can't,4
2oSGqlMe2yA,301,532.96,535.44,pagan he's just a dickhead like I can'tI don't ever normally do shit like this,4
2oSGqlMe2yA,302,535.44,535.45,I don't ever normally do shit like this,4
2oSGqlMe2yA,303,535.45,537.57,I don't ever normally do shit like thisbut I'm actually fucking I'm triggered,4
2oSGqlMe2yA,304,537.57,537.58,but I'm actually fucking I'm triggered,4
2oSGqlMe2yA,305,537.58,538.59,but I'm actually fucking I'm triggeredI'm fucking trigger,4
2oSGqlMe2yA,306,538.59,538.6,I'm fucking trigger,4
2oSGqlMe2yA,307,538.6,542.31,I'm fucking triggerdumb fucking game I'm just trying I just,4
2oSGqlMe2yA,308,542.31,542.32,dumb fucking game I'm just trying I just,4
2oSGqlMe2yA,309,542.32,544.38,dumb fucking game I'm just trying I justcan't do anything but I I get I make,4
2oSGqlMe2yA,310,544.38,544.39,can't do anything but I I get I make,4
2oSGqlMe2yA,311,544.39,545.7,can't do anything but I I get I makesick progress,4
2oSGqlMe2yA,312,545.7,545.71,sick progress,4
2oSGqlMe2yA,313,545.71,549.57,sick progressI do bit and then he starts shining Tom,4
2oSGqlMe2yA,314,549.57,549.58,I do bit and then he starts shining Tom,4
2oSGqlMe2yA,315,549.58,552.54,I do bit and then he starts shining Tomsit and pisses me off,4
2oSGqlMe2yA,316,552.54,552.55,sit and pisses me off,4
2oSGqlMe2yA,317,552.55,556.77,sit and pisses me offah whoa he's a troll he's trolling me,4
2oSGqlMe2yA,318,556.77,556.78,ah whoa he's a troll he's trolling me,4
2oSGqlMe2yA,319,556.78,558.96,ah whoa he's a troll he's trolling meman I can't why am I playing this game,4
2oSGqlMe2yA,320,558.96,558.97,man I can't why am I playing this game,4
2oSGqlMe2yA,321,558.97,559.59,man I can't why am I playing this gamebro,4
2oSGqlMe2yA,322,559.59,559.6,bro,4
2oSGqlMe2yA,323,559.6,561.06,broyou know you've got me a lonely person,4
2oSGqlMe2yA,324,561.06,561.07,you know you've got me a lonely person,4
2oSGqlMe2yA,325,561.07,563.16,you know you've got me a lonely personto make a game like this no friends and,4
2oSGqlMe2yA,326,563.16,563.17,to make a game like this no friends and,4
2oSGqlMe2yA,327,563.17,568.069,to make a game like this no friends andjust enjoy misery,4
2oSGqlMe2yA,329,568.0790000000002,570.629,see look the music Stockman bro,4
2oSGqlMe2yA,330,570.629,570.639,see look the music Stockman bro,4
2oSGqlMe2yA,331,570.639,573.629,see look the music Stockman bronot the music is helping fan the music,4
2oSGqlMe2yA,332,573.629,573.639,not the music is helping fan the music,4
2oSGqlMe2yA,333,573.639,587.16,not the music is helping fan the musicis helping it's helping fucking Buffett,4
2oSGqlMe2yA,334,587.16,587.17,is helping it's helping fucking Buffett,4
2oSGqlMe2yA,335,587.17,591.24,is helping it's helping fucking BuffettI can't be bothered why my it's fucking,4
2oSGqlMe2yA,336,591.24,591.25,I can't be bothered why my it's fucking,4
2oSGqlMe2yA,337,591.25,603.389,I can't be bothered why my it's fuckingtrash it's pure trash fucking hell,4
2oSGqlMe2yA,338,603.389,603.399,trash it's pure trash fucking hell,4
2oSGqlMe2yA,339,603.399,605.04,trash it's pure trash fucking hellwhat's the fucking point what's the,4
2oSGqlMe2yA,340,605.04,605.05,what's the fucking point what's the,4
2oSGqlMe2yA,341,605.05,639.269,what's the fucking point what's thefucking point shit game I had before,4
2oSGqlMe2yA,342,639.269,639.279,fucking point shit game I had before,4
2oSGqlMe2yA,343,639.279,652.889,fucking point shit game I had beforethat's the deal CS lewis trash trash get,4
2oSGqlMe2yA,344,652.889,652.899,that's the deal CS lewis trash trash get,4
2oSGqlMe2yA,345,652.899,655.53,that's the deal CS lewis trash trash getthat ass banned fuck that I calmed about,4
2oSGqlMe2yA,346,655.53,655.54,that ass banned fuck that I calmed about,4
2oSGqlMe2yA,347,655.54,657.689,that ass banned fuck that I calmed aboutit I'm done I'm done I'm done boy I,4
2oSGqlMe2yA,348,657.689,657.699,it I'm done I'm done I'm done boy I,4
2oSGqlMe2yA,349,657.699,659.85,it I'm done I'm done I'm done boy Ican't play this game if my mind is gonna,4
2oSGqlMe2yA,350,659.85,659.86,can't play this game if my mind is gonna,4
2oSGqlMe2yA,351,659.86,661.41,can't play this game if my mind is gonnabe talking every time I fail if I,4
2oSGqlMe2yA,352,661.41,661.42,be talking every time I fail if I,4
2oSGqlMe2yA,353,661.42,663.87,be talking every time I fail if Isucceed he talks if I barely talk oh,4
2oSGqlMe2yA,354,663.87,663.88,succeed he talks if I barely talk oh,4
2oSGqlMe2yA,355,663.88,679.2,succeed he talks if I barely talk ohshut up man it's so shit so shit oh fuck,4
2oSGqlMe2yA,357,679.21,691.51,[Music],4
2oSGqlMe2yA,358,691.51,691.52,[Music],4
2oSGqlMe2yA,359,691.52,695.24,[Music]No,4
2oSGqlMe2yA,361,695.25,701.299,[Music],4
4Ma3wcaYV8k,1,2.6289999999999996,8.27,Mario Oh what ma are you going out,4
4Ma3wcaYV8k,2,8.27,8.28,Mario Oh what ma are you going out,4
4Ma3wcaYV8k,3,8.28,11.06,Mario Oh what ma are you going outsweetie yeah I gotta save the princess,4
4Ma3wcaYV8k,4,11.06,11.07,sweetie yeah I gotta save the princess,4
4Ma3wcaYV8k,5,11.07,13.37,sweetie yeah I gotta save the princessma don't you be a dear and take your,4
4Ma3wcaYV8k,6,13.37,13.38,ma don't you be a dear and take your,4
4Ma3wcaYV8k,7,13.38,17.66,ma don't you be a dear and take yourbrother Luigi with you oh come on ma,4
4Ma3wcaYV8k,8,17.66,17.67,brother Luigi with you oh come on ma,4
4Ma3wcaYV8k,9,17.67,19.4,brother Luigi with you oh come on mahe's such a baby,4
4Ma3wcaYV8k,10,19.4,19.41,he's such a baby,4
4Ma3wcaYV8k,11,19.41,21.8,he's such a babyhe is not a baby you never know he could,4
4Ma3wcaYV8k,12,21.8,21.81,he is not a baby you never know he could,4
4Ma3wcaYV8k,13,21.81,23.63,he is not a baby you never know he couldhelp you fight that big dragon his name,4
4Ma3wcaYV8k,14,23.63,23.64,help you fight that big dragon his name,4
4Ma3wcaYV8k,15,23.64,26.15,help you fight that big dragon his nameis Bowser ma you don't know anything,4
4Ma3wcaYV8k,16,26.15,26.16,is Bowser ma you don't know anything,4
4Ma3wcaYV8k,17,26.16,28.64,is Bowser ma you don't know anythingabout what I do okay you don't get it I,4
4Ma3wcaYV8k,18,28.64,28.65,about what I do okay you don't get it I,4
4Ma3wcaYV8k,19,28.65,30.169,about what I do okay you don't get it Idon't see what the harm in taking him,4
4Ma3wcaYV8k,20,30.169,30.179000000000002,don't see what the harm in taking him,4
4Ma3wcaYV8k,21,30.179000000000002,31.97,don't see what the harm in taking himwould be he just wants to save the,4
4Ma3wcaYV8k,22,31.97,31.98,would be he just wants to save the,4
4Ma3wcaYV8k,23,31.98,32.87,would be he just wants to save theprincess chill,4
4Ma3wcaYV8k,24,32.87,32.88,princess chill,4
4Ma3wcaYV8k,25,32.88,34.7,princess chillhe's a fuckin doorbal everybody makes,4
4Ma3wcaYV8k,26,34.7,34.71,he's a fuckin doorbal everybody makes,4
4Ma3wcaYV8k,27,34.71,36.799,he's a fuckin doorbal everybody makesfun of him Mario you know I don't like,4
4Ma3wcaYV8k,28,36.799,36.809,fun of him Mario you know I don't like,4
4Ma3wcaYV8k,29,36.809,38.69,fun of him Mario you know I don't likethat language in this house I don't care,4
4Ma3wcaYV8k,30,38.69,38.7,that language in this house I don't care,4
4Ma3wcaYV8k,31,38.7,40.94,that language in this house I don't carehow many princesses you say I am still,4
4Ma3wcaYV8k,32,40.94,40.95,how many princesses you say I am still,4
4Ma3wcaYV8k,33,40.95,41.84,how many princesses you say I am stillyour mother,4
4Ma3wcaYV8k,34,41.84,41.85,your mother,4
4Ma3wcaYV8k,35,41.85,43.25,your mothernow take your brother with you this,4
4Ma3wcaYV8k,36,43.25,43.26,now take your brother with you this,4
4Ma3wcaYV8k,37,43.26,47.09,now take your brother with you thisisn't up for debate hmm come on Luigi,4
4Ma3wcaYV8k,38,47.09,47.1,isn't up for debate hmm come on Luigi,4
4Ma3wcaYV8k,39,47.1,60.41,isn't up for debate hmm come on Luigiyay I ain't gonna go on an adventure you,4
4Ma3wcaYV8k,40,60.41,60.42,yay I ain't gonna go on an adventure you,4
4Ma3wcaYV8k,41,60.42,63.138999999999996,yay I ain't gonna go on an adventure yougonna tell mom I was smoking no Mario,4
4Ma3wcaYV8k,42,63.138999999999996,63.148999999999994,gonna tell mom I was smoking no Mario,4
4Ma3wcaYV8k,43,63.148999999999994,65.359,gonna tell mom I was smoking no MarioI'm not they're gonna tell ya you better,4
4Ma3wcaYV8k,44,65.359,65.369,I'm not they're gonna tell ya you better,4
4Ma3wcaYV8k,45,65.369,67.52,I'm not they're gonna tell ya you betternot or I'll kick your ass anyway just,4
4Ma3wcaYV8k,46,67.52,67.53,not or I'll kick your ass anyway just,4
4Ma3wcaYV8k,47,67.53,69.289,not or I'll kick your ass anyway justkeep your mouth shut scrotes here come,4
4Ma3wcaYV8k,48,69.289,69.29899999999999,keep your mouth shut scrotes here come,4
4Ma3wcaYV8k,49,69.29899999999999,72.38,keep your mouth shut scrotes here comethe guys what's up dude okay why'd you,4
4Ma3wcaYV8k,50,72.38,72.39,the guys what's up dude okay why'd you,4
4Ma3wcaYV8k,51,72.39,74.63,the guys what's up dude okay why'd youbring the kid who's my mom's a fucking,4
4Ma3wcaYV8k,52,74.63,74.64,bring the kid who's my mom's a fucking,4
4Ma3wcaYV8k,53,74.64,76.88,bring the kid who's my mom's a fuckingidiot so what's on the agenda I'm,4
4Ma3wcaYV8k,54,76.88,76.89,idiot so what's on the agenda I'm,4
4Ma3wcaYV8k,55,76.89,78.23,idiot so what's on the agenda I'msupposed to get peach out of Bowser's,4
4Ma3wcaYV8k,56,78.23,78.24,supposed to get peach out of Bowser's,4
4Ma3wcaYV8k,57,78.24,79.429,supposed to get peach out of Bowser'sshithole but I'm probably gonna blow it,4
4Ma3wcaYV8k,58,79.429,79.439,shithole but I'm probably gonna blow it,4
4Ma3wcaYV8k,59,79.439,81.14,shithole but I'm probably gonna blow itoff I don't give enough of a fuck today,4
4Ma3wcaYV8k,60,81.14,81.15,off I don't give enough of a fuck today,4
4Ma3wcaYV8k,61,81.15,82.999,off I don't give enough of a fuck todayyou wanna jump the fence at the Country,4
4Ma3wcaYV8k,62,82.999,83.009,you wanna jump the fence at the Country,4
4Ma3wcaYV8k,63,83.009,84.859,you wanna jump the fence at the CountryClub and use the pool yeah we did that,4
4Ma3wcaYV8k,64,84.859,84.869,Club and use the pool yeah we did that,4
4Ma3wcaYV8k,65,84.869,86.69,Club and use the pool yeah we did thattwo days ago you want to go hanging out,4
4Ma3wcaYV8k,66,86.69,86.7,two days ago you want to go hanging out,4
4Ma3wcaYV8k,67,86.7,88.819,two days ago you want to go hanging outat Cody's house Oh Cody's a piece of,4
4Ma3wcaYV8k,68,88.819,88.829,at Cody's house Oh Cody's a piece of,4
4Ma3wcaYV8k,69,88.829,91.37,at Cody's house Oh Cody's a piece ofshit I am so tired of that asshole,4
4Ma3wcaYV8k,70,91.37,91.38,shit I am so tired of that asshole,4
4Ma3wcaYV8k,71,91.38,92.84,shit I am so tired of that assholecome on you guys I don't want to just,4
4Ma3wcaYV8k,72,92.84,92.85,come on you guys I don't want to just,4
4Ma3wcaYV8k,73,92.85,95.03,come on you guys I don't want to justfuck around today you know I want to do,4
4Ma3wcaYV8k,74,95.03,95.04,fuck around today you know I want to do,4
4Ma3wcaYV8k,75,95.04,104.929,fuck around today you know I want to dosomething,4
4Ma3wcaYV8k,77,104.939,107.49,hey you guys want to see something,4
4Ma3wcaYV8k,78,107.49,107.5,hey you guys want to see something,4
4Ma3wcaYV8k,79,107.5,109.09899999999999,hey you guys want to see somethingreally funny,4
4Ma3wcaYV8k,80,109.09899999999999,109.109,really funny,4
4Ma3wcaYV8k,81,109.109,111.929,really funnyI'm telling you scrote the princess is,4
4Ma3wcaYV8k,82,111.929,111.939,I'm telling you scrote the princess is,4
4Ma3wcaYV8k,83,111.939,113.819,I'm telling you scrote the princess isdown there you gotta jump into the pit,4
4Ma3wcaYV8k,84,113.819,113.829,down there you gotta jump into the pit,4
4Ma3wcaYV8k,85,113.829,115.919,down there you gotta jump into the pitto save her now you shut about the,4
4Ma3wcaYV8k,86,115.919,115.929,to save her now you shut about the,4
4Ma3wcaYV8k,87,115.929,118.559,to save her now you shut about thescenario and guess what else buddy she,4
4Ma3wcaYV8k,88,118.559,118.569,scenario and guess what else buddy she,4
4Ma3wcaYV8k,89,118.569,121.34899999999999,scenario and guess what else buddy shetold me she really wants to make out,4
4Ma3wcaYV8k,90,121.34899999999999,121.359,told me she really wants to make out,4
4Ma3wcaYV8k,91,121.359,126.569,told me she really wants to make outwith you oh boy don't worry princess,4
4Ma3wcaYV8k,92,126.569,126.579,with you oh boy don't worry princess,4
4Ma3wcaYV8k,93,126.579,135.75,with you oh boy don't worry princesshere comes a Luigi the son wants to be,4
4Ma3wcaYV8k,94,135.75,135.76,here comes a Luigi the son wants to be,4
4Ma3wcaYV8k,95,135.76,138.089,here comes a Luigi the son wants to beyour friend dude when it comes down give,4
4Ma3wcaYV8k,96,138.089,138.099,your friend dude when it comes down give,4
4Ma3wcaYV8k,97,138.099,149.85,your friend dude when it comes down giveit a high five don't worry dude the,4
4Ma3wcaYV8k,98,149.85,149.86,it a high five don't worry dude the,4
4Ma3wcaYV8k,99,149.86,152.25,it a high five don't worry dude thepurple mushrooms are the best ones they,4
4Ma3wcaYV8k,100,152.25,152.26,purple mushrooms are the best ones they,4
4Ma3wcaYV8k,101,152.26,188.5,purple mushrooms are the best ones theygive you super powers,4
4Ma3wcaYV8k,103,188.51,191.50900000000001,alright scrote the princesses definitely,4
4Ma3wcaYV8k,104,191.50900000000001,191.519,alright scrote the princesses definitely,4
4Ma3wcaYV8k,105,191.519,194.27,alright scrote the princesses definitelybehind this door Julio promise Amari Oh,4
4Ma3wcaYV8k,106,194.27,194.28,behind this door Julio promise Amari Oh,4
4Ma3wcaYV8k,107,194.28,215.83,behind this door Julio promise Amari OhLuigi please I would never lie to you,4
4Ma3wcaYV8k,109,215.84,218.42,I had an accident,4
4Ma3wcaYV8k,110,218.42,218.43,I had an accident,4
4Ma3wcaYV8k,111,218.43,221.05900000000003,I had an accidentoh geez did you piss yourself you,4
4Ma3wcaYV8k,112,221.05900000000003,221.06900000000002,oh geez did you piss yourself you,4
4Ma3wcaYV8k,113,221.06900000000002,222.25900000000001,oh geez did you piss yourself youdumbass geek,4
4Ma3wcaYV8k,114,222.25900000000001,222.269,dumbass geek,4
4Ma3wcaYV8k,115,222.269,224.56900000000002,dumbass geekalright guys I gotta take this baby home,4
4Ma3wcaYV8k,116,224.56900000000002,224.579,alright guys I gotta take this baby home,4
4Ma3wcaYV8k,117,224.579,226.67,alright guys I gotta take this baby homeso mommy can give him some clean under,4
4Ma3wcaYV8k,118,226.67,226.68,so mommy can give him some clean under,4
4Ma3wcaYV8k,119,226.68,228.47,so mommy can give him some clean underroof go figure,4
4Ma3wcaYV8k,120,228.47,228.48,roof go figure,4
4Ma3wcaYV8k,121,228.48,231.58900000000003,roof go figureanother day ruined by my annoying idiot,4
4Ma3wcaYV8k,122,231.58900000000003,231.59900000000002,another day ruined by my annoying idiot,4
4Ma3wcaYV8k,123,231.59900000000002,249.11,another day ruined by my annoying idiotbrother a nice one that guy is such a,4
4Ma3wcaYV8k,124,249.11,249.12,brother a nice one that guy is such a,4
4Ma3wcaYV8k,125,249.12,253.18,brother a nice one that guy is such aloser,4
4Ma3wcaYV8k,127,253.19,256.15,so what do you think kid you want to get,4
4Ma3wcaYV8k,128,256.15,256.16,so what do you think kid you want to get,4
4Ma3wcaYV8k,129,256.16,306.779,so what do you think kid you want to getreally fucked up oh okay my big boy,4
4Ma3wcaYV8k,131,306.789,310.149,for the last time MA I don't know where,4
4Ma3wcaYV8k,132,310.149,310.159,for the last time MA I don't know where,4
4Ma3wcaYV8k,133,310.159,322.54,for the last time MA I don't know wherehe is I told you he left with Daisy such,4
4Ma3wcaYV8k,134,322.54,322.55,he is I told you he left with Daisy such,4
4Ma3wcaYV8k,135,322.55,324.85,he is I told you he left with Daisy sucha sensitive boy ma wherever the little,4
4Ma3wcaYV8k,136,324.85,324.86,a sensitive boy ma wherever the little,4
4Ma3wcaYV8k,137,324.86,327.58,a sensitive boy ma wherever the littlescrote is I'm sure he's fine I should,4
4Ma3wcaYV8k,138,327.58,327.59,scrote is I'm sure he's fine I should,4
4Ma3wcaYV8k,139,327.59,328.779,scrote is I'm sure he's fine I shouldhave gotten him a cell phone I know,4
4Ma3wcaYV8k,140,328.779,328.789,have gotten him a cell phone I know,4
4Ma3wcaYV8k,141,328.789,329.89,have gotten him a cell phone I knowwhere she'd have gotten the cell phone,4
4Ma3wcaYV8k,142,329.89,329.9,where she'd have gotten the cell phone,4
4Ma3wcaYV8k,143,329.9,331.42,where she'd have gotten the cell phonewill the police be annoyed if I call,4
4Ma3wcaYV8k,144,331.42,331.43,will the police be annoyed if I call,4
4Ma3wcaYV8k,145,331.43,332.95,will the police be annoyed if I callthem again oh I wish your father was,4
4Ma3wcaYV8k,146,332.95,332.96,them again oh I wish your father was,4
4Ma3wcaYV8k,147,332.96,334.99,them again oh I wish your father washere he'd know what to do hey MA you,4
4Ma3wcaYV8k,148,334.99,335.0,here he'd know what to do hey MA you,4
4Ma3wcaYV8k,149,335.0,343.33,here he'd know what to do hey MA youknow it'll cheer you up oh geez,4
4Ma3wcaYV8k,150,343.33,343.34,know it'll cheer you up oh geez,4
4Ma3wcaYV8k,151,343.34,344.98,know it'll cheer you up oh geezwas it too much to ask that you brought,4
4Ma3wcaYV8k,152,344.98,344.99,was it too much to ask that you brought,4
4Ma3wcaYV8k,153,344.99,346.839,was it too much to ask that you broughtyour brother home with you for crying,4
4Ma3wcaYV8k,154,346.839,346.849,your brother home with you for crying,4
4Ma3wcaYV8k,155,346.849,348.64,your brother home with you for cryingout loud Mario he can't take care of,4
4Ma3wcaYV8k,156,348.64,348.65,out loud Mario he can't take care of,4
4Ma3wcaYV8k,157,348.65,351.159,out loud Mario he can't take care ofhimself he's only 35 hey someone's,4
4Ma3wcaYV8k,158,351.159,351.16900000000015,himself he's only 35 hey someone's,4
4Ma3wcaYV8k,159,351.16900000000015,353.2,himself he's only 35 hey someone'spulling up outside oh my goodness that,4
4Ma3wcaYV8k,160,353.2,353.21,pulling up outside oh my goodness that,4
4Ma3wcaYV8k,161,353.21,358.76,pulling up outside oh my goodness thatmight be him,4
4Ma3wcaYV8k,163,358.77,362.689,Luigi Luigi is that you for crying out,4
4Ma3wcaYV8k,164,362.689,362.699,Luigi Luigi is that you for crying out,4
4Ma3wcaYV8k,165,362.699,375.73,Luigi Luigi is that you for crying outloud,4
4Ma3wcaYV8k,167,375.74,383.48,WTF did I just watch hey guys it's max,4
4Ma3wcaYV8k,168,383.48,383.49,WTF did I just watch hey guys it's max,4
4Ma3wcaYV8k,169,383.49,385.01,WTF did I just watch hey guys it's maxjust wanted to let you know that if,4
4Ma3wcaYV8k,170,385.01,385.02,just wanted to let you know that if,4
4Ma3wcaYV8k,171,385.02,386.6,just wanted to let you know that ifyou'd like to watch my cartoons a full,4
4Ma3wcaYV8k,172,386.6,386.61,you'd like to watch my cartoons a full,4
4Ma3wcaYV8k,173,386.61,388.04,you'd like to watch my cartoons a fullweek before they're released on YouTube,4
4Ma3wcaYV8k,174,388.04,388.05,week before they're released on YouTube,4
4Ma3wcaYV8k,175,388.05,389.54,week before they're released on YouTubefollow me on Twitter or join the,4
4Ma3wcaYV8k,176,389.54,389.55,follow me on Twitter or join the,4
4Ma3wcaYV8k,177,389.55,391.19,follow me on Twitter or join theofficial Facebook group and you can do,4
4Ma3wcaYV8k,178,391.19,391.2,official Facebook group and you can do,4
4Ma3wcaYV8k,179,391.2,391.64,official Facebook group and you can dojust that,4
4Ma3wcaYV8k,180,391.64,391.65,just that,4
4Ma3wcaYV8k,181,391.65,393.5,just thatit really helps me out a lot so please,4
4Ma3wcaYV8k,182,393.5,393.51,it really helps me out a lot so please,4
4Ma3wcaYV8k,183,393.51,395.24,it really helps me out a lot so pleaseconsider joining this cartoon was,4
4Ma3wcaYV8k,184,395.24,395.25,consider joining this cartoon was,4
4Ma3wcaYV8k,185,395.25,396.95,consider joining this cartoon waswritten and animated by me and featured,4
4Ma3wcaYV8k,186,396.95,396.96,written and animated by me and featured,4
4Ma3wcaYV8k,187,396.96,398.69,written and animated by me and featuredthe voices of Keira Buckland Monica,4
4Ma3wcaYV8k,188,398.69,398.7,the voices of Keira Buckland Monica,4
4Ma3wcaYV8k,189,398.7,400.79,the voices of Keira Buckland MonicaFranco and myself special thanks to yo,4
4Ma3wcaYV8k,190,400.79,400.8,Franco and myself special thanks to yo,4
4Ma3wcaYV8k,191,400.8,403.13,Franco and myself special thanks to yoTom peril and Alexander gross this video,4
4Ma3wcaYV8k,192,403.13,403.14,Tom peril and Alexander gross this video,4
