id,start,end,text
L0JnM4MvhVc,149420000,149430000,fast exhale while leaving for work the
L0JnM4MvhVc,149430000,154400000,fast exhale while leaving for work the soothing pag to face the day's toil but
L0JnM4MvhVc,154400000,154410000,soothing pag to face the day's toil but
L0JnM4MvhVc,154410000,156410000,soothing pag to face the day's toil but sometimes because of the irritated eyes
L0JnM4MvhVc,156410000,156420000,sometimes because of the irritated eyes
L0JnM4MvhVc,156420000,159140000,sometimes because of the irritated eyes tickling throat dry hack
L0JnM4MvhVc,159140000,159150000,tickling throat dry hack
L0JnM4MvhVc,159150000,163910000,tickling throat dry hack wheezing and the shortness of wind the
L0JnM4MvhVc,163910000,163920000,wheezing and the shortness of wind the
L0JnM4MvhVc,163920000,166280000,wheezing and the shortness of wind the inveterate smoker gets a strange desire
L0JnM4MvhVc,166280000,166290000,inveterate smoker gets a strange desire
L0JnM4MvhVc,166290000,173080000,inveterate smoker gets a strange desire to rid himself of the habit like quiet
L0JnM4MvhVc,173080000,173090000,
L0JnM4MvhVc,173090000,207740000,where I feel better already
L0JnM4MvhVc,207740000,207750000,
L0JnM4MvhVc,207750000,210960000,well George you've gone and done it
L0JnM4MvhVc,210960000,210970000,well George you've gone and done it
L0JnM4MvhVc,210970000,213600000,well George you've gone and done it I sure admire a guy that can quit
L0JnM4MvhVc,213600000,213610000,I sure admire a guy that can quit
L0JnM4MvhVc,213610000,217020000,I sure admire a guy that can quit smoking like you can it ain't easy if it
L0JnM4MvhVc,217020000,217030000,smoking like you can it ain't easy if it
L0JnM4MvhVc,217030000,220860000,smoking like you can it ain't easy if it was quit quitting giving up the habit
L0JnM4MvhVc,220860000,220870000,was quit quitting giving up the habit
L0JnM4MvhVc,220870000,224310000,was quit quitting giving up the habit changed Keith's entire outlook hey
L0JnM4MvhVc,224310000,224320000,changed Keith's entire outlook hey
L0JnM4MvhVc,224320000,224970000,changed Keith's entire outlook hey George
L0JnM4MvhVc,224970000,224980000,George
L0JnM4MvhVc,224980000,229260000,George I'm a father have a cigar whoa boy you
L0JnM4MvhVc,229260000,229270000,I'm a father have a cigar whoa boy you
L0JnM4MvhVc,229270000,236790000,I'm a father have a cigar whoa boy you could smoke one I quit smoking for I
L0JnM4MvhVc,236790000,236800000,could smoke one I quit smoking for I
L0JnM4MvhVc,236800000,239550000,could smoke one I quit smoking for I like smoking I'm no quitter get a lot of
L0JnM4MvhVc,239550000,239560000,like smoking I'm no quitter get a lot of
L0JnM4MvhVc,239560000,241890000,like smoking I'm no quitter get a lot of pleasure smoking I love smoking it's my
L0JnM4MvhVc,241890000,241900000,pleasure smoking I love smoking it's my
L0JnM4MvhVc,241900000,289600000,pleasure smoking I love smoking it's my hobby
L0JnM4MvhVc,289600000,289610000,
L0JnM4MvhVc,289610000,308019000,a Glock Lika gone
L0JnM4MvhVc,308019000,308029000,
L0JnM4MvhVc,308029000,314449000,smooth smooth and the little man wins a
L0JnM4MvhVc,314449000,314459000,smooth smooth and the little man wins a
L0JnM4MvhVc,314459000,345260000,smooth smooth and the little man wins a big cigar
L0JnM4MvhVc,345260000,345270000,
L0JnM4MvhVc,345270000,353520000,Wow hey mister
L0JnM4MvhVc,353520000,353530000,Wow hey mister
L0JnM4MvhVc,353530000,357390000,Wow hey mister you gotta see a my male lead rope
L0JnM4MvhVc,357390000,357400000,you gotta see a my male lead rope
L0JnM4MvhVc,357400000,358559000,you gotta see a my male lead rope George
L0JnM4MvhVc,358559000,358569000,George
L0JnM4MvhVc,358569000,362119000,George cigar who snuffer anything just anything
L0JnM4MvhVc,362119000,362129000,cigar who snuffer anything just anything
L0JnM4MvhVc,362129000,366149000,cigar who snuffer anything just anything why of course my good man ever see God
L0JnM4MvhVc,366149000,366159000,why of course my good man ever see God
L0JnM4MvhVc,366159000,371779000,why of course my good man ever see God who thank you soon
L0JnM4MvhVc,371779000,371789000,
L0JnM4MvhVc,371789000,376860000,give the smoker enough rope and he'll
L0JnM4MvhVc,376860000,376870000,give the smoker enough rope and he'll
L0JnM4MvhVc,376870000,380069000,give the smoker enough rope and he'll hang on to his habit
iE8LPiFzuuo,0,2880000,* Pewds is on some Gfuel*
iE8LPiFzuuo,3140000,4680000,(Ken)Feeeeeeeeeeeeeelix
iE8LPiFzuuo,5560000,7500000,FeEeEeEeEeEeLiX
iE8LPiFzuuo,8380000,8880000,(Tensed Pewds) How are you?
iE8LPiFzuuo,9380000,9980000,Who is there?
iE8LPiFzuuo,10760000,12400000,(Deep Ken Voice) You thought you defeated me...
iE8LPiFzuuo,13040000,13540000,* Pewds suffocate GFuel *
iE8LPiFzuuo,14200000,17000000,"Oh, I have a good experience!!!!!!!"
iE8LPiFzuuo,17100000,17980000,(Confused Pewds.exe) -Series?
iE8LPiFzuuo,18280000,18780000,No!
iE8LPiFzuuo,19000000,19880000,it's me!
iE8LPiFzuuo,20020000,21460000,CINNAMONTOSTKEN !!! (Aaaah! He is back!!!)
iE8LPiFzuuo,21460000,23760000,"You deleted my System32, you bastard! (LOL Pewds did it?)"
iE8LPiFzuuo,23920000,25200000,I challenge you...
iE8LPiFzuuo,25440000,26960000,The most dangerous game in the world!
iE8LPiFzuuo,27660000,29740000,"But Ken, that was 3 years ago..."
iE8LPiFzuuo,29960000,30520000,what? ? ?
iE8LPiFzuuo,31320000,33160000,What will I do for your life?
iE8LPiFzuuo,33880000,34380000,NANI?
iE8LPiFzuuo,34940000,37960000,"Ok, Ken, I accept your challenge!"
iE8LPiFzuuo,38420000,39420000,(owo Pewds is entering satirical mode) Boo hoo
iE8LPiFzuuo,39420000,43580000,"Oh, I am still angry about losing a video game 3 years ago (0 deaths)"
iE8LPiFzuuo,44080000,45000000,It is more than just...
iE8LPiFzuuo,45400000,46640000,This is everything!
iE8LPiFzuuo,47160000,48500000,All my memes are lost forever (NOOOOOOOOOO)
iE8LPiFzuuo,49000000,50920000,"Ah, alright..."
iE8LPiFzuuo,51420000,53260000,"I don't care, little itch"
iE8LPiFzuuo,54680000,55480000,* Pewds ridicules the impending deterioration*
iE8LPiFzuuo,55860000,56700000,Damn! (He said H word)
iE8LPiFzuuo,56700000,58480000,(owo Ken is very furry now) I challenge you a ROCK game...
iE8LPiFzuuo,58640000,59360000,...paper...
iE8LPiFzuuo,60060000,60620000,... Scissas
iE8LPiFzuuo,60780000,62440000,"Oh, ok, I will let you know..."
iE8LPiFzuuo,62600000,64760000,......I'm the champion...
iE8LPiFzuuo,64760000,66760000,"...rock, paper, scissors (wow)"
iE8LPiFzuuo,66760000,68760000,uNDEAFEATED!
iE8LPiFzuuo,68760000,70760000,Ken: How can I forget? !
iE8LPiFzuuo,70760000,71700000,"*, and poods smiled; wait a minute - *"
iE8LPiFzuuo,71700000,74760000,"Pilz: Yes, you forgot, isn't it? Ken: Soon..."
iE8LPiFzuuo,74760000,75260000,*More laughter from poods* Ken: Three years! Haha
iE8LPiFzuuo,77700000,81700000,Pilz: You forgot for three years; now you will pay again! >:3
iE8LPiFzuuo,81700000,83700000,The rules are the same.
iE8LPiFzuuo,83700000,87700000,"No matter who wins rock, paper, scissors, the best 3 points"
iE8LPiFzuuo,87700000,93700000,Get the computer that controls the other party for 30 seconds
iE8LPiFzuuo,93700000,94700000,Ken: This is all I need.)
iE8LPiFzuuo,94900000,96700000,I have been plotting this...
iE8LPiFzuuo,96700000,97700000,* ding sound * * ding sound * * ding sound *
iE8LPiFzuuo,97700000,99900000,"Pilz: Hey, let's go to the first round here!"
iE8LPiFzuuo,99900000,101900000,"Pilz: Well, what should I choose, right? * Kens buzz*"
iE8LPiFzuuo,101900000,103900000,Maybe I will go to the scissors! 
iE8LPiFzuuo,103900000,105900000,"Ken: Oh, I know all your actions."
iE8LPiFzuuo,105900000,107900000,"You can't beat me this time. Pilz: Oh, yes."
iE8LPiFzuuo,107900000,110700000,"Pewds: Aww b-oh, you made a choice, right?"
iE8LPiFzuuo,110700000,112700000,* Both sides screamed strongly because poods won the XD *
iE8LPiFzuuo,114200000,115700000,*They all do (.)*
iE8LPiFzuuo,116700000,118900000,"Pilz: You made a serious mistake, challenged me, Ken!"
iE8LPiFzuuo,118900000,120900000,Ken: I don't know n
iE8LPiFzuuo,120900000,121500000,* breathe into his microphone; Ken takes off his glasses*
iE8LPiFzuuo,121500000,124500000,"Pilz: Oh, maybe I will scissors again, right?"
iE8LPiFzuuo,124500000,126500000,hhhMMmMmm
iE8LPiFzuuo,126500000,128500000,* poods screams damn because he lost (must be a smile); Ken likes *
iE8LPiFzuuo,128500000,129500000,*respite*
iE8LPiFzuuo,129500000,131500000,"Ken: You did it! YESS! Pilz: Ok, this is the first time to 3 times."
iE8LPiFzuuo,131500000,133500000,"Pilz: Ok, this is the first time to 3 times."
iE8LPiFzuuo,133500000,135500000,So it doesn't even matter - *the sound is small*
iE8LPiFzuuo,135500000,137500000,Maybe'llscssoragan
iE8LPiFzuuo,137500000,138140000,Pilz: ooooooo * Ken to drink something nervous*
iE8LPiFzuuo,138140000,140140000,**
iE8LPiFzuuo,140500000,143500000,*The masters win again; the painful voice and joy*
iE8LPiFzuuo,144260000,145120000,one more
iE8LPiFzuuo,145780000,146460000,a M0re
iE8LPiFzuuo,146460000,148220000,*Ken cough*
iE8LPiFzuuo,148220000,148760000,(Oh) my Gawd
iE8LPiFzuuo,149780000,150980000,Are you afraid of being willing?
iE8LPiFzuuo,151340000,152780000,Shake now
iE8LPiFzuuo,153660000,157020000,Maybe I will scissors again
iE8LPiFzuuo,157760000,159020000,Get TrIgGeRed
iE8LPiFzuuo,159680000,160920000,Damn
iE8LPiFzuuo,161540000,162940000,UGUGUGGGGGGGUGUGGUGUGGUG * constapated ken *
iE8LPiFzuuo,163560000,164560000,Its TIED (TOTED AF)
iE8LPiFzuuo,165060000,165680000,Ken: FUAAAAAAAA
iE8LPiFzuuo,165800000,166840000,P00ds: Maybe I will make scissors
iE8LPiFzuuo,167720000,168220000,once again
iE8LPiFzuuo,169420000,170300000,Both: BAHHHH
iE8LPiFzuuo,172200000,173680000,** Come on*End*
iE8LPiFzuuo,173980000,175200000,Ken: The reaction to God
iE8LPiFzuuo,175200000,177180000,"Poods: Come on, please come to God and ask for scissors."
iE8LPiFzuuo,177680000,184340000,Ken: Its time to activate my TRUMP card.
iE8LPiFzuuo,184340000,186120000,"Poods: No, not the trump card."
iE8LPiFzuuo,186120000,187640000,UGHHHHHHHHHHHHHHHHH
iE8LPiFzuuo,187640000,188360000,Ken: Say again
iE8LPiFzuuo,188360000,192440000,* laughter burst *
iE8LPiFzuuo,192440000,193360000,Poods: Come on.
iE8LPiFzuuo,193480000,196560000,Poods: Do this felix
iE8LPiFzuuo,196560000,200580000,Poods: You have been waiting for 3 years and you can do godamit (speak to yourself)
iE8LPiFzuuo,204100000,204940000,AHHhhHHhhh
iE8LPiFzuuo,204940000,209860000,Ken: Will be defeated by Poods: I won't be defeated by someone you like.
iE8LPiFzuuo,212700000,217520000,Ken: NOooooooo Poods: YESSSssss
iE8LPiFzuuo,217520000,219520000,(all have done some fierce embarrassment)
mWSuzIyxi6s,2570000,29640000,goddammit
mWSuzIyxi6s,29640000,29650000,
mWSuzIyxi6s,29650000,33670000,this is recon team d2 target is in view
mWSuzIyxi6s,33670000,33680000,this is recon team d2 target is in view
mWSuzIyxi6s,33680000,37000000,this is recon team d2 target is in view she's a block away moving closer don't
mWSuzIyxi6s,37000000,37010000,she's a block away moving closer don't
mWSuzIyxi6s,37010000,40210000,she's a block away moving closer don't waste ammo so what's the plan after we
mWSuzIyxi6s,40210000,40220000,waste ammo so what's the plan after we
mWSuzIyxi6s,40220000,43540000,waste ammo so what's the plan after we get out we'll go to ground outside the
mWSuzIyxi6s,43540000,43550000,get out we'll go to ground outside the
mWSuzIyxi6s,43550000,45610000,get out we'll go to ground outside the city and wait for orders from the NSA
mWSuzIyxi6s,45610000,45620000,city and wait for orders from the NSA
mWSuzIyxi6s,45620000,48250000,city and wait for orders from the NSA but first things first we need to
mWSuzIyxi6s,48250000,48260000,but first things first we need to
mWSuzIyxi6s,48260000,50469000,but first things first we need to concentrate on finding and killing that
mWSuzIyxi6s,50469000,50479000,concentrate on finding and killing that
mWSuzIyxi6s,50479000,53140000,concentrate on finding and killing that sniper let's hope we catch a break and
mWSuzIyxi6s,53140000,53150000,sniper let's hope we catch a break and
mWSuzIyxi6s,53150000,61649000,sniper let's hope we catch a break and she follows the bait let's go around
mWSuzIyxi6s,61649000,61659000,
mWSuzIyxi6s,61659000,67570000,motherfucker
mWSuzIyxi6s,67570000,67580000,
mWSuzIyxi6s,67580000,85120000,fuck yeah
mWSuzIyxi6s,85120000,85130000,
mWSuzIyxi6s,85130000,86950000,Roberta's on the other side of this
mWSuzIyxi6s,86950000,86960000,Roberta's on the other side of this
mWSuzIyxi6s,86960000,96870000,Roberta's on the other side of this crazy fight here let's go
mWSuzIyxi6s,96870000,96880000,
mWSuzIyxi6s,96880000,103480000,before we're moving
mWSuzIyxi6s,103480000,103490000,
mWSuzIyxi6s,103490000,106960000,get back young master but get out of the
mWSuzIyxi6s,106960000,106970000,get back young master but get out of the
mWSuzIyxi6s,106970000,118210000,get back young master but get out of the way fucking brats wait huh what do I
mWSuzIyxi6s,118210000,118220000,way fucking brats wait huh what do I
mWSuzIyxi6s,118220000,120520000,way fucking brats wait huh what do I find on this night beneath the moon's so
mWSuzIyxi6s,120520000,120530000,find on this night beneath the moon's so
mWSuzIyxi6s,120530000,124389000,find on this night beneath the moon's so clear and blue vile scum who raise foul
mWSuzIyxi6s,124389000,124399000,clear and blue vile scum who raise foul
mWSuzIyxi6s,124399000,127359000,clear and blue vile scum who raise foul blades against children many foes who
mWSuzIyxi6s,127359000,127369000,blades against children many foes who
mWSuzIyxi6s,127369000,129729000,blades against children many foes who face the fury of my beloved sidearm will
mWSuzIyxi6s,129729000,129739000,face the fury of my beloved sidearm will
mWSuzIyxi6s,129739000,133240000,face the fury of my beloved sidearm will be blown to pieces God is with me he
mWSuzIyxi6s,133240000,133250000,be blown to pieces God is with me he
mWSuzIyxi6s,133250000,137290000,be blown to pieces God is with me he protects me and I am his executioner
mWSuzIyxi6s,137290000,137300000,protects me and I am his executioner
mWSuzIyxi6s,137300000,139600000,protects me and I am his executioner here on earth now prepare to face a
mWSuzIyxi6s,139600000,139610000,here on earth now prepare to face a
mWSuzIyxi6s,139610000,150740000,here on earth now prepare to face a random
mWSuzIyxi6s,150740000,150750000,
mWSuzIyxi6s,150750000,154800000,okay you hide you
Hvcx1wd9S8g,0,2000000,okay children let's start the day with a
Hvcx1wd9S8g,2000000,2010000,okay children let's start the day with a
Hvcx1wd9S8g,2010000,4370000,okay children let's start the day with a few new math problems what is five times
Hvcx1wd9S8g,4370000,4380000,few new math problems what is five times
Hvcx1wd9S8g,4380000,5860000,few new math problems what is five times two
Hvcx1wd9S8g,5860000,5870000,two
Hvcx1wd9S8g,5870000,8660000,two come on children don't be shy just give
Hvcx1wd9S8g,8660000,8670000,come on children don't be shy just give
Hvcx1wd9S8g,8670000,9680000,come on children don't be shy just give it your best shot
Hvcx1wd9S8g,9680000,9690000,it your best shot
Hvcx1wd9S8g,9690000,13459000,it your best shot yes Clyde well okay now let's try to get
Hvcx1wd9S8g,13459000,13469000,yes Clyde well okay now let's try to get
Hvcx1wd9S8g,13469000,14749000,yes Clyde well okay now let's try to get an answer from someone who's not a
Hvcx1wd9S8g,14749000,14759000,an answer from someone who's not a
Hvcx1wd9S8g,14759000,17930000,an answer from someone who's not a complete retard anyone come on don't be
Hvcx1wd9S8g,17930000,17940000,complete retard anyone come on don't be
Hvcx1wd9S8g,17940000,19640000,complete retard anyone come on don't be shy I think I know the answer mr.
Hvcx1wd9S8g,19640000,19650000,shy I think I know the answer mr.
Hvcx1wd9S8g,19650000,23509000,shy I think I know the answer mr. garrison don't call me fat you fuckin
Hvcx1wd9S8g,23509000,23519000,garrison don't call me fat you fuckin
Hvcx1wd9S8g,23519000,26779000,garrison don't call me fat you fuckin Jew Eric did you just say the F word Jew
Hvcx1wd9S8g,26779000,26789000,Jew Eric did you just say the F word Jew
Hvcx1wd9S8g,26789000,28580000,Jew Eric did you just say the F word Jew no he's not gonna fuck you can't say
Hvcx1wd9S8g,28580000,28590000,no he's not gonna fuck you can't say
Hvcx1wd9S8g,28590000,29630000,no he's not gonna fuck you can't say fucking school you're fucking fat-ass
Hvcx1wd9S8g,29630000,29640000,fucking school you're fucking fat-ass
Hvcx1wd9S8g,29640000,30910000,fucking school you're fucking fat-ass Carl
Hvcx1wd9S8g,30910000,30920000,Carl
Hvcx1wd9S8g,30920000,33080000,Carl Eric dude you just said fuck against
Hvcx1wd9S8g,33080000,33090000,Eric dude you just said fuck against
Hvcx1wd9S8g,33090000,37270000,Eric dude you just said fuck against family boom Kenny doesn't hurt anybody
Hvcx1wd9S8g,37270000,37280000,family boom Kenny doesn't hurt anybody
Hvcx1wd9S8g,37280000,39619000,family boom Kenny doesn't hurt anybody how would you like to go see the school
Hvcx1wd9S8g,39619000,39629000,how would you like to go see the school
Hvcx1wd9S8g,39629000,41959000,how would you like to go see the school counselor how would you like to suck my
Hvcx1wd9S8g,41959000,41969000,counselor how would you like to suck my
Hvcx1wd9S8g,41969000,46400000,counselor how would you like to suck my buzz what did you say I'm sorry I'm
Hvcx1wd9S8g,46400000,46410000,buzz what did you say I'm sorry I'm
Hvcx1wd9S8g,46410000,46850000,buzz what did you say I'm sorry I'm sorry
Hvcx1wd9S8g,46850000,46860000,sorry
Hvcx1wd9S8g,46860000,58399000,sorry actually what I said was holy shit dude
3w-C0-zVaW8,0,12820000,you play with them balls like it's
3w-C0-zVaW8,12820000,12830000,
3w-C0-zVaW8,12830000,18430000,[Music]
3w-C0-zVaW8,18430000,18440000,
3w-C0-zVaW8,18440000,30710000,[Music]
3w-C0-zVaW8,30710000,30720000,[Music]
3w-C0-zVaW8,30720000,32910000,[Music] basically
3w-C0-zVaW8,32910000,32920000,basically
3w-C0-zVaW8,32920000,34280000,basically [Music]
3w-C0-zVaW8,34280000,34290000,[Music]
3w-C0-zVaW8,34290000,35990000,[Music] [Applause]
3w-C0-zVaW8,35990000,36000000,[Applause]
3w-C0-zVaW8,36000000,50969000,[Applause] [Music]
3w-C0-zVaW8,50969000,50979000,
3w-C0-zVaW8,50979000,57599000,that's a lot of guys down issue change
3w-C0-zVaW8,57599000,57609000,that's a lot of guys down issue change
3w-C0-zVaW8,57609000,66730000,that's a lot of guys down issue change so bad don't you change me
3w-C0-zVaW8,66730000,66740000,so bad don't you change me
3w-C0-zVaW8,66740000,70970000,so bad don't you change me [Music]
3w-C0-zVaW8,70970000,70980000,[Music]
3w-C0-zVaW8,70980000,73560000,[Music] three turns
3w-C0-zVaW8,73560000,73570000,three turns
3w-C0-zVaW8,73570000,96500000,three turns [Music]
3w-C0-zVaW8,96500000,96510000,[Music]
3w-C0-zVaW8,96510000,98770000,[Music] baby
3w-C0-zVaW8,98770000,98780000,baby
3w-C0-zVaW8,98780000,120090000,baby [Music]
3w-C0-zVaW8,120090000,120100000,
3w-C0-zVaW8,120100000,134830000,you play with them balls like fired
3w-C0-zVaW8,134830000,134840000,you play with them balls like fired
3w-C0-zVaW8,134840000,136740000,you play with them balls like fired you're fired
3w-C0-zVaW8,136740000,136750000,you're fired
3w-C0-zVaW8,136750000,143699000,you're fired [Music]
3w-C0-zVaW8,143699000,143709000,
3w-C0-zVaW8,143709000,149940000,that Joe kitty real tired
3w-C0-zVaW8,149940000,149950000,
3w-C0-zVaW8,149950000,173839000,[Music]
3w-C0-zVaW8,173839000,173849000,[Music]
3w-C0-zVaW8,173849000,178200000,[Music] you win
U3YVFa_rLmU,6053000,9035000,Holy shit! A Pinsir!
U3YVFa_rLmU,10202000,12625000,Oh Crap. I don't have a Pokemon to battle with.
U3YVFa_rLmU,13291000,15074000,I got this Pokeball tho...
U3YVFa_rLmU,15620000,17582000,You're mine PINSIR!
U3YVFa_rLmU,18689000,21233000,Argh! Goddamn... What the f-
U3YVFa_rLmU,21920000,23899000,Oh my god! I can't believe that worked!
U3YVFa_rLmU,24369000,28568000,Oh No! IS THIS A FUCKING POKEBALL?
U3YVFa_rLmU,28568000,31827000,Come on! Come on! Just a little longer...
U3YVFa_rLmU,35115000,36915000,Oh Crapachu...
U3YVFa_rLmU,37270000,39473000,So... You want a new Pokemon uh?
U3YVFa_rLmU,40345000,41406000,Do you just go around...
U3YVFa_rLmU,41406000,43091000,Punching Pokemons in the head...
U3YVFa_rLmU,43321000,46165000,Smacking ma poke-face with your poke-BALLS
U3YVFa_rLmU,46165000,50810000,Listen! I'm sorry... I...I promise... I'll never do it again!
U3YVFa_rLmU,50810000,52697000,No... you won't!
U3YVFa_rLmU,52932000,54866000,PINSIR PINSIR!
U3YVFa_rLmU,56773000,58858000,Hold still you little punk!
G-Wn48geCJ8,4899000,13209000,yeah I jump now listen here missile I
G-Wn48geCJ8,13209000,13219000,yeah I jump now listen here missile I
G-Wn48geCJ8,13219000,15670000,yeah I jump now listen here missile I roam use no truck go back into your all
G-Wn48geCJ8,15670000,15680000,roam use no truck go back into your all
G-Wn48geCJ8,15680000,18820000,roam use no truck go back into your all the kind started the sir I just leave my
G-Wn48geCJ8,18820000,18830000,the kind started the sir I just leave my
G-Wn48geCJ8,18830000,25769000,the kind started the sir I just leave my own counsel we both have all man
G-Wn48geCJ8,25769000,25779000,
G-Wn48geCJ8,25779000,30310000,nah cause it must be a Mario he just he
G-Wn48geCJ8,30310000,30320000,nah cause it must be a Mario he just he
G-Wn48geCJ8,30320000,32589000,nah cause it must be a Mario he just he take racing and though seriously he
G-Wn48geCJ8,32589000,32599000,take racing and though seriously he
G-Wn48geCJ8,32599000,34990000,take racing and though seriously he takes everything too seriously
G-Wn48geCJ8,34990000,35000000,takes everything too seriously
G-Wn48geCJ8,35000000,37660000,takes everything too seriously you motherfuckers invite nor the Tendo
G-Wn48geCJ8,37660000,37670000,you motherfuckers invite nor the Tendo
G-Wn48geCJ8,37670000,52090000,you motherfuckers invite nor the Tendo characters onto my plaque is killing all
G-Wn48geCJ8,52090000,52100000,characters onto my plaque is killing all
G-Wn48geCJ8,52100000,55090000,characters onto my plaque is killing all the bad new Tendo racers what is he some
G-Wn48geCJ8,55090000,55100000,the bad new Tendo racers what is he some
G-Wn48geCJ8,55100000,61720000,the bad new Tendo racers what is he some kind of racist you're not need pendo
G-Wn48geCJ8,61720000,61730000,kind of racist you're not need pendo
G-Wn48geCJ8,61730000,66249000,kind of racist you're not need pendo your your retained or your all race
G-Wn48geCJ8,66249000,66259000,your your retained or your all race
G-Wn48geCJ8,66259000,88470000,your your retained or your all race traitors
G-Wn48geCJ8,88470000,88480000,
G-Wn48geCJ8,88480000,93190000,23 years of jumping ABARES 20 feet back
G-Wn48geCJ8,93190000,93200000,23 years of jumping ABARES 20 feet back
G-Wn48geCJ8,93200000,96789000,23 years of jumping ABARES 20 feet back in years
G-Wn48geCJ8,96789000,96799000,
G-Wn48geCJ8,96799000,117819000,Oh God Oh Luigi common forgit nigga
G-Wn48geCJ8,117819000,117829000,
G-Wn48geCJ8,117829000,121730000,wait Mario think of our history so you
G-Wn48geCJ8,121730000,121740000,wait Mario think of our history so you
G-Wn48geCJ8,121740000,137979000,wait Mario think of our history so you like it to go fast
G-Wn48geCJ8,137979000,137989000,
G-Wn48geCJ8,137989000,140720000,alright I can't it now it's mine and I
G-Wn48geCJ8,140720000,140730000,alright I can't it now it's mine and I
G-Wn48geCJ8,140730000,153250000,alright I can't it now it's mine and I can force it to do whatever I want
G-Wn48geCJ8,153250000,153260000,
G-Wn48geCJ8,153260000,156320000,Mario stop we're brothers
G-Wn48geCJ8,156320000,156330000,Mario stop we're brothers
G-Wn48geCJ8,156330000,166640000,Mario stop we're brothers I have no Brad Marlowe oh it's great oh
G-Wn48geCJ8,166640000,166650000,I have no Brad Marlowe oh it's great oh
G-Wn48geCJ8,166650000,173720000,I have no Brad Marlowe oh it's great oh s--- your playstation characters never
G-Wn48geCJ8,173720000,173730000,s--- your playstation characters never
G-Wn48geCJ8,173730000,226610000,s--- your playstation characters never learn
G-Wn48geCJ8,226610000,226620000,
G-Wn48geCJ8,226620000,228680000,you
rXmE1MgAXzU,30000,2960000,yo wanna know why I get my games g2a
rXmE1MgAXzU,2960000,2970000,yo wanna know why I get my games g2a
rXmE1MgAXzU,2970000,4910000,yo wanna know why I get my games g2a shield check them out they got cheap
rXmE1MgAXzU,4910000,4920000,shield check them out they got cheap
rXmE1MgAXzU,4920000,8000000,shield check them out they got cheap games easy yo good work inside of Judah
rXmE1MgAXzU,8000000,8010000,games easy yo good work inside of Judah
rXmE1MgAXzU,8010000,22250000,games easy yo good work inside of Judah poutine today I'm playing existe let's
rXmE1MgAXzU,22250000,22260000,poutine today I'm playing existe let's
rXmE1MgAXzU,22260000,26060000,poutine today I'm playing existe let's do this really tell me what tell me your
rXmE1MgAXzU,26060000,26070000,do this really tell me what tell me your
rXmE1MgAXzU,26070000,30939000,do this really tell me what tell me your name okay is my name do you want a name
rXmE1MgAXzU,30939000,30949000,name okay is my name do you want a name
rXmE1MgAXzU,30949000,33560000,name okay is my name do you want a name no I just I just gave you my name
rXmE1MgAXzU,33560000,33570000,no I just I just gave you my name
rXmE1MgAXzU,33570000,40040000,no I just I just gave you my name no you didn't fucking did yes I did and
rXmE1MgAXzU,40040000,40050000,no you didn't fucking did yes I did and
rXmE1MgAXzU,40050000,46340000,no you didn't fucking did yes I did and I told you fuck off so how are you okay
rXmE1MgAXzU,46340000,46350000,I told you fuck off so how are you okay
rXmE1MgAXzU,46350000,48889000,I told you fuck off so how are you okay just completely bypass my insult that's
rXmE1MgAXzU,48889000,48899000,just completely bypass my insult that's
rXmE1MgAXzU,48899000,52670000,just completely bypass my insult that's fair play fair play I am good you I'm
rXmE1MgAXzU,52670000,52680000,fair play fair play I am good you I'm
