id,start,end,text
Tp8VW7FTvYw,637230000,637240000,route 4 earlier how did you get here so
Tp8VW7FTvYw,637240000,637810000,route 4 earlier how did you get here so fast
Tp8VW7FTvYw,637810000,637820000,fast
Tp8VW7FTvYw,637820000,645950000,fast [Music]
Tp8VW7FTvYw,645950000,645960000,
Tp8VW7FTvYw,645960000,651830000,multiple choice multiple choice joke
Tp8VW7FTvYw,651830000,651840000,multiple choice multiple choice joke
Tp8VW7FTvYw,651840000,655800000,multiple choice multiple choice joke multiple choice ash you've disrespected
Tp8VW7FTvYw,655800000,655810000,multiple choice ash you've disrespected
Tp8VW7FTvYw,655810000,658110000,multiple choice ash you've disrespected and completely forgotten about me for
Tp8VW7FTvYw,658110000,658120000,and completely forgotten about me for
Tp8VW7FTvYw,658120000,660090000,and completely forgotten about me for the last time I'm getting my revenge
Tp8VW7FTvYw,660090000,660100000,the last time I'm getting my revenge
Tp8VW7FTvYw,660100000,662880000,the last time I'm getting my revenge only this time it's personal
Tp8VW7FTvYw,662880000,662890000,only this time it's personal
Tp8VW7FTvYw,662890000,665190000,only this time it's personal bitch you're asking for a hurtin I have
Tp8VW7FTvYw,665190000,665200000,bitch you're asking for a hurtin I have
Tp8VW7FTvYw,665200000,667410000,bitch you're asking for a hurtin I have all ground-types so your Pikachu and
Tp8VW7FTvYw,667410000,667420000,all ground-types so your Pikachu and
Tp8VW7FTvYw,667420000,669210000,all ground-types so your Pikachu and fletchling won't stand a chance and
Tp8VW7FTvYw,669210000,669220000,fletchling won't stand a chance and
Tp8VW7FTvYw,669220000,671010000,fletchling won't stand a chance and battle ha you just made a mistake
Tp8VW7FTvYw,671010000,671020000,battle ha you just made a mistake
Tp8VW7FTvYw,671020000,672690000,battle ha you just made a mistake telling me that now I'm gonna have a
Tp8VW7FTvYw,672690000,672700000,telling me that now I'm gonna have a
Tp8VW7FTvYw,672700000,673860000,telling me that now I'm gonna have a strategy bitch
Tp8VW7FTvYw,673860000,673870000,strategy bitch
Tp8VW7FTvYw,673870000,676950000,strategy bitch ooh I gave both my pokemons air balloons
Tp8VW7FTvYw,676950000,676960000,ooh I gave both my pokemons air balloons
Tp8VW7FTvYw,676960000,678540000,ooh I gave both my pokemons air balloons so good luck using earthquake on them
Tp8VW7FTvYw,678540000,678550000,so good luck using earthquake on them
Tp8VW7FTvYw,678550000,690140000,so good luck using earthquake on them now go neither what the kiss yes gust
Tp8VW7FTvYw,690140000,690150000,
Tp8VW7FTvYw,690150000,694440000,oh my god no I thought of a strategy for
Tp8VW7FTvYw,694440000,694450000,oh my god no I thought of a strategy for
Tp8VW7FTvYw,694450000,696690000,oh my god no I thought of a strategy for the first time ever and I lost the game
Tp8VW7FTvYw,696690000,696700000,the first time ever and I lost the game
Tp8VW7FTvYw,696700000,700770000,the first time ever and I lost the game again but why what the hell happened
Tp8VW7FTvYw,700770000,700780000,again but why what the hell happened
Tp8VW7FTvYw,700780000,702630000,again but why what the hell happened when she sent out that thing that
Tp8VW7FTvYw,702630000,702640000,when she sent out that thing that
Tp8VW7FTvYw,702640000,706710000,when she sent out that thing that strange flying with wings that I've
Tp8VW7FTvYw,706710000,706720000,strange flying with wings that I've
Tp8VW7FTvYw,706720000,708780000,strange flying with wings that I've never seen before how do I keep losing
Tp8VW7FTvYw,708780000,708790000,never seen before how do I keep losing
Tp8VW7FTvYw,708790000,711780000,never seen before how do I keep losing battles like this it's cuz you can't see
Tp8VW7FTvYw,711780000,711790000,battles like this it's cuz you can't see
Tp8VW7FTvYw,711790000,714000000,battles like this it's cuz you can't see the truth also the gym leaders cheating
Tp8VW7FTvYw,714000000,714010000,the truth also the gym leaders cheating
Tp8VW7FTvYw,714010000,716760000,the truth also the gym leaders cheating here have a moist towelette - oh uh
Tp8VW7FTvYw,716760000,716770000,here have a moist towelette - oh uh
Tp8VW7FTvYw,716770000,719760000,here have a moist towelette - oh uh thanks wait did you just read my mind
Tp8VW7FTvYw,719760000,719770000,thanks wait did you just read my mind
Tp8VW7FTvYw,719770000,723090000,thanks wait did you just read my mind it's nice to see you again ash uh as
Tp8VW7FTvYw,723090000,723100000,it's nice to see you again ash uh as
Tp8VW7FTvYw,723100000,725460000,it's nice to see you again ash uh as opposed to the five minutes ago when I
Tp8VW7FTvYw,725460000,725470000,opposed to the five minutes ago when I
Tp8VW7FTvYw,725470000,726090000,opposed to the five minutes ago when I met you
Tp8VW7FTvYw,726090000,726100000,met you
Tp8VW7FTvYw,726100000,727440000,met you we've actually known each other for a
Tp8VW7FTvYw,727440000,727450000,we've actually known each other for a
Tp8VW7FTvYw,727450000,729660000,we've actually known each other for a lot longer than you can imagine and you
Tp8VW7FTvYw,729660000,729670000,lot longer than you can imagine and you
Tp8VW7FTvYw,729670000,732300000,lot longer than you can imagine and you have something that I want what's this a
Tp8VW7FTvYw,732300000,732310000,have something that I want what's this a
Tp8VW7FTvYw,732310000,733350000,have something that I want what's this a cliffhanger
Tp8VW7FTvYw,733350000,733360000,cliffhanger
Tp8VW7FTvYw,733360000,735390000,cliffhanger how could Serina have known asked before
Tp8VW7FTvYw,735390000,735400000,how could Serina have known asked before
Tp8VW7FTvYw,735400000,737670000,how could Serina have known asked before this find out next time on I love this
Tp8VW7FTvYw,737670000,737680000,this find out next time on I love this
Tp8VW7FTvYw,737680000,739440000,this find out next time on I love this episode but it's too bad the wait for
Tp8VW7FTvYw,739440000,739450000,episode but it's too bad the wait for
Tp8VW7FTvYw,739450000,741320000,episode but it's too bad the wait for the next one isn't a bridge
Tp8VW7FTvYw,741320000,741330000,the next one isn't a bridge
Tp8VW7FTvYw,741330000,770340000,the next one isn't a bridge [Music]
Tp8VW7FTvYw,770340000,770350000,
Tp8VW7FTvYw,770350000,771720000,[Music]
Tp8VW7FTvYw,771720000,771730000,[Music]
Tp8VW7FTvYw,771730000,785689000,[Music] he has absolutely no idea perfect
Tp8VW7FTvYw,785689000,785699000,
Tp8VW7FTvYw,785699000,787759000,you
6Dh-RL__uN4,1820000,3840000,"I don't like you, T-Series"
6Dh-RL__uN4,4580000,6240000,"Nothing personal, kid"
6Dh-RL__uN4,7420000,9060000,But I have to give everything
6Dh-RL__uN4,10380000,11620000,Just this once
6Dh-RL__uN4,12700000,15480000,Bobs of Vegana? Whatever will it be?
6Dh-RL__uN4,15600000,19440000,"Breeding Sit, T-Series, I'm here to waste the real tea!"
6Dh-RL__uN4,19620000,22200000,You try to dethrone me from number one in the rankings
6Dh-RL__uN4,23000000,23920000,"But ""You are India, you are losing"" so better think you win"
6Dh-RL__uN4,25260000,28460000,"When I'm done with you, we're going to be completely fucking ready"
6Dh-RL__uN4,28460000,32440000,"""Because we have just started, I will review your zero."
6Dh-RL__uN4,32440000,36050000,"So, come on, T-Series, Hungry for some drama?"
6Dh-RL__uN4,36050000,38160000,"Here, let me serve you bitch lasagna"
6Dh-RL__uN4,38420000,38920000,Bitch lasers
6Dh-RL__uN4,38920000,41630000,Bitch lasagne
6Dh-RL__uN4,41630000,44700000,T-Series is nothing but a bitch lasagne
6Dh-RL__uN4,44840000,47990000,"Bitch lasagne, Bitch lasagne"
6Dh-RL__uN4,47990000,51230000,"Look at T-Series, they just cry for their mum!"
6Dh-RL__uN4,51230000,54430000,"Bitch lasagne, Bitch lasagne"
6Dh-RL__uN4,54430000,56770000,"T-Series is nothing but a ""Bitch lasagne""."
6Dh-RL__uN4,56770000,57620000,Bitch lasagne
6Dh-RL__uN4,57620000,60840000,"Bitch lasagne, Bitch lasagne"
6Dh-RL__uN4,60840000,63840000,T-Series currently watering themselves in their pajamas
6Dh-RL__uN4,63840000,66740000,"So who is hell, Bob and why do you want to kiss him?"
6Dh-RL__uN4,66880000,67240000,Eww ~
6Dh-RL__uN4,67240000,70450000,I'm a Blue-Eye White Dragon while you're just a Wizard.
6Dh-RL__uN4,70450000,73640000,"You have a fifth of the population in your nation, but"
6Dh-RL__uN4,73640000,76340000,"I have nine years of worlds, so keep your feces"
6Dh-RL__uN4,76340000,76650000,(Oops)
6Dh-RL__uN4,76840000,79830000,"""Motu Patlu""? What the fuck is it even meant to mean?"
6Dh-RL__uN4,79830000,83240000,Your language comes from a mumble rap community.
6Dh-RL__uN4,83240000,86230000,"""No daddy, no daddy, yes daddy, Johnny"""
6Dh-RL__uN4,86230000,89650000,Now download all the sugar and let us throw this fucking party with a little
6Dh-RL__uN4,89650000,92830000,"Bitch lasagne, Bitch lasagne"
6Dh-RL__uN4,92830000,96020000,"Look at T-Series, they just cry for their mum!"
6Dh-RL__uN4,96020000,99250000,"Bitch lasagne, Bitch lasagne"
6Dh-RL__uN4,99250000,102440000,T-Series is nothing but a Bitch lasagne.
6Dh-RL__uN4,102440000,105590000,"Bitch lasagne, Bitch lasagne"
6Dh-RL__uN4,105590000,108850000,Look at T-Series they are currently watering their pajamas
6Dh-RL__uN4,108850000,112020000,"Bitch lasagne, Bitch lasagne"
6Dh-RL__uN4,112020000,115250000,T-Series is nothing but a bitch lasagne
6Dh-RL__uN4,115250000,121640000,"You have a population of 1.32 billion but,"
6Dh-RL__uN4,121640000,127840000,Most of your videos can't even touch a million
6Dh-RL__uN4,128040000,130580000,SUB BOT!
6Dh-RL__uN4,132580000,134580000,Spotify / iTunes link in the description!
2BfRSpkq9lI,2860000,5240000,Peter: So your mom says you been drinking
2BfRSpkq9lI,5240000,7980000,"Meg: Ya like a little bit, but-but its nothing you have to worry about."
2BfRSpkq9lI,8440000,9820000,Peter: Look I was young too
2BfRSpkq9lI,10120000,11440000,"you know, I'm might be going to parties"
2BfRSpkq9lI,11680000,14980000,"Walking up with a six-pack, your so excited to get there"
2BfRSpkq9lI,15260000,16380000,you start jogging a little
2BfRSpkq9lI,16900000,21200000,"your friends are all there, and there so happy to see you, there practically cheering your name"
2BfRSpkq9lI,21480000,28060000,and then moony bonny (I don't know the song) comes on at just the right time and everyone's dancing and Laura hellstion (Is that how you spell her name?) juggs are just slamming into you
2BfRSpkq9lI,28300000,29180000,you don't have a care in the world
2BfRSpkq9lI,29480000,32420000,and and if it all came to an end right there-and-there so be it
2BfRSpkq9lI,32840000,34600000,well your my daughter
2BfRSpkq9lI,34960000,36100000,and I don't want any of that for you
2BfRSpkq9lI,37660000,40240000,hey you want to see where I was sitting when you were born
2BfRSpkq9lI,44140000,46620000,Peter: Yeah I still think of Laura lot
2BfRSpkq9lI,46960000,48060000,you were already drinking tonight
2BfRSpkq9lI,48200000,48820000,weren't you
2BfRSpkq9lI,49060000,50580000,Meg: huhhaha (Snores likes a pig) a little
2BfRSpkq9lI,50740000,52900000,"Peter: Whelp, I can't talk to a drunk person if I'm sliver"
2BfRSpkq9lI,52960000,54120000,hey Jerome can I get a beer please?
2BfRSpkq9lI,55380000,60000000,Meg: But now I'm starting to sliver up so I'm going to need one to keep an evening playing field
2BfRSpkq9lI,60140000,62800000,Peter: Alright but it stays between us
2BfRSpkq9lI,63040000,63660000,and what if they card ya
2BfRSpkq9lI,63760000,65740000,"Meg: Don't worry, I got it covered"
2BfRSpkq9lI,65820000,68320000,(FAKE!!!!!!!!!!!!!)
2BfRSpkq9lI,68460000,70180000,Peter: Wow that's really good
2BfRSpkq9lI,70180000,72940000,"Meg: Right, Jerome make it 2"
2BfRSpkq9lI,73100000,120060000,(Music playing in back round)
2BfRSpkq9lI,120580000,127140000,(Birds chriping)
2BfRSpkq9lI,130940000,132820000,Meg: DAD!! Dad wake up
2BfRSpkq9lI,132940000,133520000,"Peter: Huh, what happen"
2BfRSpkq9lI,133680000,134400000,Meg: I don't know
2BfRSpkq9lI,134400000,138140000,we must have stolen this boat last night I-I don't know were the hell we are
2BfRSpkq9lI,140540000,142180000,oh no my cellphone's dead (How can you put your password even though it's dead)
2BfRSpkq9lI,142380000,144940000,Peter: I got a little bit of juice left so we can either
2BfRSpkq9lI,145060000,148300000,A. Call someone maybe they answer maybe they can help or
2BfRSpkq9lI,148400000,150780000,B. We can diffenelty (I can't spell) switch faces
2BfRSpkq9lI,151400000,157760000,look at you look at me that's what this is (Phone dies) ah were going to die
2BfRSpkq9lI,157840000,159660000,"Meg: Dad, what are we going to do"
2BfRSpkq9lI,159900000,163600000,Peter: you think its too early to tie are shirts around are heads to show were going insane
2BfRSpkq9lI,163900000,166060000,Meg: I mean it dad this is serious
2BfRSpkq9lI,166220000,167820000,Peter: I did pants instead
2BfRSpkq9lI,168120000,169880000,"Meg: Ah, I don't feel so hot"
2BfRSpkq9lI,170120000,171480000,what's wrong with me
2BfRSpkq9lI,171620000,173520000,Peter: Have you ever taken a break since you started drinking
2BfRSpkq9lI,173740000,175340000,Meg: Not until right now
2BfRSpkq9lI,175680000,179900000,Peter: Do you feel like laying on the couch rubbing your eyes while listing lut rings perfect theme
2BfRSpkq9lI,180000000,180500000,Meg: YES!
2BfRSpkq9lI,180600000,181700000,Peter: Well I'll tell you what's wrong with you
2BfRSpkq9lI,181860000,182740000,you've got a hangover
2BfRSpkq9lI,183100000,184800000,Meg: what can you do for a hangover
2BfRSpkq9lI,185060000,189320000,Peter: Well Meg so I don't have too think about my throbbing headache I've try to think of something else
2BfRSpkq9lI,189320000,190140000,like a riddle
2BfRSpkq9lI,190160000,193120000,"like ""how would you describe Chris o' donald"""
2BfRSpkq9lI,193560000,196160000,"Meg: Huh, he's not tall or short"
2BfRSpkq9lI,196600000,198200000,he's not fat or thin
2BfRSpkq9lI,198420000,201700000,well he's not handsome or ugly
2BfRSpkq9lI,201920000,204200000,he's not young or old
2BfRSpkq9lI,204480000,206780000,he's not loud or quiet
2BfRSpkq9lI,207180000,210620000,he's not memorable but but I know who he is
2BfRSpkq9lI,210820000,213720000,"huh, thanks dad I feel so much better"
2BfRSpkq9lI,213820000,215380000,Peter: But you know who doesn't
2BfRSpkq9lI,215640000,216680000,Chris o' donald
2BfRSpkq9lI,216980000,218200000,bye d***o
-g7yAXPuu6A,0,1200000,Heyyyyyy ~ (even kawaiii)
-g7yAXPuu6A,1505000,3060000,It's me (another dazzling sign)
-g7yAXPuu6A,3060000,4545000,"Video, another day"
-g7yAXPuu6A,4545000,7405000,"Another video, you know how all these (voice)"
-g7yAXPuu6A,7405000,9980000,"Only YouTube users, ""Hey guys"
-g7yAXPuu6A,9980000,13495000,"Huffin McFing Vedus for Thirteen Avery Single Day """
-g7yAXPuu6A,13680000,17620000,"""BoOhOOhoo"" you like Singlee every day"
-g7yAXPuu6A,17660000,18980000,I'm not taking BrEaks
-g7yAXPuu6A,19575000,22605000,"Is it even eight years, since when do I do this?"
-g7yAXPuu6A,22605000,24600000,Mather Fly Nine Years (Voice of Sfeir)
-g7yAXPuu6A,24920000,28160000,"Let's start LWIAY, everyone's favorite show (clap) (note me pewds senpai)"
-g7yAXPuu6A,28220000,31215000,"(Start with the introduction, words already on your screen)"
-g7yAXPuu6A,31215000,34445000,(an introduction)
-g7yAXPuu6A,34445000,37180000,(an introduction)
-g7yAXPuu6A,37700000,40100000,I am honored to be the general army of
-g7yAXPuu6A,40100000,43300000,The nine-year-old army is ready to host Mimi's review
-g7yAXPuu6A,44240000,47000000,"(Reads the paper) ""I'm a blue baby shirt!"" Well anyone"
-g7yAXPuu6A,47000000,49220000,I think it's safe to say that anyone gets
-g7yAXPuu6A,49220000,53260000,100 A upvotes will automatically get you to host a M review
-g7yAXPuu6A,53400000,54340000,(Clapping clap)
-g7yAXPuu6A,54540000,56960000,Baby blue shirt put on your finest
-g7yAXPuu6A,56965000,59845000,Blue Shirt Cause It's Time to Host (Applause)
-g7yAXPuu6A,59845000,61120000,Bar Review
-g7yAXPuu6A,61120000,65300000,Bar review with hosts such as Elon musk and blue baby shirt
-g7yAXPuu6A,65300000,70700000,"(Laughs) I mean I'm down, and I'll be in touch with you with a blue baby girl checking out DS."
-g7yAXPuu6A,70880000,74940000,"Blue forgotten shirt for the baby, I am also on the side of Bio-Deppi"
-g7yAXPuu6A,74940000,77120000,Because I do not like T-series personally
-g7yAXPuu6A,77140000,80560000,"So if you're in a bad mood, I can watch it to feel better"
-g7yAXPuu6A,80740000,83040000,Ah-ah- (Cut off laughter)
-g7yAXPuu6A,83360000,84520000,Very healthy and sweet
-g7yAXPuu6A,84520000,86640000,This was a great video I really enjoyed
-g7yAXPuu6A,86760000,90300000,Not the hero we deserve but the hero we need
-g7yAXPuu6A,90560000,92740000,Captain Mercy everyone!
-g7yAXPuu6A,92860000,94060000,Daaaaamn!
-g7yAXPuu6A,94220000,97900000,"Supernatural hero with no flat ass, am I right?"
-g7yAXPuu6A,97920000,99520000,Haha sexual objection ..
-g7yAXPuu6A,99760000,101100000,(chuckle)
-g7yAXPuu6A,101180000,104940000,"Nah, I did not usually choose the appearance of people but I do not like Barry Larson"
-g7yAXPuu6A,105060000,105760000,(Laugh)
-g7yAXPuu6A,105780000,109180000,Ask me anything I will answer on my Youtube channel
-g7yAXPuu6A,109180000,111400000,"(Closes the lid) Well baby blue shirt, relax"
-g7yAXPuu6A,111460000,115120000,You get a meme review (hit) and (hit) this (final hit) final okay?
-g7yAXPuu6A,115160000,118140000,"Where did you buy the blue shirt, that's what I want to know"
-g7yAXPuu6A,118140000,121240000,I love how this guy just got instant internet fame
-g7yAXPuu6A,121380000,122780000,Can you lend me a blue shirt?
-g7yAXPuu6A,122880000,124760000,"Legal (applause) good (applause), neutral (applause) good (applause),"
-g7yAXPuu6A,124760000,126620000,"Good Chaos, (Legitimate Shift in Laughter)"
-g7yAXPuu6A,126700000,129240000,This is actually very careful
-g7yAXPuu6A,129300000,131900000,(Breathes) They have done a good job in getting all sorts of people
-g7yAXPuu6A,132000000,133300000,(Laugh)
-g7yAXPuu6A,133500000,136480000,Oh my God is the whole Reddit seized by a baby blue shirt
-g7yAXPuu6A,136600000,140320000,"(Strange Voice): ""Anime, Adapting With Netflix"", Incredible"
-g7yAXPuu6A,140340000,141760000,What about manga
-g7yAXPuu6A,141820000,146620000,Did you know that the bones in your fingers are formed (hit) like a penis (hit)? (Success)
-g7yAXPuu6A,146760000,150180000,"Of course, of course! Why do you think I eat G FUEL with my fingers"
-g7yAXPuu6A,150360000,152640000,"'Cause I'm like me, I'm an idiot"
-g7yAXPuu6A,152640000,153660000,I love d- (cuts to static noise)
-g7yAXPuu6A,153680000,159020000,"If you can not find out the name of a song, just upload a video to YouTube"
-g7yAXPuu6A,159280000,160760000,And they will copyright it
-g7yAXPuu6A,160860000,162960000,My God (laughs)
-g7yAXPuu6A,163020000,166320000,Modern problems require modern solutions
-g7yAXPuu6A,166400000,167900000,I'm sure this will work
-g7yAXPuu6A,168000000,169080000,Someone should try this
-g7yAXPuu6A,169200000,174020000,"My last attempt to post here, I spent two months making it; I just want to see pewds"
-g7yAXPuu6A,174100000,174600000,"right Now,"
-g7yAXPuu6A,174700000,175860000,This guy went all out
-g7yAXPuu6A,175920000,177840000,(bgm (background music) starts)
-g7yAXPuu6A,178560000,181420000,It's anime pewdiepie another (laughs) Jesus Christ
-g7yAXPuu6A,185920000,187120000,Well damn God
-g7yAXPuu6A,190320000,191420000,(Short laugh and pewdiepie make sound effects)
-g7yAXPuu6A,193480000,193980000,Nice
-g7yAXPuu6A,195020000,195580000,Holy St.
-g7yAXPuu6A,196820000,197480000,Curse!
-g7yAXPuu6A,199720000,202380000,This Devilman reference was crying (?)
-g7yAXPuu6A,209100000,210720000,God damn this wonderful
-g7yAXPuu6A,211280000,211980000,(Short Laughter)
-g7yAXPuu6A,213360000,214460000,(Bgm ends)
-g7yAXPuu6A,214580000,217940000,"If we like a cartoon, I have to act in Swedish"
-g7yAXPuu6A,217940000,218740000,(Short Laughter)
-g7yAXPuu6A,218800000,219540000,?
-g7yAXPuu6A,219700000,220740000,? ? ? ?
-g7yAXPuu6A,221020000,222900000,[Is Swedish a real language?]
-g7yAXPuu6A,222960000,224040000,Just just an idea
-g7yAXPuu6A,224080000,226560000,"Pewds, your sampling rate is set to ""4: 2: 0"""
-g7yAXPuu6A,226700000,229100000,I do not see any problem (hit) (hit) with (hit) it
-g7yAXPuu6A,229220000,234220000,"This is a video quality problem, the camera must be able to change it to anywhere in the settings"
-g7yAXPuu6A,234480000,237060000,"Well god damn, beep boep boep boop"
-g7yAXPuu6A,237160000,239920000,"Ah, it turned out: it's stuck in 420"
-g7yAXPuu6A,240140000,243440000,Listen I'm really trying my best to fix the quality
-g7yAXPuu6A,243840000,246760000,But eh - this is pretty much IMAX
-g7yAXPuu6A,246980000,249960000,"Cinema quality, so I think the players should be satisfied"
-g7yAXPuu6A,250400000,252160000,With the quality of this video
-g7yAXPuu6A,252260000,253600000,do not stop
-g7yAXPuu6A,253900000,255260000,(Laugh)
-g7yAXPuu6A,255500000,258660000,(Breathing) to celebrate International Women's Day
-g7yAXPuu6A,259020000,262600000,Mark the creative women who inspired you - Gloria (hit?) Borger
aWT12InZLsQ,210000,2900000,hey what's up you little motherfuckers
aWT12InZLsQ,2900000,2910000,hey what's up you little motherfuckers
aWT12InZLsQ,2910000,5630000,hey what's up you little motherfuckers this is yogurt Dora the explora and if I
aWT12InZLsQ,5630000,5640000,this is yogurt Dora the explora and if I
aWT12InZLsQ,5640000,7580000,this is yogurt Dora the explora and if I hit my son Pepito and that riders my
aWT12InZLsQ,7580000,7590000,hit my son Pepito and that riders my
aWT12InZLsQ,7590000,10220000,hit my son Pepito and that riders my daughter Lupita anyway let me go put
aWT12InZLsQ,10220000,10230000,daughter Lupita anyway let me go put
aWT12InZLsQ,10230000,11720000,daughter Lupita anyway let me go put these little motherfuckers down cuz they
aWT12InZLsQ,11720000,11730000,these little motherfuckers down cuz they
aWT12InZLsQ,11730000,14689000,these little motherfuckers down cuz they heavy anyway so I got three kids I know
aWT12InZLsQ,14689000,14699000,heavy anyway so I got three kids I know
aWT12InZLsQ,14699000,16249000,heavy anyway so I got three kids I know you already know that but I actually got
aWT12InZLsQ,16249000,16259000,you already know that but I actually got
aWT12InZLsQ,16259000,18560000,you already know that but I actually got three yo these no more fuckers look
aWT12InZLsQ,18560000,18570000,three yo these no more fuckers look
aWT12InZLsQ,18570000,19999000,three yo these no more fuckers look hungry when you posed to get your food
aWT12InZLsQ,19999000,20009000,hungry when you posed to get your food
aWT12InZLsQ,20009000,22730000,hungry when you posed to get your food stamps don't worry about that anyway
aWT12InZLsQ,22730000,22740000,stamps don't worry about that anyway
aWT12InZLsQ,22740000,24800000,stamps don't worry about that anyway my other son Juan Carlos Jimenez and my
aWT12InZLsQ,24800000,24810000,my other son Juan Carlos Jimenez and my
aWT12InZLsQ,24810000,27349000,my other son Juan Carlos Jimenez and my penis con solid what happened was one
aWT12InZLsQ,27349000,27359000,penis con solid what happened was one
aWT12InZLsQ,27359000,29239000,penis con solid what happened was one day I got tired of him cry so I put him
aWT12InZLsQ,29239000,29249000,day I got tired of him cry so I put him
aWT12InZLsQ,29249000,31880000,day I got tired of him cry so I put him on top of a tree okay and then I just
aWT12InZLsQ,31880000,31890000,on top of a tree okay and then I just
aWT12InZLsQ,31890000,33410000,on top of a tree okay and then I just left him that for weeks that was three
aWT12InZLsQ,33410000,33420000,left him that for weeks that was three
aWT12InZLsQ,33420000,34910000,left him that for weeks that was three years ago so I don't know what happened
aWT12InZLsQ,34910000,34920000,years ago so I don't know what happened
aWT12InZLsQ,34920000,36560000,years ago so I don't know what happened to him you don't matter cuz his father
aWT12InZLsQ,36560000,36570000,to him you don't matter cuz his father
aWT12InZLsQ,36570000,38360000,to him you don't matter cuz his father never called me and nothing no money for
aWT12InZLsQ,38360000,38370000,never called me and nothing no money for
aWT12InZLsQ,38370000,41030000,never called me and nothing no money for top or nothing kids can you say hijo de
aWT12InZLsQ,41030000,41040000,top or nothing kids can you say hijo de
aWT12InZLsQ,41040000,49370000,top or nothing kids can you say hijo de la gran puta very good but I got to go
aWT12InZLsQ,49370000,49380000,la gran puta very good but I got to go
aWT12InZLsQ,49380000,51200000,la gran puta very good but I got to go cuz we're gonna be late
aWT12InZLsQ,51200000,51210000,cuz we're gonna be late
aWT12InZLsQ,51210000,53420000,cuz we're gonna be late yo yo what up door this your boy Matt
aWT12InZLsQ,53420000,53430000,yo yo what up door this your boy Matt
aWT12InZLsQ,53430000,55580000,yo yo what up door this your boy Matt your lookout for my new album coming out
aWT12InZLsQ,55580000,55590000,your lookout for my new album coming out
aWT12InZLsQ,55590000,58970000,your lookout for my new album coming out this summer called salt GPS anyway I
aWT12InZLsQ,58970000,58980000,this summer called salt GPS anyway I
aWT12InZLsQ,58980000,60860000,this summer called salt GPS anyway I know you late so I got you look that's
aWT12InZLsQ,60860000,60870000,know you late so I got you look that's
aWT12InZLsQ,60870000,62420000,know you late so I got you look that's what you gotta do you gonna come around
aWT12InZLsQ,62420000,62430000,what you gotta do you gonna come around
aWT12InZLsQ,62430000,64640000,what you gotta do you gonna come around BAM you gonna hit that River don't fuck
aWT12InZLsQ,64640000,64650000,BAM you gonna hit that River don't fuck
aWT12InZLsQ,64650000,67010000,BAM you gonna hit that River don't fuck up I hope you can swim anyway BAM you
aWT12InZLsQ,67010000,67020000,up I hope you can swim anyway BAM you
