id,start,end,text
2oSGqlMe2yA,412750000,415140000,spending enough time in that sense every pixelated obstacle and sexy hiking is
2oSGqlMe2yA,415140000,415150000,pixelated obstacle and sexy hiking is
2oSGqlMe2yA,415150000,434850000,pixelated obstacle and sexy hiking is real
2oSGqlMe2yA,434850000,434860000,
2oSGqlMe2yA,434860000,436680000,well I don't need to do this I don't
2oSGqlMe2yA,436680000,436690000,well I don't need to do this I don't
2oSGqlMe2yA,436690000,440490000,well I don't need to do this I don't need your fucking do this I'm bossing
2oSGqlMe2yA,440490000,440500000,need your fucking do this I'm bossing
2oSGqlMe2yA,440500000,443100000,need your fucking do this I'm bossing this and then my mind starts poking and
2oSGqlMe2yA,443100000,443110000,this and then my mind starts poking and
2oSGqlMe2yA,443110000,445410000,this and then my mind starts poking and he just fucks with my my psyche and and
2oSGqlMe2yA,445410000,445420000,he just fucks with my my psyche and and
2oSGqlMe2yA,445420000,447180000,he just fucks with my my psyche and and I don't know what to do and then I fuck
2oSGqlMe2yA,447180000,447190000,I don't know what to do and then I fuck
2oSGqlMe2yA,447190000,459510000,I don't know what to do and then I fuck up I'm in a good position anyway we're
2oSGqlMe2yA,459510000,459520000,up I'm in a good position anyway we're
2oSGqlMe2yA,459520000,460830000,up I'm in a good position anyway we're good we're good were good were good
2oSGqlMe2yA,460830000,460840000,good we're good were good were good
2oSGqlMe2yA,460840000,462360000,good we're good were good were good we're good we're good we're good we're
2oSGqlMe2yA,462360000,462370000,we're good we're good we're good we're
2oSGqlMe2yA,462370000,464550000,we're good we're good we're good we're good yeah we go there we go we're good
2oSGqlMe2yA,464550000,464560000,good yeah we go there we go we're good
2oSGqlMe2yA,464560000,465060000,good yeah we go there we go we're good we're good
2oSGqlMe2yA,465060000,465070000,we're good
2oSGqlMe2yA,465070000,468360000,we're good uh-huh you know what I've got I've got
2oSGqlMe2yA,468360000,468370000,uh-huh you know what I've got I've got
2oSGqlMe2yA,468370000,479220000,uh-huh you know what I've got I've got the technique oh no no no no no you know
2oSGqlMe2yA,479220000,479230000,the technique oh no no no no no you know
2oSGqlMe2yA,479230000,482280000,the technique oh no no no no no you know I wanted to be here I like this spot to
2oSGqlMe2yA,482280000,482290000,I wanted to be here I like this spot to
2oSGqlMe2yA,482290000,490340000,I wanted to be here I like this spot to be honest I like this fucking I like
2oSGqlMe2yA,490340000,490350000,be honest I like this fucking I like
2oSGqlMe2yA,490350000,491640000,be honest I like this fucking I like spot
2oSGqlMe2yA,491640000,491650000,spot
2oSGqlMe2yA,491650000,500250000,spot oh I don't slap you fucking whose voice
2oSGqlMe2yA,500250000,500260000,oh I don't slap you fucking whose voice
2oSGqlMe2yA,500260000,502770000,oh I don't slap you fucking whose voice is this I need to know because though I
2oSGqlMe2yA,502770000,502780000,is this I need to know because though I
2oSGqlMe2yA,502780000,504840000,is this I need to know because though I he's getting hey what's this game called
2oSGqlMe2yA,504840000,504850000,he's getting hey what's this game called
2oSGqlMe2yA,504850000,508230000,he's getting hey what's this game called get over it cool voice Bennett funny
2oSGqlMe2yA,508230000,508240000,get over it cool voice Bennett funny
2oSGqlMe2yA,508240000,512520000,get over it cool voice Bennett funny cool he's the dude who make wop as well
2oSGqlMe2yA,512520000,512530000,cool he's the dude who make wop as well
2oSGqlMe2yA,512530000,514140000,cool he's the dude who make wop as well you just saw you know he's a fucking
2oSGqlMe2yA,514140000,514150000,you just saw you know he's a fucking
2oSGqlMe2yA,514150000,517830000,you just saw you know he's a fucking pagan my man has Twitter yo yeah I cool
2oSGqlMe2yA,517830000,517840000,pagan my man has Twitter yo yeah I cool
2oSGqlMe2yA,517840000,522930000,pagan my man has Twitter yo yeah I cool I want you to @b f OD just at him saying
2oSGqlMe2yA,522930000,522940000,I want you to @b f OD just at him saying
2oSGqlMe2yA,522940000,526410000,I want you to @b f OD just at him saying your game getting over it is shit okay
2oSGqlMe2yA,526410000,526420000,your game getting over it is shit okay
2oSGqlMe2yA,526420000,529770000,your game getting over it is shit okay also your voice is shit okay you're a
2oSGqlMe2yA,529770000,529780000,also your voice is shit okay you're a
2oSGqlMe2yA,529780000,532950000,also your voice is shit okay you're a pagan he's just a dickhead like I can't
2oSGqlMe2yA,532950000,532960000,pagan he's just a dickhead like I can't
2oSGqlMe2yA,532960000,535440000,pagan he's just a dickhead like I can't I don't ever normally do shit like this
2oSGqlMe2yA,535440000,535450000,I don't ever normally do shit like this
2oSGqlMe2yA,535450000,537570000,I don't ever normally do shit like this but I'm actually fucking I'm triggered
2oSGqlMe2yA,537570000,537580000,but I'm actually fucking I'm triggered
2oSGqlMe2yA,537580000,538590000,but I'm actually fucking I'm triggered I'm fucking trigger
2oSGqlMe2yA,538590000,538600000,I'm fucking trigger
2oSGqlMe2yA,538600000,542310000,I'm fucking trigger dumb fucking game I'm just trying I just
2oSGqlMe2yA,542310000,542320000,dumb fucking game I'm just trying I just
2oSGqlMe2yA,542320000,544380000,dumb fucking game I'm just trying I just can't do anything but I I get I make
2oSGqlMe2yA,544380000,544390000,can't do anything but I I get I make
2oSGqlMe2yA,544390000,545700000,can't do anything but I I get I make sick progress
2oSGqlMe2yA,545700000,545710000,sick progress
2oSGqlMe2yA,545710000,549570000,sick progress I do bit and then he starts shining Tom
2oSGqlMe2yA,549570000,549580000,I do bit and then he starts shining Tom
2oSGqlMe2yA,549580000,552540000,I do bit and then he starts shining Tom sit and pisses me off
2oSGqlMe2yA,552540000,552550000,sit and pisses me off
2oSGqlMe2yA,552550000,556770000,sit and pisses me off ah whoa he's a troll he's trolling me
2oSGqlMe2yA,556770000,556780000,ah whoa he's a troll he's trolling me
2oSGqlMe2yA,556780000,558960000,ah whoa he's a troll he's trolling me man I can't why am I playing this game
2oSGqlMe2yA,558960000,558970000,man I can't why am I playing this game
2oSGqlMe2yA,558970000,559590000,man I can't why am I playing this game bro
2oSGqlMe2yA,559590000,559600000,bro
2oSGqlMe2yA,559600000,561060000,bro you know you've got me a lonely person
2oSGqlMe2yA,561060000,561070000,you know you've got me a lonely person
2oSGqlMe2yA,561070000,563160000,you know you've got me a lonely person to make a game like this no friends and
2oSGqlMe2yA,563160000,563170000,to make a game like this no friends and
2oSGqlMe2yA,563170000,568069000,to make a game like this no friends and just enjoy misery
2oSGqlMe2yA,568069000,568079000,
2oSGqlMe2yA,568079000,570629000,see look the music Stockman bro
2oSGqlMe2yA,570629000,570639000,see look the music Stockman bro
2oSGqlMe2yA,570639000,573629000,see look the music Stockman bro not the music is helping fan the music
2oSGqlMe2yA,573629000,573639000,not the music is helping fan the music
2oSGqlMe2yA,573639000,587160000,not the music is helping fan the music is helping it's helping fucking Buffett
2oSGqlMe2yA,587160000,587170000,is helping it's helping fucking Buffett
2oSGqlMe2yA,587170000,591240000,is helping it's helping fucking Buffett I can't be bothered why my it's fucking
2oSGqlMe2yA,591240000,591250000,I can't be bothered why my it's fucking
2oSGqlMe2yA,591250000,603389000,I can't be bothered why my it's fucking trash it's pure trash fucking hell
2oSGqlMe2yA,603389000,603399000,trash it's pure trash fucking hell
2oSGqlMe2yA,603399000,605040000,trash it's pure trash fucking hell what's the fucking point what's the
2oSGqlMe2yA,605040000,605050000,what's the fucking point what's the
2oSGqlMe2yA,605050000,639269000,what's the fucking point what's the fucking point shit game I had before
2oSGqlMe2yA,639269000,639279000,fucking point shit game I had before
2oSGqlMe2yA,639279000,652889000,fucking point shit game I had before that's the deal CS lewis trash trash get
2oSGqlMe2yA,652889000,652899000,that's the deal CS lewis trash trash get
2oSGqlMe2yA,652899000,655530000,that's the deal CS lewis trash trash get that ass banned fuck that I calmed about
2oSGqlMe2yA,655530000,655540000,that ass banned fuck that I calmed about
2oSGqlMe2yA,655540000,657689000,that ass banned fuck that I calmed about it I'm done I'm done I'm done boy I
2oSGqlMe2yA,657689000,657699000,it I'm done I'm done I'm done boy I
2oSGqlMe2yA,657699000,659850000,it I'm done I'm done I'm done boy I can't play this game if my mind is gonna
2oSGqlMe2yA,659850000,659860000,can't play this game if my mind is gonna
2oSGqlMe2yA,659860000,661410000,can't play this game if my mind is gonna be talking every time I fail if I
2oSGqlMe2yA,661410000,661420000,be talking every time I fail if I
2oSGqlMe2yA,661420000,663870000,be talking every time I fail if I succeed he talks if I barely talk oh
2oSGqlMe2yA,663870000,663880000,succeed he talks if I barely talk oh
2oSGqlMe2yA,663880000,679200000,succeed he talks if I barely talk oh shut up man it's so shit so shit oh fuck
2oSGqlMe2yA,679200000,679210000,
2oSGqlMe2yA,679210000,691510000,[Music]
2oSGqlMe2yA,691510000,691520000,[Music]
2oSGqlMe2yA,691520000,695240000,[Music] No
2oSGqlMe2yA,695240000,695250000,
2oSGqlMe2yA,695250000,701299000,[Music]
avmG0UKSUNw,30000,3530000,Hey the answer to America tool to unlock
avmG0UKSUNw,3530000,3540000,Hey the answer to America tool to unlock
avmG0UKSUNw,3540000,15499000,Hey the answer to America tool to unlock a male copy sir hey Nobita judo get the
avmG0UKSUNw,15499000,15509000,a male copy sir hey Nobita judo get the
avmG0UKSUNw,15509000,17570000,a male copy sir hey Nobita judo get the package would not only promise promise
avmG0UKSUNw,17570000,17580000,package would not only promise promise
avmG0UKSUNw,17580000,22160000,package would not only promise promise you but you do not do me to take it with
avmG0UKSUNw,22160000,22170000,you but you do not do me to take it with
avmG0UKSUNw,22170000,27189000,you but you do not do me to take it with me however me to thingy do mu / no
avmG0UKSUNw,27189000,27199000,me however me to thingy do mu / no
avmG0UKSUNw,27199000,30529000,me however me to thingy do mu / no merito condom licking mommy condom Lena
avmG0UKSUNw,30529000,30539000,merito condom licking mommy condom Lena
avmG0UKSUNw,30539000,34549000,merito condom licking mommy condom Lena episode oh no Donna I'm in Bali badnik
avmG0UKSUNw,34549000,34559000,episode oh no Donna I'm in Bali badnik
avmG0UKSUNw,34559000,38150000,episode oh no Donna I'm in Bali badnik on the media in Uganda Kadir calculated
avmG0UKSUNw,38150000,38160000,on the media in Uganda Kadir calculated
avmG0UKSUNw,38160000,44540000,on the media in Uganda Kadir calculated a condom condom condom condom condom no
avmG0UKSUNw,44540000,44550000,a condom condom condom condom condom no
avmG0UKSUNw,44550000,44900000,a condom condom condom condom condom no me
avmG0UKSUNw,44900000,44910000,me
avmG0UKSUNw,44910000,55490000,me righto get going to Manila was Ricky
avmG0UKSUNw,55490000,55500000,
avmG0UKSUNw,55500000,60480000,made it is muddy food here Laura
i-v-OtlDdio,60000,4670000,let's talk about music I dig blues music
i-v-OtlDdio,4670000,4680000,let's talk about music I dig blues music
i-v-OtlDdio,4680000,10430000,let's talk about music I dig blues music we don't like children's music know what
i-v-OtlDdio,10430000,10440000,we don't like children's music know what
i-v-OtlDdio,10440000,15259000,we don't like children's music know what music are you into I like this it's very
i-v-OtlDdio,15259000,15269000,music are you into I like this it's very
i-v-OtlDdio,15269000,21740000,music are you into I like this it's very grown-up sorry the side whatever be tiny
i-v-OtlDdio,21740000,21750000,grown-up sorry the side whatever be tiny
i-v-OtlDdio,21750000,26480000,grown-up sorry the side whatever be tiny lady put hair by bein up the army you be
i-v-OtlDdio,26480000,26490000,lady put hair by bein up the army you be
i-v-OtlDdio,26490000,34220000,lady put hair by bein up the army you be the what
i-v-OtlDdio,34220000,34230000,
i-v-OtlDdio,34230000,39970000,[Music]
i-v-OtlDdio,39970000,39980000,
i-v-OtlDdio,39980000,42980000,you
s0RAJWd8T3s,30000,1910000,yeah well so quick you silent celebrity
s0RAJWd8T3s,1910000,1920000,yeah well so quick you silent celebrity
s0RAJWd8T3s,1920000,3379000,yeah well so quick you silent celebrity how we were doing that today we're gonna
s0RAJWd8T3s,3379000,3389000,how we were doing that today we're gonna
s0RAJWd8T3s,3389000,6650000,how we were doing that today we're gonna be going on a bit of a roadblock yes
s0RAJWd8T3s,6650000,6660000,be going on a bit of a roadblock yes
s0RAJWd8T3s,6660000,9620000,be going on a bit of a roadblock yes we're going all the way back to 2012 KS
s0RAJWd8T3s,9620000,9630000,we're going all the way back to 2012 KS
s0RAJWd8T3s,9630000,12950000,we're going all the way back to 2012 KS side the naive eating your boy doing
s0RAJWd8T3s,12950000,12960000,side the naive eating your boy doing
s0RAJWd8T3s,12960000,14060000,side the naive eating your boy doing dumb shit
s0RAJWd8T3s,14060000,14070000,dumb shit
s0RAJWd8T3s,14070000,18500000,dumb shit filming tom shit and essentially being a
s0RAJWd8T3s,18500000,18510000,filming tom shit and essentially being a
s0RAJWd8T3s,18510000,20300000,filming tom shit and essentially being a top she's I don't know if he can
s0RAJWd8T3s,20300000,20310000,top she's I don't know if he can
s0RAJWd8T3s,20310000,22730000,top she's I don't know if he can remember but way back in like 2011
s0RAJWd8T3s,22730000,22740000,remember but way back in like 2011
s0RAJWd8T3s,22740000,26120000,remember but way back in like 2011 I did a series called being dizzy
s0RAJWd8T3s,26120000,26130000,I did a series called being dizzy
s0RAJWd8T3s,26130000,28160000,I did a series called being dizzy why do you ever mushroom on your head a
s0RAJWd8T3s,28160000,28170000,why do you ever mushroom on your head a
s0RAJWd8T3s,28170000,31759000,why do you ever mushroom on your head a mushroom yeah oh it's your hair sorry No
s0RAJWd8T3s,31759000,31769000,mushroom yeah oh it's your hair sorry No
s0RAJWd8T3s,31769000,33650000,mushroom yeah oh it's your hair sorry No so this was a character I would play
s0RAJWd8T3s,33650000,33660000,so this was a character I would play
s0RAJWd8T3s,33660000,36170000,so this was a character I would play where I would be awkward towards people
s0RAJWd8T3s,36170000,36180000,where I would be awkward towards people
s0RAJWd8T3s,36180000,40930000,where I would be awkward towards people in public and essentially do you shave
s0RAJWd8T3s,40930000,40940000,in public and essentially do you shave
s0RAJWd8T3s,40940000,51770000,in public and essentially do you shave your pubes can you get your tits oh no
s0RAJWd8T3s,51770000,51780000,your pubes can you get your tits oh no
s0RAJWd8T3s,51780000,57319000,your pubes can you get your tits oh no yeah so give the people what they want
s0RAJWd8T3s,57319000,57329000,yeah so give the people what they want
s0RAJWd8T3s,57329000,60410000,yeah so give the people what they want so this video being awkward at Eurogamer
s0RAJWd8T3s,60410000,60420000,so this video being awkward at Eurogamer
s0RAJWd8T3s,60420000,64219000,so this video being awkward at Eurogamer it copies use copy like but it also got
s0RAJWd8T3s,64219000,64229000,it copies use copy like but it also got
s0RAJWd8T3s,64229000,67280000,it copies use copy like but it also got me into a world of trouble article after
s0RAJWd8T3s,67280000,67290000,me into a world of trouble article after
s0RAJWd8T3s,67290000,70820000,me into a world of trouble article after article sexual harassment this misogyny
s0RAJWd8T3s,70820000,70830000,article sexual harassment this misogyny
s0RAJWd8T3s,70830000,73840000,article sexual harassment this misogyny that I was getting annihilated from oh
s0RAJWd8T3s,73840000,73850000,that I was getting annihilated from oh
s0RAJWd8T3s,73850000,77179000,that I was getting annihilated from oh god are you actually going to so much
s0RAJWd8T3s,77179000,77189000,god are you actually going to so much
s0RAJWd8T3s,77189000,79880000,god are you actually going to so much trouble but they banned me from the
s0RAJWd8T3s,79880000,79890000,trouble but they banned me from the
s0RAJWd8T3s,79890000,80510000,trouble but they banned me from the event
s0RAJWd8T3s,80510000,80520000,event
s0RAJWd8T3s,80520000,82520000,event I also bad booth babes for some reason
s0RAJWd8T3s,82520000,82530000,I also bad booth babes for some reason
s0RAJWd8T3s,82530000,84620000,I also bad booth babes for some reason so I guess you can thank me for that
s0RAJWd8T3s,84620000,84630000,so I guess you can thank me for that
s0RAJWd8T3s,84630000,86800000,so I guess you can thank me for that [Music]
s0RAJWd8T3s,86800000,86810000,[Music]
s0RAJWd8T3s,86810000,89300000,[Music] well yeah all these news websites
s0RAJWd8T3s,89300000,89310000,well yeah all these news websites
s0RAJWd8T3s,89310000,91969000,well yeah all these news websites literally had me by the balls and
s0RAJWd8T3s,91969000,91979000,literally had me by the balls and
s0RAJWd8T3s,91979000,94399000,literally had me by the balls and rightly so this video I'm about to react
s0RAJWd8T3s,94399000,94409000,rightly so this video I'm about to react
s0RAJWd8T3s,94409000,99020000,rightly so this video I'm about to react to it's really bad so bad it's not even
s0RAJWd8T3s,99020000,99030000,to it's really bad so bad it's not even
s0RAJWd8T3s,99030000,101450000,to it's really bad so bad it's not even on my channel anymore but it's still on
s0RAJWd8T3s,101450000,101460000,on my channel anymore but it's still on
s0RAJWd8T3s,101460000,103760000,on my channel anymore but it's still on YouTube as whatever you Barney internet
s0RAJWd8T3s,103760000,103770000,YouTube as whatever you Barney internet
s0RAJWd8T3s,103770000,105740000,YouTube as whatever you Barney internet stays on the Internet
s0RAJWd8T3s,105740000,105750000,stays on the Internet
s0RAJWd8T3s,105750000,108920000,stays on the Internet three billion views for fuck's sake
s0RAJWd8T3s,108920000,108930000,three billion views for fuck's sake
s0RAJWd8T3s,108930000,110450000,three billion views for fuck's sake what was the point of me taking down the
s0RAJWd8T3s,110450000,110460000,what was the point of me taking down the
s0RAJWd8T3s,110460000,113359000,what was the point of me taking down the video if someone it's just gonna reload
s0RAJWd8T3s,113359000,113369000,video if someone it's just gonna reload
s0RAJWd8T3s,113369000,114980000,video if someone it's just gonna reload it and get paid for it
s0RAJWd8T3s,114980000,114990000,it and get paid for it
s0RAJWd8T3s,114990000,116420000,it and get paid for it in a while since I've seen this video
s0RAJWd8T3s,116420000,116430000,in a while since I've seen this video
s0RAJWd8T3s,116430000,118039000,in a while since I've seen this video it's actually been several years since
s0RAJWd8T3s,118039000,118049000,it's actually been several years since
s0RAJWd8T3s,118049000,121649000,it's actually been several years since I've seen this video so but I do
s0RAJWd8T3s,121649000,121659000,I've seen this video so but I do
s0RAJWd8T3s,121659000,124319000,I've seen this video so but I do watch hey guys you're working solo GWT
s0RAJWd8T3s,124319000,124329000,watch hey guys you're working solo GWT
s0RAJWd8T3s,124329000,129029000,watch hey guys you're working solo GWT and today I'm with massive tits classic
s0RAJWd8T3s,129029000,129039000,and today I'm with massive tits classic
s0RAJWd8T3s,129039000,132300000,and today I'm with massive tits classic ksi what's her name it doesn't matter
s0RAJWd8T3s,132300000,132310000,ksi what's her name it doesn't matter
s0RAJWd8T3s,132310000,136490000,ksi what's her name it doesn't matter she's complete it's color that yeah yeah
s0RAJWd8T3s,136490000,136500000,she's complete it's color that yeah yeah
s0RAJWd8T3s,136500000,139920000,she's complete it's color that yeah yeah I guess that's was such an e number one
s0RAJWd8T3s,139920000,139930000,I guess that's was such an e number one
s0RAJWd8T3s,139930000,142620000,I guess that's was such an e number one actually real quick what the fuck is on
s0RAJWd8T3s,142620000,142630000,actually real quick what the fuck is on
s0RAJWd8T3s,142630000,145920000,actually real quick what the fuck is on my head
s0RAJWd8T3s,145920000,145930000,
s0RAJWd8T3s,145930000,147479000,funny thing is I was actually a virgin
s0RAJWd8T3s,147479000,147489000,funny thing is I was actually a virgin
s0RAJWd8T3s,147489000,153210000,funny thing is I was actually a virgin at the time of this video the age of 12
s0RAJWd8T3s,153210000,153220000,at the time of this video the age of 12
s0RAJWd8T3s,153220000,156330000,at the time of this video the age of 12 literally it's ridiculous most of the
s0RAJWd8T3s,156330000,156340000,literally it's ridiculous most of the
s0RAJWd8T3s,156340000,158130000,literally it's ridiculous most of the ghosts I meet nowadays tell me that they
s0RAJWd8T3s,158130000,158140000,ghosts I meet nowadays tell me that they
s0RAJWd8T3s,158140000,159900000,ghosts I meet nowadays tell me that they lost their virginity when they're like
s0RAJWd8T3s,159900000,159910000,lost their virginity when they're like
s0RAJWd8T3s,159910000,163229000,lost their virginity when they're like 14 or 15 and I'm like what the fuck are
s0RAJWd8T3s,163229000,163239000,14 or 15 and I'm like what the fuck are
s0RAJWd8T3s,163239000,165750000,14 or 15 and I'm like what the fuck are you doing spreading your legs at that
s0RAJWd8T3s,165750000,165760000,you doing spreading your legs at that
s0RAJWd8T3s,165760000,167280000,you doing spreading your legs at that age you know what I was doing at that
s0RAJWd8T3s,167280000,167290000,age you know what I was doing at that
s0RAJWd8T3s,167290000,170009000,age you know what I was doing at that age and that age I was busy not knowing
s0RAJWd8T3s,170009000,170019000,age and that age I was busy not knowing
s0RAJWd8T3s,170019000,171780000,age and that age I was busy not knowing what a vagina was because I was
s0RAJWd8T3s,171780000,171790000,what a vagina was because I was
s0RAJWd8T3s,171790000,173640000,what a vagina was because I was introverted and I didn't know how to
s0RAJWd8T3s,173640000,173650000,introverted and I didn't know how to
s0RAJWd8T3s,173650000,178880000,introverted and I didn't know how to talk to girls so so yeah also beyblade
s0RAJWd8T3s,178880000,178890000,talk to girls so so yeah also beyblade
s0RAJWd8T3s,178890000,181740000,talk to girls so so yeah also beyblade love beyblade fuck man
s0RAJWd8T3s,181740000,181750000,love beyblade fuck man
s0RAJWd8T3s,181750000,185580000,love beyblade fuck man I miss the house so badly can i moan
s0RAJWd8T3s,185580000,185590000,I miss the house so badly can i moan
s0RAJWd8T3s,185590000,193310000,I miss the house so badly can i moan about you yeah right now
s0RAJWd8T3s,193310000,193320000,
s0RAJWd8T3s,193320000,196350000,no big enough not big enough
s0RAJWd8T3s,196350000,196360000,no big enough not big enough
s0RAJWd8T3s,196360000,198810000,no big enough not big enough bitch I leave now snow might leave
s0RAJWd8T3s,198810000,198820000,bitch I leave now snow might leave
s0RAJWd8T3s,198820000,200850000,bitch I leave now snow might leave something on your face though Jesus
s0RAJWd8T3s,200850000,200860000,something on your face though Jesus
s0RAJWd8T3s,200860000,202460000,something on your face though Jesus Christ
s0RAJWd8T3s,202460000,202470000,Christ
s0RAJWd8T3s,202470000,205920000,Christ well I call her a bitch that's misogyny
s0RAJWd8T3s,205920000,205930000,well I call her a bitch that's misogyny
s0RAJWd8T3s,205930000,208500000,well I call her a bitch that's misogyny number two I'm implying that I'm gonna
s0RAJWd8T3s,208500000,208510000,number two I'm implying that I'm gonna
s0RAJWd8T3s,208510000,214830000,number two I'm implying that I'm gonna put some bodily fluids I so what's your
s0RAJWd8T3s,214830000,214840000,put some bodily fluids I so what's your
s0RAJWd8T3s,214840000,220860000,put some bodily fluids I so what's your favorite CD I'm implying that's so
s0RAJWd8T3s,220860000,220870000,favorite CD I'm implying that's so
s0RAJWd8T3s,220870000,222960000,favorite CD I'm implying that's so that's so that's what's actually done
s0RAJWd8T3s,222960000,222970000,that's so that's what's actually done
s0RAJWd8T3s,222970000,226880000,that's so that's what's actually done before fucking hell definitely media
s0RAJWd8T3s,226880000,226890000,before fucking hell definitely media
s0RAJWd8T3s,226890000,232680000,before fucking hell definitely media because you already have it like such a
s0RAJWd8T3s,232680000,232690000,because you already have it like such a
s0RAJWd8T3s,232690000,236040000,because you already have it like such a muffin well you know I just got old
s0RAJWd8T3s,236040000,236050000,muffin well you know I just got old
s0RAJWd8T3s,236050000,238800000,muffin well you know I just got old right you mean the costume yeah have
s0RAJWd8T3s,238800000,238810000,right you mean the costume yeah have
s0RAJWd8T3s,238810000,243740000,right you mean the costume yeah have your tits gone where'd the God this
s0RAJWd8T3s,243740000,243750000,
s0RAJWd8T3s,243750000,266800000,because I can't see them
s0RAJWd8T3s,266800000,266810000,
s0RAJWd8T3s,266810000,269480000,how can I say that how can I actually
s0RAJWd8T3s,269480000,269490000,how can I say that how can I actually
s0RAJWd8T3s,269490000,272420000,how can I say that how can I actually say that oh my god what are you doing Oh
s0RAJWd8T3s,272420000,272430000,say that oh my god what are you doing Oh
