id,start,end,text
XOCwt6k-Nx4,439000,4490000,the world is a dark place and I'm so
XOCwt6k-Nx4,4490000,4500000,the world is a dark place and I'm so
XOCwt6k-Nx4,4500000,9110000,the world is a dark place and I'm so sorry there are certain things in life
XOCwt6k-Nx4,9110000,9120000,sorry there are certain things in life
XOCwt6k-Nx4,9120000,12650000,sorry there are certain things in life that should never see the light of day
XOCwt6k-Nx4,12650000,12660000,that should never see the light of day
XOCwt6k-Nx4,12660000,14870000,that should never see the light of day things that go against our ethics our
XOCwt6k-Nx4,14870000,14880000,things that go against our ethics our
XOCwt6k-Nx4,14880000,18170000,things that go against our ethics our beliefs things that go against humanity
XOCwt6k-Nx4,18170000,18180000,beliefs things that go against humanity
XOCwt6k-Nx4,18180000,21620000,beliefs things that go against humanity no matter what some things should be
XOCwt6k-Nx4,21620000,21630000,no matter what some things should be
XOCwt6k-Nx4,21630000,25700000,no matter what some things should be kept hidden forever until now because
XOCwt6k-Nx4,25700000,25710000,kept hidden forever until now because
XOCwt6k-Nx4,25710000,28250000,kept hidden forever until now because today I'm gonna show you something that
XOCwt6k-Nx4,28250000,28260000,today I'm gonna show you something that
XOCwt6k-Nx4,28260000,30950000,today I'm gonna show you something that the world needs to see and nobody can
XOCwt6k-Nx4,30950000,30960000,the world needs to see and nobody can
XOCwt6k-Nx4,30960000,31790000,the world needs to see and nobody can stop me
XOCwt6k-Nx4,31790000,31800000,stop me
XOCwt6k-Nx4,31800000,33680000,stop me organizations and governments from all
XOCwt6k-Nx4,33680000,33690000,organizations and governments from all
XOCwt6k-Nx4,33690000,35540000,organizations and governments from all over the world have been calling me and
XOCwt6k-Nx4,35540000,35550000,over the world have been calling me and
XOCwt6k-Nx4,35550000,37190000,over the world have been calling me and now this is simply not the way God
XOCwt6k-Nx4,37190000,37200000,now this is simply not the way God
XOCwt6k-Nx4,37200000,39650000,now this is simply not the way God intended it to be try some putrid
XOCwt6k-Nx4,39650000,39660000,intended it to be try some putrid
XOCwt6k-Nx4,39660000,49940000,intended it to be try some putrid biomedical research moms churches and
XOCwt6k-Nx4,49940000,49950000,biomedical research moms churches and
XOCwt6k-Nx4,49950000,52520000,biomedical research moms churches and even radical terrorist groups have come
XOCwt6k-Nx4,52520000,52530000,even radical terrorist groups have come
XOCwt6k-Nx4,52530000,54529000,even radical terrorist groups have come together to protest against the sudden
XOCwt6k-Nx4,54529000,54539000,together to protest against the sudden
XOCwt6k-Nx4,54539000,58040000,together to protest against the sudden ethical act I am so sorry
XOCwt6k-Nx4,58040000,58050000,ethical act I am so sorry
XOCwt6k-Nx4,58050000,61760000,ethical act I am so sorry hi Francis of the filth have discovered
XOCwt6k-Nx4,61760000,61770000,hi Francis of the filth have discovered
XOCwt6k-Nx4,61770000,65920000,hi Francis of the filth have discovered the final ingredient to make the perfect
XOCwt6k-Nx4,65920000,65930000,the final ingredient to make the perfect
XOCwt6k-Nx4,65930000,69500000,the final ingredient to make the perfect ramen known to mankind and the final
XOCwt6k-Nx4,69500000,69510000,ramen known to mankind and the final
XOCwt6k-Nx4,69510000,74870000,ramen known to mankind and the final ingredients the final ingredient is
XOCwt6k-Nx4,74870000,74880000,ingredients the final ingredient is
XOCwt6k-Nx4,74880000,78859000,ingredients the final ingredient is human and today we are going to test
XOCwt6k-Nx4,78859000,78869000,human and today we are going to test
XOCwt6k-Nx4,78869000,81140000,human and today we are going to test this theory and I will volunteer myself
XOCwt6k-Nx4,81140000,81150000,this theory and I will volunteer myself
XOCwt6k-Nx4,81150000,83810000,this theory and I will volunteer myself as the final ingredients it's not about
XOCwt6k-Nx4,83810000,83820000,as the final ingredients it's not about
XOCwt6k-Nx4,83820000,85789000,as the final ingredients it's not about whether we should do it or not it's
XOCwt6k-Nx4,85789000,85799000,whether we should do it or not it's
XOCwt6k-Nx4,85799000,91760000,whether we should do it or not it's about whether we can do it or not it's
XOCwt6k-Nx4,91760000,91770000,about whether we can do it or not it's
XOCwt6k-Nx4,91770000,93560000,about whether we can do it or not it's time to go to the laundry room and
XOCwt6k-Nx4,93560000,93570000,time to go to the laundry room and
XOCwt6k-Nx4,93570000,99920000,time to go to the laundry room and prepare the ramen hey how's M us sure
XOCwt6k-Nx4,99920000,99930000,prepare the ramen hey how's M us sure
XOCwt6k-Nx4,99930000,106000000,prepare the ramen hey how's M us sure I see you this man top-notch oh yeah
XOCwt6k-Nx4,106000000,106010000,I see you this man top-notch oh yeah
XOCwt6k-Nx4,106010000,109010000,I see you this man top-notch oh yeah still masturbate while eating top ramen
XOCwt6k-Nx4,109010000,109020000,still masturbate while eating top ramen
XOCwt6k-Nx4,109020000,111050000,still masturbate while eating top ramen at a fast rate and the bigger quantities
XOCwt6k-Nx4,111050000,111060000,at a fast rate and the bigger quantities
XOCwt6k-Nx4,111060000,112760000,at a fast rate and the bigger quantities accounts as rape when I'm slurping at
XOCwt6k-Nx4,112760000,112770000,accounts as rape when I'm slurping at
XOCwt6k-Nx4,112770000,175620000,accounts as rape when I'm slurping at this unbelievable
XOCwt6k-Nx4,175620000,175630000,
XOCwt6k-Nx4,175630000,178570000,we have a bunch of ramen there's about
XOCwt6k-Nx4,178570000,178580000,we have a bunch of ramen there's about
XOCwt6k-Nx4,178580000,182140000,we have a bunch of ramen there's about 40 packets hello we're gonna we're gonna
XOCwt6k-Nx4,182140000,182150000,40 packets hello we're gonna we're gonna
XOCwt6k-Nx4,182150000,244180000,40 packets hello we're gonna we're gonna make some beautiful now you're all
XOCwt6k-Nx4,244180000,244190000,make some beautiful now you're all
XOCwt6k-Nx4,244190000,247390000,make some beautiful now you're all probably wondering why now why are you
XOCwt6k-Nx4,247390000,247400000,probably wondering why now why are you
XOCwt6k-Nx4,247400000,250840000,probably wondering why now why are you the no no seasonings of sauces
XOCwt6k-Nx4,250840000,250850000,the no no seasonings of sauces
XOCwt6k-Nx4,250850000,256010000,the no no seasonings of sauces give me the soft bits what
XOCwt6k-Nx4,256010000,256020000,give me the soft bits what
XOCwt6k-Nx4,256020000,263970000,give me the soft bits what oh yeah this swirl because stuck at ease
XOCwt6k-Nx4,263970000,263980000,
XOCwt6k-Nx4,263980000,272300000,oh yeah
XOCwt6k-Nx4,272300000,272310000,
XOCwt6k-Nx4,272310000,277160000,I'm Bon Appetit
XOCwt6k-Nx4,277160000,277170000,
XOCwt6k-Nx4,277170000,280970000,and you see what good is the meat
XOCwt6k-Nx4,280970000,280980000,and you see what good is the meat
XOCwt6k-Nx4,280980000,285870000,and you see what good is the meat without a little seasoning you see that
XOCwt6k-Nx4,285870000,285880000,without a little seasoning you see that
XOCwt6k-Nx4,285880000,288600000,without a little seasoning you see that give that nigga good old Robin give that
XOCwt6k-Nx4,288600000,288610000,give that nigga good old Robin give that
XOCwt6k-Nx4,288610000,292470000,give that nigga good old Robin give that like a good old Rob yes yeah okay we
XOCwt6k-Nx4,292470000,292480000,like a good old Rob yes yeah okay we
XOCwt6k-Nx4,292480000,294960000,like a good old Rob yes yeah okay we gotta get back data good old Robin give
XOCwt6k-Nx4,294960000,294970000,gotta get back data good old Robin give
XOCwt6k-Nx4,294970000,297000000,gotta get back data good old Robin give that man a good old Rob you know season
XOCwt6k-Nx4,297000000,297010000,that man a good old Rob you know season
XOCwt6k-Nx4,297010000,299010000,that man a good old Rob you know season the legs season the legs just a little
XOCwt6k-Nx4,299010000,299020000,the legs season the legs just a little
XOCwt6k-Nx4,299020000,300330000,the legs season the legs just a little bit I don't even know what the fuck this
XOCwt6k-Nx4,300330000,300340000,bit I don't even know what the fuck this
XOCwt6k-Nx4,300340000,331740000,bit I don't even know what the fuck this show is anymore honestly vegetables kids
XOCwt6k-Nx4,331740000,331750000,show is anymore honestly vegetables kids
XOCwt6k-Nx4,331750000,340500000,show is anymore honestly vegetables kids you got it I think that's that's all the
XOCwt6k-Nx4,340500000,340510000,you got it I think that's that's all the
XOCwt6k-Nx4,340510000,342660000,you got it I think that's that's all the vegetables we use for now because your
XOCwt6k-Nx4,342660000,342670000,vegetables we use for now because your
XOCwt6k-Nx4,342670000,344340000,vegetables we use for now because your once you make vegetables me Rhonda you
XOCwt6k-Nx4,344340000,344350000,once you make vegetables me Rhonda you
XOCwt6k-Nx4,344350000,345090000,once you make vegetables me Rhonda you know what I'm saying
XOCwt6k-Nx4,345090000,345100000,know what I'm saying
XOCwt6k-Nx4,345100000,355090000,know what I'm saying what's no fuck motherfucking leeks
XOCwt6k-Nx4,355090000,355100000,
XOCwt6k-Nx4,355100000,357490000,I'm Robin King this is how you make a
XOCwt6k-Nx4,357490000,357500000,I'm Robin King this is how you make a
XOCwt6k-Nx4,357500000,361680000,I'm Robin King this is how you make a perfect human ramen the noodles the sows
XOCwt6k-Nx4,361680000,361690000,perfect human ramen the noodles the sows
XOCwt6k-Nx4,361690000,366010000,perfect human ramen the noodles the sows the vegetables and the meat no you got
XOCwt6k-Nx4,366010000,366020000,the vegetables and the meat no you got
XOCwt6k-Nx4,366020000,366310000,the vegetables and the meat no you got it
XOCwt6k-Nx4,366310000,366320000,it
XOCwt6k-Nx4,366320000,371920000,it you have to get the juices flowing can I
XOCwt6k-Nx4,371920000,371930000,you have to get the juices flowing can I
XOCwt6k-Nx4,371930000,402059000,you have to get the juices flowing can I let the chef do the taster
XOCwt6k-Nx4,402059000,402069000,
XOCwt6k-Nx4,402069000,417480000,this is by far the absolute
XOCwt6k-Nx4,417480000,417490000,
XOCwt6k-Nx4,417490000,429649000,under the Broadway
XOCwt6k-Nx4,429649000,429659000,
XOCwt6k-Nx4,429659000,432390000,this is best and Robin I've ever had so
XOCwt6k-Nx4,432390000,432400000,this is best and Robin I've ever had so
XOCwt6k-Nx4,432400000,434100000,this is best and Robin I've ever had so we got a cold Gordon Ramsay for this one
XOCwt6k-Nx4,434100000,434110000,we got a cold Gordon Ramsay for this one
XOCwt6k-Nx4,434110000,438439000,we got a cold Gordon Ramsay for this one go to Ramsay I'm coming for you buddy
XOCwt6k-Nx4,438439000,438449000,go to Ramsay I'm coming for you buddy
XOCwt6k-Nx4,438449000,441059000,go to Ramsay I'm coming for you buddy Jamie Oliver I'm coming for you
XOCwt6k-Nx4,441059000,441069000,Jamie Oliver I'm coming for you
XOCwt6k-Nx4,441069000,443490000,Jamie Oliver I'm coming for you Paula Deen I'm coming it's Paula Deen
XOCwt6k-Nx4,443490000,443500000,Paula Deen I'm coming it's Paula Deen
XOCwt6k-Nx4,443500000,448290000,Paula Deen I'm coming it's Paula Deen the one with it policy I'm coming with
XOCwt6k-Nx4,448290000,448300000,the one with it policy I'm coming with
XOCwt6k-Nx4,448300000,448649000,the one with it policy I'm coming with you
XOCwt6k-Nx4,448649000,448659000,you
XOCwt6k-Nx4,448659000,450629000,you okay I'm coming for you I'm coming
XOCwt6k-Nx4,450629000,450639000,okay I'm coming for you I'm coming
XOCwt6k-Nx4,450639000,458790000,okay I'm coming for you I'm coming inside you oh hey hey girl what are you
XOCwt6k-Nx4,458790000,458800000,inside you oh hey hey girl what are you
XOCwt6k-Nx4,458800000,459179000,inside you oh hey hey girl what are you up to
XOCwt6k-Nx4,459179000,459189000,up to
XOCwt6k-Nx4,459189000,462240000,up to Oh maybe that much I'm just making
XOCwt6k-Nx4,462240000,462250000,Oh maybe that much I'm just making
XOCwt6k-Nx4,462250000,466649000,Oh maybe that much I'm just making myself into it into a beautiful ramen
XOCwt6k-Nx4,466649000,466659000,myself into it into a beautiful ramen
XOCwt6k-Nx4,466659000,470040000,myself into it into a beautiful ramen human soup you know what I'm saying baby
XOCwt6k-Nx4,470040000,470050000,human soup you know what I'm saying baby
XOCwt6k-Nx4,470050000,471749000,human soup you know what I'm saying baby oh you want some of this human ramen
XOCwt6k-Nx4,471749000,471759000,oh you want some of this human ramen
XOCwt6k-Nx4,471759000,475309000,oh you want some of this human ramen soup yeah you can come right over
XOCwt6k-Nx4,475309000,475319000,soup yeah you can come right over
XOCwt6k-Nx4,475319000,480119000,soup yeah you can come right over taste me you hear that girl that's me
XOCwt6k-Nx4,480119000,480129000,taste me you hear that girl that's me
XOCwt6k-Nx4,480129000,487820000,taste me you hear that girl that's me that's all me baby
XOCwt6k-Nx4,487820000,487830000,
XOCwt6k-Nx4,487830000,489480000,let's off me
XOCwt6k-Nx4,489480000,489490000,let's off me
XOCwt6k-Nx4,489490000,493309000,let's off me only 2007 sheet motherfucker 2006
XOCwt6k-Nx4,493309000,493319000,only 2007 sheet motherfucker 2006
XOCwt6k-Nx4,493319000,498450000,only 2007 sheet motherfucker 2006 that's only thing you don't come
XOCwt6k-Nx4,498450000,498460000,that's only thing you don't come
XOCwt6k-Nx4,498460000,500969000,that's only thing you don't come straight into this bathroom I'll see you
XOCwt6k-Nx4,500969000,500979000,straight into this bathroom I'll see you
XOCwt6k-Nx4,500979000,505649000,straight into this bathroom I'll see you in five minutes baby pictures love human
XOCwt6k-Nx4,505649000,505659000,in five minutes baby pictures love human
XOCwt6k-Nx4,505659000,508860000,in five minutes baby pictures love human ramen everybody loves human ramen and
XOCwt6k-Nx4,508860000,508870000,ramen everybody loves human ramen and
XOCwt6k-Nx4,508870000,512750000,ramen everybody loves human ramen and that's why you should be a human ramen
XOCwt6k-Nx4,512750000,512760000,that's why you should be a human ramen
XOCwt6k-Nx4,512760000,516269000,that's why you should be a human ramen the papa franku here Julie now Daniel
XOCwt6k-Nx4,516269000,516279000,the papa franku here Julie now Daniel
XOCwt6k-Nx4,516279000,521639000,the papa franku here Julie now Daniel onion motherfuckin ass I hate myself and
XOCwt6k-Nx4,521639000,521649000,onion motherfuckin ass I hate myself and
XOCwt6k-Nx4,521649000,523529000,onion motherfuckin ass I hate myself and I'm severe depression and I want to kill
XOCwt6k-Nx4,523529000,523539000,I'm severe depression and I want to kill
XOCwt6k-Nx4,523539000,527400000,I'm severe depression and I want to kill myself this is a part of the act anymore
XOCwt6k-Nx4,527400000,527410000,myself this is a part of the act anymore
XOCwt6k-Nx4,527410000,531090000,myself this is a part of the act anymore it's filthy Frank motherfucker it's
XOCwt6k-Nx4,531090000,531100000,it's filthy Frank motherfucker it's
XOCwt6k-Nx4,531100000,534660000,it's filthy Frank motherfucker it's built the brick this let's get some
XOCwt6k-Nx4,534660000,534670000,built the brick this let's get some
XOCwt6k-Nx4,534670000,537120000,built the brick this let's get some pussy tonight
xV3BKxguUoA,4410000,6410000,we were going to the final three
xV3BKxguUoA,6410000,6420000,we were going to the final three
xV3BKxguUoA,6420000,9020000,we were going to the final three together guess we're not aren't you even
xV3BKxguUoA,9020000,9030000,together guess we're not aren't you even
xV3BKxguUoA,9030000,13970000,together guess we're not aren't you even sad or BFFs yeah for the contest I mean
xV3BKxguUoA,13970000,13980000,sad or BFFs yeah for the contest I mean
xV3BKxguUoA,13980000,15049000,sad or BFFs yeah for the contest I mean it's not like we're gonna be best
xV3BKxguUoA,15049000,15059000,it's not like we're gonna be best
xV3BKxguUoA,15059000,19310000,it's not like we're gonna be best friends for life or anything believe she
xV3BKxguUoA,19310000,19320000,friends for life or anything believe she
xV3BKxguUoA,19320000,22370000,friends for life or anything believe she said that can't believe you just said
xV3BKxguUoA,22370000,22380000,said that can't believe you just said
xV3BKxguUoA,22380000,25700000,said that can't believe you just said that but we pinkie swore do you mean
xV3BKxguUoA,25700000,25710000,that but we pinkie swore do you mean
xV3BKxguUoA,25710000,28640000,that but we pinkie swore do you mean I've been helping you all this time and
xV3BKxguUoA,28640000,28650000,I've been helping you all this time and
xV3BKxguUoA,28650000,33049000,I've been helping you all this time and you didn't even like me uh truth not
xV3BKxguUoA,33049000,33059000,you didn't even like me uh truth not
xV3BKxguUoA,33059000,35959000,you didn't even like me uh truth not really know what we're not here to make
xV3BKxguUoA,35959000,35969000,really know what we're not here to make
xV3BKxguUoA,35969000,36559000,really know what we're not here to make friends
xV3BKxguUoA,36559000,36569000,friends
xV3BKxguUoA,36569000,37579000,friends we're here to become celebrities
xV3BKxguUoA,37579000,37589000,we're here to become celebrities
xV3BKxguUoA,37589000,42020000,we're here to become celebrities remember OS Colebrook oh like you're
xV3BKxguUoA,42020000,42030000,remember OS Colebrook oh like you're
xV3BKxguUoA,42030000,44270000,remember OS Colebrook oh like you're such a team player all you do is go
xV3BKxguUoA,44270000,44280000,such a team player all you do is go
xV3BKxguUoA,44280000,45889000,such a team player all you do is go around scaring the crap out of everyone
xV3BKxguUoA,45889000,45899000,around scaring the crap out of everyone
xV3BKxguUoA,45899000,48169000,around scaring the crap out of everyone at least I'm straight with people
xV3BKxguUoA,48169000,48179000,at least I'm straight with people
xV3BKxguUoA,48179000,51709000,at least I'm straight with people whatever I have invincibility no one can
xV3BKxguUoA,51709000,51719000,whatever I have invincibility no one can
xV3BKxguUoA,51719000,54500000,whatever I have invincibility no one can touch me this week
xV3BKxguUoA,54500000,54510000,touch me this week
xV3BKxguUoA,54510000,57830000,touch me this week you really are mean and all that bad
xV3BKxguUoA,57830000,57840000,you really are mean and all that bad
xV3BKxguUoA,57840000,60620000,you really are mean and all that bad stuff people say about you is true like
xV3BKxguUoA,60620000,60630000,stuff people say about you is true like
xV3BKxguUoA,60630000,62420000,stuff people say about you is true like how you're a two-faced backstabbing
xV3BKxguUoA,62420000,62430000,how you're a two-faced backstabbing
xV3BKxguUoA,62430000,68980000,how you're a two-faced backstabbing lying little
xV3BKxguUoA,68980000,68990000,
xV3BKxguUoA,68990000,71170000,I always told them they were wrong I
xV3BKxguUoA,71170000,71180000,I always told them they were wrong I
xV3BKxguUoA,71180000,73450000,I always told them they were wrong I stood up for you because I thought we
xV3BKxguUoA,73450000,73460000,stood up for you because I thought we
xV3BKxguUoA,73460000,76390000,stood up for you because I thought we were BFFs but they're right you really
xV3BKxguUoA,76390000,76400000,were BFFs but they're right you really
xV3BKxguUoA,76400000,79060000,were BFFs but they're right you really are a two-faced backstabbing lying
xV3BKxguUoA,79060000,79070000,are a two-faced backstabbing lying
xV3BKxguUoA,79070000,84719000,are a two-faced backstabbing lying little
xV3BKxguUoA,84719000,84729000,
xV3BKxguUoA,84729000,88170000,and guess what I don't want to be BFFs
xV3BKxguUoA,88170000,88180000,and guess what I don't want to be BFFs
xV3BKxguUoA,88180000,90389000,and guess what I don't want to be BFFs anymore I'd rather spend the day staring
xV3BKxguUoA,90389000,90399000,anymore I'd rather spend the day staring
xV3BKxguUoA,90399000,92880000,anymore I'd rather spend the day staring at Owens butt and shopping with you and
xV3BKxguUoA,92880000,92890000,at Owens butt and shopping with you and
xV3BKxguUoA,92890000,103919000,at Owens butt and shopping with you and PS your shoes are tacky jump in the
xV3BKxguUoA,103919000,103929000,PS your shoes are tacky jump in the
xV3BKxguUoA,103929000,114690000,PS your shoes are tacky jump in the piranhas for I don't know what came over
xV3BKxguUoA,114690000,114700000,piranhas for I don't know what came over
xV3BKxguUoA,114700000,115109000,piranhas for I don't know what came over me
xV3BKxguUoA,115109000,115119000,me
xV3BKxguUoA,115119000,120270000,me oh wait yes I do there's a total
Gc71AmT_b2k,5340000,6340000,Yeah
Gc71AmT_b2k,10220000,11280000,I must tell how I feel
Gc71AmT_b2k,12340000,13340000,Look
Gc71AmT_b2k,14200000,17920000,You are very precious when you smile
Gc71AmT_b2k,20860000,24660000,Hit the back and the Wild Market
Gc71AmT_b2k,27540000,30640000,Hey Girl . I lost myself in these eyes
Gc71AmT_b2k,30840000,33100000,In the field
Gc71AmT_b2k,34240000,37800000,I just want you to know
Gc71AmT_b2k,37800000,39440000,Mine
Gc71AmT_b2k,41060000,42520000,Hands on your body
Gc71AmT_b2k,42720000,45360000,I do not want to waste your time
Gc71AmT_b2k,47820000,49340000,Feeling like forever
Gc71AmT_b2k,49380000,51940000,Even if it is forever tonight
Gc71AmT_b2k,51940000,54280000,Just stretch out with me
Gc71AmT_b2k,54480000,57320000,Wear this night away with me
Gc71AmT_b2k,57440000,58440000,You are
Gc71AmT_b2k,58780000,60680000,Mine
Gc71AmT_b2k,61340000,62480000,I can not look away
Gc71AmT_b2k,62740000,63980000,I have to say
Gc71AmT_b2k,64460000,66860000,I'm so happy
Gc71AmT_b2k,66880000,68900000,Because you are alive
Gc71AmT_b2k,71200000,73340000,And God will do what you do
Gc71AmT_b2k,73340000,75300000,You just have to say it's true
Gc71AmT_b2k,78000000,82100000,Hey girl I'll do anything I can do to make you feel better
Gc71AmT_b2k,83220000,84620000,Oh oh oh oh
Gc71AmT_b2k,84620000,88780000,I have to tell you that you are fine
Gc71AmT_b2k,89240000,91160000,Episodes revolve around my brain
Gc71AmT_b2k,91460000,94100000,"Even in the rain, whatever you do, you will be blessed"
Gc71AmT_b2k,94100000,97580000,You are very beautiful Ante Star Camarray
Gc71AmT_b2k,98065000,100815000,This incredible feeling will turn you into a bride
Gc71AmT_b2k,100820000,102460000,you are mine
Gc71AmT_b2k,104960000,108740000,Hand on your body I do not want to waste your time
Gc71AmT_b2k,111640000,115700000,Feeling like forever so that it was forever tonight
Gc71AmT_b2k,115760000,121180000,Stay away tonight with me
Gc71AmT_b2k,121180000,123440000,you're mine
Gc71AmT_b2k,125060000,126660000,I can not look away
Gc71AmT_b2k,126660000,128120000,I have to say
vNxMR2wq3uE,5440000,6180000,"Hey Meg,"
vNxMR2wq3uE,6180000,7140000,What are you up to?
vNxMR2wq3uE,7140000,10500000,"Not much.  Just finished an angel food cake might go out to the trash,"
vNxMR2wq3uE,10599000,12480000,See if there's any possums to kiss
vNxMR2wq3uE,12480000,13559000,I was just out there
vNxMR2wq3uE,15670000,19649000,"Come on it's just senior year, somebody must be having a party or something"
vNxMR2wq3uE,19649000,22780000,"There's one, but I wasn't invited"
vNxMR2wq3uE,22780000,24400000,So what?  Go crash it!
vNxMR2wq3uE,24400000,25700000,"Nah, not my style."
vNxMR2wq3uE,25700000,27700000,And what do you care? Do you want the tv or something?
vNxMR2wq3uE,29400000,32600000,"What? No, no. I wanna see you have fun!"
vNxMR2wq3uE,32820000,36040000,"Come on. You should go. You know,  let loose a little."
vNxMR2wq3uE,36040000,39400000,You know what? You're right. Maybe I will give it a shot
vNxMR2wq3uE,39520000,44280000,"Yeah, how awkward can it be? It can't be worse than waving at someone who doesn't wave back at ya."
vNxMR2wq3uE,47820000,49200000,"No, not you!"
vNxMR2wq3uE,49200000,50180000,"Oh, sorry"
vNxMR2wq3uE,50180000,52240000,"In fact, everyone but you."
vNxMR2wq3uE,52240000,53640000,Hi everyone but him!
vNxMR2wq3uE,53680000,54260000,Hi!
vNxMR2wq3uE,55400000,56260000,(techno music plays)
vNxMR2wq3uE,67740000,71260000,All right ladies. Time. To. Mingle.
vNxMR2wq3uE,71300000,76560000,"Hey, you guys talking Big Bang over here? Big Bang Theory? No?"
vNxMR2wq3uE,76560000,79000000,Any bangers over here? No?
vNxMR2wq3uE,79460000,81180000,"Well, I've tried everything."
vNxMR2wq3uE,81180000,83200000,We just don't have anything in common with these guys.
vNxMR2wq3uE,83760000,87780000,Maybe we don't need anything in common with them.
vNxMR2wq3uE,90960000,93360000,Meg come on don't go crazy.
vNxMR2wq3uE,93360000,94280000,Damn that's hot!
vNxMR2wq3uE,97020000,98680000,That was just lucky.
vNxMR2wq3uE,98680000,99200000,"Oh, yeah?"
vNxMR2wq3uE,104040000,108889000,Wow. Megs so good at casually tossing bottles over her shoulders so they land upright!
vNxMR2wq3uE,108890000,112130000,And that's very popular right now because we've run out of things on earth
vNxMR2wq3uE,112700000,115200000,Meg that was amazing!
vNxMR2wq3uE,115200000,117700000,What can I say? I'm full of surprises!
vNxMR2wq3uE,117700000,119360000,Like the end of The Usual Suspects
vNxMR2wq3uE,125960000,129200000,*Gasp*  He was gay the whole time!
vNxMR2wq3uE,133420000,135000000,Kids! Dinner's ready!
vNxMR2wq3uE,135000000,139920000,Dinner's ready. Shut up. A little of the old schnapps sure oughta get me right.
vNxMR2wq3uE,141590000,144180000,"Aay, Chrissay!"
vNxMR2wq3uE,144180000,147729000,"Well that's delightfully informal, Meg. How the heck are ya?"
vNxMR2wq3uE,151629000,153209000,So what are you kids doing in school?
vNxMR2wq3uE,153209000,157060000,I got in trouble for saying something insensitive to trans kids.
vNxMR2wq3uE,157060000,158480000,What'd you say?
